drop table if exists gap1,gap2,gap3;
CREATE DATABASE mysqlslap;
CREATE TABLE gap1 (id1 INT, id2 INT, id3 INT, c1 INT, value INT,
PRIMARY KEY (id1, id2, id3),
INDEX i (c1)) ENGINE=memory;
CREATE TABLE gap2 like gap1;
CREATE TABLE gap3 (id INT, value INT,
PRIMARY KEY (id),
UNIQUE KEY ui(value)) ENGINE=memory;
insert into gap3 values (1,1), (2,2),(3,3),(4,4),(5,5);
create table gap4 (
pk int primary key,
a int,
b int,
key(a)
) ENGINE=memory;
insert into gap4 values (1,1,1), (2,2,2), (3,3,3), (4,4,4);
create table gap5 like gap4;
insert into gap5 values (1,1,1), (2,2,2), (3,3,3), (4,4,4);
set session gap_lock_raise_error=1;
set session gap_lock_write_log=1;
select sum(value) from gap1;
sum(value)
500500
update gap1 set gap1.value= (select count(*) from gap2);
select sum(value) from gap1;
sum(value)
1000000
set global gap_lock_write_log= 0;
set global gap_lock_raise_error= 0;
drop table if exists gap1, gap2, gap3, gap4, gap5;
DROP DATABASE mysqlslap;
0
SET GLOBAL gap_lock_log_file='<GAP_LOCK_ORIG>';
SET GLOBAL gap_lock_log_file='<GAP_LOCK>';
flush general logs;
drop table if exists gap1,gap2,gap3;
CREATE DATABASE mysqlslap;
CREATE TABLE gap1 (id1 INT, id2 INT, id3 INT, c1 INT, value INT,
PRIMARY KEY (id1, id2, id3),
INDEX i (c1)) ENGINE=myisam;
CREATE TABLE gap2 like gap1;
CREATE TABLE gap3 (id INT, value INT,
PRIMARY KEY (id),
UNIQUE KEY ui(value)) ENGINE=myisam;
insert into gap3 values (1,1), (2,2),(3,3),(4,4),(5,5);
create table gap4 (
pk int primary key,
a int,
b int,
key(a)
) ENGINE=myisam;
insert into gap4 values (1,1,1), (2,2,2), (3,3,3), (4,4,4);
create table gap5 like gap4;
insert into gap5 values (1,1,1), (2,2,2), (3,3,3), (4,4,4);
set session gap_lock_raise_error=1;
set session gap_lock_write_log=1;
select sum(value) from gap1;
sum(value)
500500
update gap1 set gap1.value= (select count(*) from gap2);
select sum(value) from gap1;
sum(value)
1000000
set global gap_lock_write_log= 0;
set global gap_lock_raise_error= 0;
drop table if exists gap1, gap2, gap3, gap4, gap5;
DROP DATABASE mysqlslap;
0
SET GLOBAL gap_lock_log_file='<GAP_LOCK_ORIG>';
SET GLOBAL gap_lock_log_file='<GAP_LOCK>';
flush general logs;
