DROP TABLE IF EXISTS t1;
DROP TABLE IF EXISTS t2;
DROP TABLE IF EXISTS t3;
# Explicit COMMIT should fail when innodb_fake_changes is enabled
# DML should be fine
CREATE TABLE t1 (a INT primary key, b int) ENGINE=InnoDB;
INSERT INTO t1 VALUES (1,1);
CREATE TABLE t2 (a INT primary key, b int) ENGINE=InnoDB;
CREATE INDEX bx ON t2(b);
INSERT INTO t2 VALUES (1,1);
CREATE TABLE t3 (a INT primary key, b text) ENGINE=InnoDB;
INSERT INTO t3 VALUES (1,'');
SELECT * FROM t1;
a	b
1	1
SELECT * FROM t2;
a	b
1	1
SELECT a FROM t3;
a
1
COMMIT;
SELECT VARIABLE_VALUE INTO @innodb_rows_inserted_1 FROM INFORMATION_SCHEMA.GLOBAL_STATUS WHERE VARIABLE_NAME = 'Innodb_rows_inserted';
SELECT VARIABLE_VALUE INTO @innodb_rows_deleted_1 FROM INFORMATION_SCHEMA.GLOBAL_STATUS WHERE VARIABLE_NAME = 'Innodb_rows_deleted';
SELECT VARIABLE_VALUE INTO @innodb_rows_updated_1 FROM INFORMATION_SCHEMA.GLOBAL_STATUS WHERE VARIABLE_NAME = 'Innodb_rows_updated';
SELECT ROWS_INSERTED, ROWS_UPDATED, ROWS_DELETED, IO_INDEX_INSERTS
INTO @table_stat_rows_inserted_1, @table_stat_rows_updated_1, @table_stat_rows_deleted_1, @table_stat_io_index_inserts_1
FROM INFORMATION_SCHEMA.TABLE_STATISTICS
WHERE TABLE_NAME='t1' AND TABLE_SCHEMA='test';
SELECT ROWS_INSERTED, ROWS_UPDATED, ROWS_DELETED
INTO @user_stat_rows_inserted_1, @user_stat_rows_updated_1, @user_stat_rows_deleted_1
FROM INFORMATION_SCHEMA.USER_STATISTICS
WHERE USER_NAME='root';
SET innodb_fake_changes=1;
BEGIN;
SELECT * FROM t1;
a	b
1	1
COMMIT;
ERROR HY000: Got error 131 during COMMIT
BEGIN;
SELECT * FROM t2;
a	b
1	1
COMMIT;
ERROR HY000: Got error 131 during COMMIT
BEGIN;
SELECT * FROM t3;
a	b
1	
COMMIT;
ERROR HY000: Got error 131 during COMMIT
BEGIN;
INSERT INTO t1 VALUES (2,2);
COMMIT;
ERROR HY000: Got error 131 during COMMIT
BEGIN;
INSERT INTO t2 VALUES (2,2);
COMMIT;
ERROR HY000: Got error 131 during COMMIT
BEGIN;
INSERT INTO t3 VALUES (2,lpad('a',10000, 'b'));
COMMIT;
ERROR HY000: Got error 131 during COMMIT
BEGIN;
UPDATE t1 SET a=0 where b=1;
COMMIT;
ERROR HY000: Got error 131 during COMMIT
BEGIN;
UPDATE t2 SET a=0 where b=1;
COMMIT;
ERROR HY000: Got error 131 during COMMIT
BEGIN;
UPDATE t3 SET a=0 where a=1;
COMMIT;
ERROR HY000: Got error 131 during COMMIT
BEGIN;
UPDATE t1 SET b=0 where a=1;
COMMIT;
ERROR HY000: Got error 131 during COMMIT
BEGIN;
UPDATE t2 SET b=0 where a=1;
COMMIT;
ERROR HY000: Got error 131 during COMMIT
BEGIN;
UPDATE t3 SET b=lpad('a',10000, 'z') where a=1;
COMMIT;
ERROR HY000: Got error 131 during COMMIT
BEGIN;
UPDATE t1 SET b=0 where a=2;
COMMIT;
ERROR HY000: Got error 131 during COMMIT
BEGIN;
UPDATE t2 SET b=0 where a=2;
COMMIT;
ERROR HY000: Got error 131 during COMMIT
BEGIN;
UPDATE t3 SET b=lpad('a',10000, 'z') where a=2;
COMMIT;
ERROR HY000: Got error 131 during COMMIT
BEGIN;
DELETE FROM t1 where b=2;
COMMIT;
ERROR HY000: Got error 131 during COMMIT
BEGIN;
DELETE FROM t2 where b=2;
COMMIT;
ERROR HY000: Got error 131 during COMMIT
BEGIN;
DELETE FROM t1 where b=1;
COMMIT;
ERROR HY000: Got error 131 during COMMIT
BEGIN;
DELETE FROM t2 where b=1;
COMMIT;
ERROR HY000: Got error 131 during COMMIT
BEGIN;
DELETE FROM t1 where a=2;
COMMIT;
ERROR HY000: Got error 131 during COMMIT
BEGIN;
DELETE FROM t2 where a=2;
COMMIT;
ERROR HY000: Got error 131 during COMMIT
BEGIN;
DELETE FROM t3 where a=2;
COMMIT;
ERROR HY000: Got error 131 during COMMIT
BEGIN;
DELETE FROM t1 where a=1;
COMMIT;
ERROR HY000: Got error 131 during COMMIT
BEGIN;
DELETE FROM t2 where a=1;
COMMIT;
ERROR HY000: Got error 131 during COMMIT
BEGIN;
DELETE FROM t3 where a=1;
COMMIT;
ERROR HY000: Got error 131 during COMMIT
BEGIN;
REPLACE INTO t1 values (2,3);
COMMIT;
ERROR HY000: Got error 131 during COMMIT
BEGIN;
REPLACE INTO t2 values (2,3);
COMMIT;
ERROR HY000: Got error 131 during COMMIT
BEGIN;
REPLACE INTO t3 values (2,lpad('a',9000,'q'));
COMMIT;
ERROR HY000: Got error 131 during COMMIT
BEGIN;
INSERT INTO t1 VALUES (1,1) ON DUPLICATE KEY UPDATE b=2;
COMMIT;
ERROR HY000: Got error 131 during COMMIT
BEGIN;
INSERT INTO t2 VALUES (1,1) ON DUPLICATE KEY UPDATE b=2;
COMMIT;
ERROR HY000: Got error 131 during COMMIT
BEGIN;
INSERT INTO t3 VALUES (1,1) ON DUPLICATE KEY UPDATE b=lpad('b',11000,'c');
COMMIT;
ERROR HY000: Got error 131 during COMMIT
BEGIN;
SELECT * FROM t1;
a	b
1	1
COMMIT;
ERROR HY000: Got error 131 during COMMIT
BEGIN;
SELECT * FROM t2;
a	b
1	1
COMMIT;
ERROR HY000: Got error 131 during COMMIT
BEGIN;
SELECT * FROM t3;
a	b
1	
COMMIT;
ERROR HY000: Got error 131 during COMMIT
create index bx on t1(b);
ERROR HY000: Got error 131 during COMMIT
SET innodb_fake_changes=0;
CHECK TABLE t1;
Table	Op	Msg_type	Msg_text
test.t1	check	status	OK
SELECT VARIABLE_VALUE INTO @innodb_rows_inserted_2 FROM INFORMATION_SCHEMA.GLOBAL_STATUS WHERE VARIABLE_NAME = 'Innodb_rows_inserted';
SELECT VARIABLE_VALUE INTO @innodb_rows_deleted_2 FROM INFORMATION_SCHEMA.GLOBAL_STATUS WHERE VARIABLE_NAME = 'Innodb_rows_deleted';
SELECT VARIABLE_VALUE INTO @innodb_rows_updated_2 FROM INFORMATION_SCHEMA.GLOBAL_STATUS WHERE VARIABLE_NAME = 'Innodb_rows_updated';
SELECT ROWS_INSERTED, ROWS_UPDATED, ROWS_DELETED, IO_INDEX_INSERTS
INTO @table_stat_rows_inserted_2, @table_stat_rows_updated_2, @table_stat_rows_deleted_2, @table_stat_io_index_inserts_2
FROM INFORMATION_SCHEMA.TABLE_STATISTICS
WHERE TABLE_NAME='t1' AND TABLE_SCHEMA='test';
SELECT ROWS_INSERTED, ROWS_UPDATED, ROWS_DELETED
INTO @user_stat_rows_inserted_2, @user_stat_rows_updated_2, @user_stat_rows_deleted_2
FROM INFORMATION_SCHEMA.USER_STATISTICS
WHERE USER_NAME='root';
should_be_1
1
SELECT @innodb_rows_inserted_2 - @innodb_rows_inserted_1 AS should_be_0;
should_be_0
0
SELECT @innodb_rows_deleted_2 - @innodb_rows_deleted_1 AS should_be_0;
should_be_0
0
SELECT @innodb_rows_updated_2 - @innodb_rows_updated_1 AS should_be_0;
should_be_0
0
SELECT @table_stat_rows_inserted_2 - @table_stat_rows_inserted_1 AS should_be_0;
should_be_0
0
SELECT @table_stat_rows_updated_2 - @table_stat_rows_updated_1 AS should_be_0;
should_be_0
0
SELECT @table_stat_rows_deleted_2 - @table_stat_rows_deleted_1 AS should_be_0;
should_be_0
0
SELECT @table_stat_io_index_inserts_2 - @table_stat_io_index_inserts_1 AS should_be_0;
should_be_0
0
SELECT @user_stat_rows_inserted_2 - @user_stat_rows_inserted_1 AS should_be_0;
should_be_0
0
SELECT @user_stat_rows_updated_2 - @user_stat_rows_updated_1 AS should_be_0;
should_be_0
0
SELECT @user_stat_rows_deleted_2 - @user_stat_rows_deleted_1 AS should_be_0;
should_be_0
0
INSERT INTO t1 VALUES (3,3);
INSERT INTO t2 VALUES (3,3);
INSERT INTO t3 VALUES (3,lpad('r',12000, 't'));
SELECT * FROM t1;
a	b
1	1
3	3
SELECT * FROM t2;
a	b
1	1
3	3
SELECT a, length(b) FROM t3;
a	length(b)
1	0
3	12000
DROP TABLE t1;
DROP TABLE t2;
DROP TABLE t3;
