drop table if exists p1,p2,s1,src;
create table p1 (a int not null primary key, b int not null) engine=myisam;
create table p2 (a int not null primary key, b int not null) engine=myisam;
create table s1 (a int not null primary key, b int not null, index bx(b)) engine=myisam;
create table src(a int, b int);
show create table p1;
Table	Create Table
p1	CREATE TABLE `p1` (
  `a` int(11) NOT NULL,
  `b` int(11) NOT NULL,
  PRIMARY KEY (`a`)
) ENGINE=ENGINE DEFAULT CHARSET=latin1
show create table s1;
Table	Create Table
s1	CREATE TABLE `s1` (
  `a` int(11) NOT NULL,
  `b` int(11) NOT NULL,
  PRIMARY KEY (`a`),
  KEY `bx` (`b`)
) ENGINE=ENGINE DEFAULT CHARSET=latin1
insert into src values
(1,1),(2,2),(3,3),(4,4),(5,5),(6,6),(7,7),(8,8),(9,9),
(10,10),(11,11),(12,12),(13,13),(14,14),(15,15),(16,16),(17,17),(18,18),(19,19),
(20,20),(21,21),(22,12),(23,23),(24,24),(25,25),(26,26),(27,27),(28,28),(29,29);
""
Test insert
""
flush statistics;
insert into p1 values (1,1), (2,2);
select TABLE_SCHEMA,TABLE_NAME,TABLE_ENGINE,ROWS_INSERTED,ROWS_UPDATED,ROWS_DELETED,ROWS_READ,ROWS_REQUESTED,ROWS_INDEX_FIRST,ROWS_INDEX_NEXT,IO_INDEX_INSERTS
from information_schema.table_statistics where table_name = 'p1';
TABLE_SCHEMA	TABLE_NAME	TABLE_ENGINE	ROWS_INSERTED	ROWS_UPDATED	ROWS_DELETED	ROWS_READ	ROWS_REQUESTED	ROWS_INDEX_FIRST	ROWS_INDEX_NEXT	IO_INDEX_INSERTS
test	p1	ENGINE	2	0	0	0	0	0	0	0
select TABLE_SCHEMA,TABLE_NAME,TABLE_ENGINE,ROWS_INSERTED,ROWS_UPDATED,ROWS_DELETED,ROWS_READ,ROWS_REQUESTED,ROWS_INDEX_FIRST,ROWS_INDEX_NEXT,IO_INDEX_INSERTS
from information_schema.table_statistics where table_name like 'p%' order by ROWS_INSERTED;
TABLE_SCHEMA	TABLE_NAME	TABLE_ENGINE	ROWS_INSERTED	ROWS_UPDATED	ROWS_DELETED	ROWS_READ	ROWS_REQUESTED	ROWS_INDEX_FIRST	ROWS_INDEX_NEXT	IO_INDEX_INSERTS
test	p1	ENGINE	2	0	0	0	0	0	0	0
select 'should be 0,2,0,0', Rows_read,Rows_inserted,Rows_updated,Rows_deleted from information_schema.table_statistics where table_name = 'p1';
should be 0,2,0,0	Rows_read	Rows_inserted	Rows_updated	Rows_deleted
should be 0,2,0,0	0	2	0	0
select Table_Engine from information_schema.table_statistics where table_name = 'p1';
Table_Engine
ENGINE
""
Test delete
""
flush statistics;
delete from p1 where (a+b) > 0;
select 'should be 2,0,0,2', Rows_read,Rows_inserted,Rows_updated,Rows_deleted from information_schema.table_statistics where table_name = 'p1';
should be 2,0,0,2	Rows_read	Rows_inserted	Rows_updated	Rows_deleted
should be 2,0,0,2	2	0	0	2
delete from p1;
insert into p1 values (1,1), (2,2);
""
Test insert select
""
flush statistics;
insert into p2 select * from p1;
select 'should be 2,0,0,0', Rows_read,Rows_inserted,Rows_updated,Rows_deleted from information_schema.table_statistics where table_name = 'p1';
should be 2,0,0,0	Rows_read	Rows_inserted	Rows_updated	Rows_deleted
should be 2,0,0,0	2	0	0	0
select 'should be 0,2,0,0', Rows_read,Rows_inserted,Rows_updated,Rows_deleted from information_schema.table_statistics where table_name = 'p2';
should be 0,2,0,0	Rows_read	Rows_inserted	Rows_updated	Rows_deleted
should be 0,2,0,0	0	2	0	0
""
Test update with PK scans
""
delete from p1;
insert into p1 select * from src;
analyze table p1;
flush statistics;
update p1 set a = 32 where a = 1;
select 'should be (1 or 2),0,1,0', Rows_read,Rows_inserted,Rows_updated,Rows_deleted from information_schema.table_statistics where table_name = 'p1';
should be (1 or 2),0,1,0	Rows_read	Rows_inserted	Rows_updated	Rows_deleted
should be (1 or 2),0,1,0	1	0	1	0
flush statistics;
update p1 set a = 51 where a = 32;
select 'should be (1 or 2),0,1,0', Rows_read,Rows_inserted,Rows_updated,Rows_deleted from information_schema.table_statistics where table_name = 'p1';
should be (1 or 2),0,1,0	Rows_read	Rows_inserted	Rows_updated	Rows_deleted
should be (1 or 2),0,1,0	1	0	1	0
delete from p1;
insert into p1 select * from src;
analyze table p1;
""
Test update with secondary index scans
echo ""
delete from s1;
insert into s1 select * from src;
analyze table s1;
flush statistics;
update s1 set a = 31 where b = 1;
select 'should be 0,1,0', Rows_inserted,Rows_updated,Rows_deleted from information_schema.table_statistics where table_name = 's1';
should be 0,1,0	Rows_inserted	Rows_updated	Rows_deleted
should be 0,1,0	0	1	0
select Rows_read = 1 or Rows_read = 2 from information_schema.table_statistics where table_name = 's1';
Rows_read = 1 or Rows_read = 2
1
delete from s1;
insert into s1 select * from src;
analyze table s1;
""
Test delete with PK scans
""
flush statistics;
delete from p1 where a = 31;
select 'should be 0,0,0,0', Rows_read,Rows_inserted,Rows_updated,Rows_deleted from information_schema.table_statistics where table_name = 'p1';
should be 0,0,0,0	Rows_read	Rows_inserted	Rows_updated	Rows_deleted
should be 0,0,0,0	0	0	0	0
select 'should be 1', Rows_requested from information_schema.table_statistics where table_name = 'p1';
should be 1	Rows_requested
should be 1	1
flush statistics;
delete from p1 where a = 2;
select 'should be 1,0,0,1', Rows_read,Rows_inserted,Rows_updated,Rows_deleted from information_schema.table_statistics where table_name = 'p1';
should be 1,0,0,1	Rows_read	Rows_inserted	Rows_updated	Rows_deleted
should be 1,0,0,1	1	0	0	1
delete from p1;
insert into p1 select * from src;
""
Test delete with secondary index scans
""
flush statistics;
delete from s1 where b = 1;
select 'should be 1,0,0,1', Rows_read,Rows_inserted,Rows_updated,Rows_deleted from information_schema.table_statistics where table_name = 's1';
should be 1,0,0,1	Rows_read	Rows_inserted	Rows_updated	Rows_deleted
should be 1,0,0,1	1	0	0	1
delete from s1;
insert into s1 select * from src;
analyze table s1;
""
Test select with PK scans
""
flush statistics;
select count(*) from p1 where a = 1;
count(*)
1
select 'should be 1,0,0,0', Rows_read,Rows_inserted,Rows_updated,Rows_deleted from information_schema.table_statistics where table_name = 'p1';
should be 1,0,0,0	Rows_read	Rows_inserted	Rows_updated	Rows_deleted
should be 1,0,0,0	1	0	0	0
flush statistics;
select count(*) from p1 where a < 0;
count(*)
0
select 'should be (0 or 1),0,0,0', Rows_read,Rows_inserted,Rows_updated,Rows_deleted from information_schema.table_statistics where table_name = 'p1';
should be (0 or 1),0,0,0	Rows_read	Rows_inserted	Rows_updated	Rows_deleted
should be (0 or 1),0,0,0	1	0	0	0
flush statistics;
select a from p1 where a < 32 order by a desc;
a
29
28
27
26
25
24
23
22
21
20
19
18
17
16
15
14
13
12
11
10
9
8
7
6
5
4
3
2
1
select 'should be 29,0,0,0', Rows_read,Rows_inserted,Rows_updated,Rows_deleted from information_schema.table_statistics where table_name = 'p1';
should be 29,0,0,0	Rows_read	Rows_inserted	Rows_updated	Rows_deleted
should be 29,0,0,0	29	0	0	0
flush statistics;
select a from p1 where a > 0 order by a;
a
1
2
3
4
5
6
7
8
9
10
11
12
13
14
15
16
17
18
19
20
21
22
23
24
25
26
27
28
29
select 'should be 29,0,0,0', Rows_read,Rows_inserted,Rows_updated,Rows_deleted from information_schema.table_statistics where table_name = 'p1';
should be 29,0,0,0	Rows_read	Rows_inserted	Rows_updated	Rows_deleted
should be 29,0,0,0	29	0	0	0
""
Test select with secondary scans
""
flush statistics;
select * from s1 where b = 1;
a	b
1	1
select 'should be 1,0,0,0', Rows_read,Rows_inserted,Rows_updated,Rows_deleted from information_schema.table_statistics where table_name = 's1';
should be 1,0,0,0	Rows_read	Rows_inserted	Rows_updated	Rows_deleted
should be 1,0,0,0	1	0	0	0
flush statistics;
select b from s1 where b < 0;
b
select 'should be (0 or 1),0,0,0', Rows_read,Rows_inserted,Rows_updated,Rows_deleted from information_schema.table_statistics where table_name = 's1';
should be (0 or 1),0,0,0	Rows_read	Rows_inserted	Rows_updated	Rows_deleted
should be (0 or 1),0,0,0	1	0	0	0
flush statistics;
select b from s1 where b < 2;
b
1
select 'should be (1 or 2),0,0,0', Rows_read,Rows_inserted,Rows_updated,Rows_deleted from information_schema.table_statistics where table_name = 's1';
should be (1 or 2),0,0,0	Rows_read	Rows_inserted	Rows_updated	Rows_deleted
should be (1 or 2),0,0,0	2	0	0	0
flush statistics;
select b from s1 where b < 4 order by b desc;
b
3
2
1
select 'should be 3,0,0,0', Rows_read,Rows_inserted,Rows_updated,Rows_deleted from information_schema.table_statistics where table_name = 's1';
should be 3,0,0,0	Rows_read	Rows_inserted	Rows_updated	Rows_deleted
should be 3,0,0,0	3	0	0	0
flush statistics;
select b from s1 where b < 2 order by b desc;
b
1
select 'should be 1,0,0,0', Rows_read,Rows_inserted,Rows_updated,Rows_deleted from information_schema.table_statistics where table_name = 's1';
should be 1,0,0,0	Rows_read	Rows_inserted	Rows_updated	Rows_deleted
should be 1,0,0,0	1	0	0	0
flush statistics;
select b from s1 where b > -1 order by b;
b
1
2
3
4
5
6
7
8
9
10
11
12
12
13
14
15
16
17
18
19
20
21
23
24
25
26
27
28
29
select 'should be 29,0,0,0', Rows_read,Rows_inserted,Rows_updated,Rows_deleted from information_schema.table_statistics where table_name = 's1';
should be 29,0,0,0	Rows_read	Rows_inserted	Rows_updated	Rows_deleted
should be 29,0,0,0	29	0	0	0
flush statistics;
select b from s1 where b > 27 order by b;
b
28
29
select 'should be 2,0,0,0', Rows_read,Rows_inserted,Rows_updated,Rows_deleted from information_schema.table_statistics where table_name = 's1';
should be 2,0,0,0	Rows_read	Rows_inserted	Rows_updated	Rows_deleted
should be 2,0,0,0	2	0	0	0
select count(*) from s1;
count(*)
29
flush statistics;
delete from s1;
select 'should be 29,0,0,29', Rows_read,Rows_inserted,Rows_updated,Rows_deleted from information_schema.table_statistics where table_name = 's1';
should be 29,0,0,29	Rows_read	Rows_inserted	Rows_updated	Rows_deleted
should be 29,0,0,29	0	0	0	29
drop table p1;
drop table p2;
drop table s1;
drop table src;
