CREATE TABLE t (a INT, PRIMARY KEY (a)) ENGINE=InnoDB;
INSERT INTO t VALUES (0), (2), (6), (10), (14), (18), (22);
START TRANSACTION;
SELECT lock_table, COUNT(*) FROM INFORMATION_SCHEMA.INNODB_LOCKS
GROUP BY lock_table;
lock_table	COUNT(*)
# con1
START TRANSACTION;
# default connection
UPDATE t SET a = 16 WHERE a = 0;
# con1
UPDATE t SET a = 8 WHERE a = 22;
select a from t order by a;
a
0
2
6
8
10
14
18
UPDATE t SET a = 12 WHERE a = 0;
# default connection
SELECT lock_table, COUNT(*) FROM INFORMATION_SCHEMA.INNODB_LOCKS
GROUP BY lock_table;
lock_table	COUNT(*)
`test`.`t`	2
select a from t order by a;
a
2
6
10
14
16
18
22
UPDATE t SET a = 4 WHERE a = 22;
ERROR 40001: Deadlock found when trying to get lock; try restarting transaction
# con1
ROLLBACK;
# default connection
DROP TABLE t;
