set fb_vector_search_limit_multiplier=1;
CREATE TABLE t1 (
id BIGINT NOT NULL PRIMARY KEY,
vector1 JSON NOT NULL fb_vector_dimension 4,
name varchar(64),
INDEX key1(vector1) FB_VECTOR_INDEX_TYPE 'ivfpq' FB_VECTOR_TRAINED_INDEX_TABLE 'VECTORDB_DATA' FB_VECTOR_TRAINED_INDEX_ID 'id1'
);

verify index config info in INFORMATION_SCHEMA
SELECT INDEX_TYPE, CODE_SIZE, NLIST, PQ_M, PQ_NBITS FROM INFORMATION_SCHEMA.ROCKSDB_VECTOR_INDEX WHERE TABLE_NAME = 't1';
INDEX_TYPE	CODE_SIZE	NLIST	PQ_M	PQ_NBITS
ivfpq	4	4	4	8

populate test data
insert into t1 (WITH RECURSIVE a(i) AS (SELECT 0 union all select i+1 from a where i < 99) SELECT i, json_array(6.66+i*0.0001, 5.45-i*0.0001, 0, 0), concat('val', i) from a);
insert into t1 (WITH RECURSIVE a(i) AS (SELECT 0 union all select i+1 from a where i < 49) SELECT i+1000, json_array(9.52+i*0.0001, 7.79-i*0.0001, 0, 0), concat('val', i+1000) from a);

select *, fb_vector_l2(vector1, '[3, 2]')  as dis from t1 order by dis limit 10;
id	vector1	name	dis
63	[6.6663, 5.4437, 0, 0]	val63	25.3008
64	[6.6664, 5.4436, 0, 0]	val64	25.3009
65	[6.6665, 5.4435, 0, 0]	val65	25.3009
0	[6.66, 5.45, 0, 0]	val0	25.2981
1	[6.6601, 5.4499, 0, 0]	val1	25.2981
2	[6.6602, 5.4498, 0, 0]	val2	25.2982
3	[6.6603, 5.4497, 0, 0]	val3	25.2982
4	[6.6604, 5.4496, 0, 0]	val4	25.2983
5	[6.6605, 5.4495, 0, 0]	val5	25.2983
6	[6.6606, 5.4494, 0, 0]	val6	25.2984
SELECT NTOTAL, HIT, MIN_LIST_SIZE, MAX_LIST_SIZE, AVG_LIST_SIZE  FROM INFORMATION_SCHEMA.ROCKSDB_VECTOR_INDEX WHERE TABLE_NAME = 't1';
NTOTAL	HIT	MIN_LIST_SIZE	MAX_LIST_SIZE	AVG_LIST_SIZE
150	1	0	100	37

test update, move id 0 to centroid 3, id 1 to centroid 2
update t1 set vector1='[1.249, 1.022, 0, 0]' where id=0;
update t1 set vector1='[3.7, 3.05, 0, 0]' where id=1;
select *, fb_vector_l2(vector1, '[3, 2]')  as dis from t1 order by dis limit 10;
id	vector1	name	dis
1	[3.7, 3.05, 0, 0]	val1	1.5925
0	[1.249, 1.022, 0, 0]	val0	4.0225
63	[6.6663, 5.4437, 0, 0]	val63	25.3008
64	[6.6664, 5.4436, 0, 0]	val64	25.3009
65	[6.6665, 5.4435, 0, 0]	val65	25.3009
2	[6.6602, 5.4498, 0, 0]	val2	25.2982
3	[6.6603, 5.4497, 0, 0]	val3	25.2982
4	[6.6604, 5.4496, 0, 0]	val4	25.2983
5	[6.6605, 5.4495, 0, 0]	val5	25.2983
6	[6.6606, 5.4494, 0, 0]	val6	25.2984
SELECT NTOTAL, HIT, MIN_LIST_SIZE, MAX_LIST_SIZE, AVG_LIST_SIZE  FROM INFORMATION_SCHEMA.ROCKSDB_VECTOR_INDEX WHERE TABLE_NAME = 't1';
NTOTAL	HIT	MIN_LIST_SIZE	MAX_LIST_SIZE	AVG_LIST_SIZE
150	2	1	98	37

test delete, delete id 64
delete from t1 where id=64;
select *, fb_vector_l2(vector1, '[3, 2]')  as dis from t1 order by dis limit 10;
id	vector1	name	dis
1	[3.7, 3.05, 0, 0]	val1	1.5925
0	[1.249, 1.022, 0, 0]	val0	4.0225
63	[6.6663, 5.4437, 0, 0]	val63	25.3008
65	[6.6665, 5.4435, 0, 0]	val65	25.3009
2	[6.6602, 5.4498, 0, 0]	val2	25.2982
3	[6.6603, 5.4497, 0, 0]	val3	25.2982
4	[6.6604, 5.4496, 0, 0]	val4	25.2983
5	[6.6605, 5.4495, 0, 0]	val5	25.2983
6	[6.6606, 5.4494, 0, 0]	val6	25.2984
7	[6.6607, 5.4493, 0, 0]	val7	25.2984
SELECT NTOTAL, HIT, MIN_LIST_SIZE, MAX_LIST_SIZE, AVG_LIST_SIZE  FROM INFORMATION_SCHEMA.ROCKSDB_VECTOR_INDEX WHERE TABLE_NAME = 't1';
NTOTAL	HIT	MIN_LIST_SIZE	MAX_LIST_SIZE	AVG_LIST_SIZE
149	3	1	97	37

test ip
select *, fb_vector_ip(vector1, '[3, 2]')  as dis from t1 order by dis desc limit 10;
id	vector1	name	dis
1038	[9.5238, 7.7862, 0, 0]	val1038	44.1438
1037	[9.5237, 7.7863, 0, 0]	val1037	44.1437
1036	[9.5236, 7.7864, 0, 0]	val1036	44.1436
1035	[9.5235, 7.7865, 0, 0]	val1035	44.1435
1034	[9.5234, 7.7866, 0, 0]	val1034	44.1434
1033	[9.5233, 7.7867, 0, 0]	val1033	44.1433
1032	[9.5232, 7.7868, 0, 0]	val1032	44.1432
1031	[9.5231, 7.7869, 0, 0]	val1031	44.1431
1030	[9.523, 7.787, 0, 0]	val1030	44.143
1029	[9.5229, 7.7871, 0, 0]	val1029	44.1429
SELECT NTOTAL, HIT, MIN_LIST_SIZE, MAX_LIST_SIZE, AVG_LIST_SIZE  FROM INFORMATION_SCHEMA.ROCKSDB_VECTOR_INDEX WHERE TABLE_NAME = 't1';
NTOTAL	HIT	MIN_LIST_SIZE	MAX_LIST_SIZE	AVG_LIST_SIZE
149	4	1	97	37
drop table t1;
blob column test
set fb_vector_search_limit_multiplier=1;
CREATE TABLE t1 (
id BIGINT NOT NULL PRIMARY KEY,
blob1 BLOB NOT NULL fb_vector_dimension 4,
name varchar(64),
INDEX key1(blob1) FB_VECTOR_INDEX_TYPE 'ivfpq' FB_VECTOR_TRAINED_INDEX_TABLE 'VECTORDB_DATA' FB_VECTOR_TRAINED_INDEX_ID 'id1'
);

verify index config info in INFORMATION_SCHEMA
SELECT INDEX_TYPE, CODE_SIZE, NLIST, PQ_M, PQ_NBITS FROM INFORMATION_SCHEMA.ROCKSDB_VECTOR_INDEX WHERE TABLE_NAME = 't1';
INDEX_TYPE	CODE_SIZE	NLIST	PQ_M	PQ_NBITS
ivfpq	4	4	4	8

populate test data
insert into t1 (WITH RECURSIVE a(i) AS (SELECT 0 union all select i+1 from a where i < 99) SELECT i, FB_VECTOR_JSON_TO_BLOB(json_array(6.66+i*0.0001, 5.45-i*0.0001, 0, 0)), concat('val', i) from a);
insert into t1 (WITH RECURSIVE a(i) AS (SELECT 0 union all select i+1 from a where i < 49) SELECT i+1000, FB_VECTOR_JSON_TO_BLOB(json_array(9.52+i*0.0001, 7.79-i*0.0001, 0, 0)), concat('val', i+1000) from a);

select id, FB_VECTOR_BLOB_TO_JSON(blob1), name, fb_vector_l2(blob1, '[3, 2]')  as dis from t1 order by dis limit 10;
id	FB_VECTOR_BLOB_TO_JSON(blob1)	name	dis
63	[6.6663, 5.4437, 0, 0]	val63	25.3008
64	[6.6664, 5.4436, 0, 0]	val64	25.3009
65	[6.6665, 5.4435, 0, 0]	val65	25.3009
0	[6.66, 5.45, 0, 0]	val0	25.2981
1	[6.6601, 5.4499, 0, 0]	val1	25.2981
2	[6.6602, 5.4498, 0, 0]	val2	25.2982
3	[6.6603, 5.4497, 0, 0]	val3	25.2982
4	[6.6604, 5.4496, 0, 0]	val4	25.2983
5	[6.6605, 5.4495, 0, 0]	val5	25.2983
6	[6.6606, 5.4494, 0, 0]	val6	25.2984
SELECT NTOTAL, HIT, MIN_LIST_SIZE, MAX_LIST_SIZE, AVG_LIST_SIZE  FROM INFORMATION_SCHEMA.ROCKSDB_VECTOR_INDEX WHERE TABLE_NAME = 't1';
NTOTAL	HIT	MIN_LIST_SIZE	MAX_LIST_SIZE	AVG_LIST_SIZE
150	1	0	100	37

test update, move id 0 to centroid 3, id 1 to centroid 2
update t1 set blob1=FB_VECTOR_JSON_TO_BLOB('[1.249, 1.022, 0, 0]') where id=0;
update t1 set blob1=FB_VECTOR_JSON_TO_BLOB('[3.7, 3.05, 0, 0]') where id=1;
select id, FB_VECTOR_BLOB_TO_JSON(blob1), name, fb_vector_l2(blob1, '[3, 2]')  as dis from t1 order by dis limit 10;
id	FB_VECTOR_BLOB_TO_JSON(blob1)	name	dis
1	[3.7, 3.05, 0, 0]	val1	1.5925
0	[1.249, 1.022, 0, 0]	val0	4.0225
63	[6.6663, 5.4437, 0, 0]	val63	25.3008
64	[6.6664, 5.4436, 0, 0]	val64	25.3009
65	[6.6665, 5.4435, 0, 0]	val65	25.3009
2	[6.6602, 5.4498, 0, 0]	val2	25.2982
3	[6.6603, 5.4497, 0, 0]	val3	25.2982
4	[6.6604, 5.4496, 0, 0]	val4	25.2983
5	[6.6605, 5.4495, 0, 0]	val5	25.2983
6	[6.6606, 5.4494, 0, 0]	val6	25.2984
SELECT NTOTAL, HIT, MIN_LIST_SIZE, MAX_LIST_SIZE, AVG_LIST_SIZE  FROM INFORMATION_SCHEMA.ROCKSDB_VECTOR_INDEX WHERE TABLE_NAME = 't1';
NTOTAL	HIT	MIN_LIST_SIZE	MAX_LIST_SIZE	AVG_LIST_SIZE
150	2	1	98	37

test delete, delete id 64
delete from t1 where id=64;
select id, FB_VECTOR_BLOB_TO_JSON(blob1), name, fb_vector_l2(blob1, '[3, 2]')  as dis from t1 order by dis limit 10;
id	FB_VECTOR_BLOB_TO_JSON(blob1)	name	dis
1	[3.7, 3.05, 0, 0]	val1	1.5925
0	[1.249, 1.022, 0, 0]	val0	4.0225
63	[6.6663, 5.4437, 0, 0]	val63	25.3008
65	[6.6665, 5.4435, 0, 0]	val65	25.3009
2	[6.6602, 5.4498, 0, 0]	val2	25.2982
3	[6.6603, 5.4497, 0, 0]	val3	25.2982
4	[6.6604, 5.4496, 0, 0]	val4	25.2983
5	[6.6605, 5.4495, 0, 0]	val5	25.2983
6	[6.6606, 5.4494, 0, 0]	val6	25.2984
7	[6.6607, 5.4493, 0, 0]	val7	25.2984
SELECT NTOTAL, HIT, MIN_LIST_SIZE, MAX_LIST_SIZE, AVG_LIST_SIZE  FROM INFORMATION_SCHEMA.ROCKSDB_VECTOR_INDEX WHERE TABLE_NAME = 't1';
NTOTAL	HIT	MIN_LIST_SIZE	MAX_LIST_SIZE	AVG_LIST_SIZE
149	3	1	97	37

test ip
select id, FB_VECTOR_BLOB_TO_JSON(blob1), name, fb_vector_ip(blob1, '[3, 2]')  as dis from t1 order by dis desc limit 10;
id	FB_VECTOR_BLOB_TO_JSON(blob1)	name	dis
1038	[9.5238, 7.7862, 0, 0]	val1038	44.1438
1037	[9.5237, 7.7863, 0, 0]	val1037	44.1437
1036	[9.5236, 7.7864, 0, 0]	val1036	44.1436
1035	[9.5235, 7.7865, 0, 0]	val1035	44.1435
1034	[9.5234, 7.7866, 0, 0]	val1034	44.1434
1033	[9.5233, 7.7867, 0, 0]	val1033	44.1433
1032	[9.5232, 7.7868, 0, 0]	val1032	44.1432
1031	[9.5231, 7.7869, 0, 0]	val1031	44.1431
1030	[9.523, 7.787, 0, 0]	val1030	44.143
1029	[9.5229, 7.7871, 0, 0]	val1029	44.1429
SELECT NTOTAL, HIT, MIN_LIST_SIZE, MAX_LIST_SIZE, AVG_LIST_SIZE  FROM INFORMATION_SCHEMA.ROCKSDB_VECTOR_INDEX WHERE TABLE_NAME = 't1';
NTOTAL	HIT	MIN_LIST_SIZE	MAX_LIST_SIZE	AVG_LIST_SIZE
149	4	1	97	37
drop table t1;
