DROP TABLE IF EXISTS t1;
CREATE TABLE t1 (a INT, b CHAR(8)) ENGINE=rocksdb;
SHOW CREATE TABLE t1;
Table	Create Table
t1	CREATE TABLE `t1` (
  `a` int(11) DEFAULT NULL,
  `b` char(8) DEFAULT NULL
) ENGINE=ROCKSDB DEFAULT CHARSET=latin1
SHOW COLUMNS IN t1;
Field	Type	Null	Key	Default	Extra
a	int(11)	YES		NULL	
b	char(8)	YES		NULL	
INSERT INTO t1 (a,b) VALUES (35,'foo');
INSERT INTO t1 (a,b) VALUES (76,'bar');
INSERT INTO t1 (a,b) VALUES (77,'baz');
SELECT * FROM t1;
a	b
35	foo
76	bar
77	baz
INSERT INTO t1 (a,b) VALUES (45,'bob');
SELECT * FROM t1;
a	b
35	foo
45	bob
76	bar
77	baz
UPDATE t1 SET a=a+100;
SELECT * FROM t1;
a	b
135	foo
145	bob
176	bar
177	baz
UPDATE t1 SET a=a-100, b='bbb' WHERE a>100;
UPDATE t1 SET a=300, b='ccc' WHERE a>70;
UPDATE t1 SET a=123 WHERE a=35;
UPDATE t1 SET a=321 WHERE b='ccc';
SELECT * FROM t1;
a	b
123	bbb
321	ccc
321	ccc
45	bbb
SELECT a,b FROM t1 WHERE a>76;
a	b
123	bbb
321	ccc
321	ccc
SELECT a,b FROM t1 WHERE a=123 AND b='bbb';
a	b
123	bbb
SELECT b FROM t1;
b
bbb
bbb
ccc
ccc
DELETE FROM t1 WHERE a=123;
SELECT * FROM t1;
a	b
321	ccc
321	ccc
45	bbb
DELETE FROM t1 WHERE b > 'bbb';
SELECT * FROM t1;
a	b
45	bbb
DROP TABLE t1;
CREATE TABLE t1 (a INT, c CHAR(8)) ENGINE=rocksdb;
INSERT INTO t1 VALUES (1,'a'),(5,'z');
ALTER TABLE t1 ADD COLUMN b INT;
SHOW CREATE TABLE t1;
Table	Create Table
t1	CREATE TABLE `t1` (
  `a` int(11) DEFAULT NULL,
  `c` char(8) DEFAULT NULL,
  `b` int(11) DEFAULT NULL
) ENGINE=ROCKSDB DEFAULT CHARSET=latin1
SELECT * FROM t1;
a	c	b
1	a	NULL
5	z	NULL
ALTER TABLE t1 DROP COLUMN b;
SHOW CREATE TABLE t1;
Table	Create Table
t1	CREATE TABLE `t1` (
  `a` int(11) DEFAULT NULL,
  `c` char(8) DEFAULT NULL
) ENGINE=ROCKSDB DEFAULT CHARSET=latin1
SELECT * FROM t1;
a	c
1	a
5	z
DROP TABLE t1;
CREATE TABLE t1 (a INT, b CHAR(8), pk INT AUTO_INCREMENT PRIMARY KEY) ENGINE=rocksdb;
ALTER TABLE t1 DROP COLUMN pk;
SHOW CREATE TABLE t1;
Table	Create Table
t1	CREATE TABLE `t1` (
  `a` int(11) DEFAULT NULL,
  `b` char(8) DEFAULT NULL
) ENGINE=ROCKSDB DEFAULT CHARSET=latin1
INSERT INTO t1 (a,b) VALUES (35,'foo');
INSERT INTO t1 (a,b) VALUES (76,'bar');
INSERT INTO t1 (a,b) VALUES (77,'baz');
SELECT * FROM t1;
a	b
35	foo
76	bar
77	baz
DROP TABLE t1;
