CREATE TABLE `link_table` (
`id1` bigint(20) unsigned NOT NULL DEFAULT '0' ,
`id1_type` int(10) unsigned NOT NULL DEFAULT '0' ,
`id2` bigint(20) unsigned NOT NULL DEFAULT '0' ,
`id2_type` int(10) unsigned NOT NULL DEFAULT '0' ,
`link_type` bigint(20) unsigned NOT NULL DEFAULT '0' ,
`visibility` tinyint(3) NOT NULL DEFAULT '0' ,
`data` varchar(255) COLLATE latin1_bin NOT NULL DEFAULT '' ,
`time` int(10) unsigned NOT NULL DEFAULT '0' ,
`version` bigint(20) unsigned NOT NULL DEFAULT '0' ,
PRIMARY KEY (`link_type` , `id1` , `id2`) COMMENT 'cf_link' ,
KEY `id1_type` (`id1` , `link_type` , `visibility` , `time` , `id2` ,
`version` , `data`) COMMENT 'rev:cf_link_id1_type'
) ENGINE=ROCKSDB DEFAULT CHARSET=latin1 COLLATE=latin1_bin
ROW_FORMAT=COMPRESSED KEY_BLOCK_SIZE=8;
Warnings:
Warning	1681	Integer display width is deprecated and will be removed in a future release.
Warning	1681	Integer display width is deprecated and will be removed in a future release.
Warning	1681	Integer display width is deprecated and will be removed in a future release.
Warning	1681	Integer display width is deprecated and will be removed in a future release.
Warning	1681	Integer display width is deprecated and will be removed in a future release.
Warning	1681	Integer display width is deprecated and will be removed in a future release.
Warning	1681	Integer display width is deprecated and will be removed in a future release.
Warning	1681	Integer display width is deprecated and will be removed in a future release.
CREATE TABLE `link_table2` (
`id1` bigint(20) unsigned NOT NULL DEFAULT '0' ,
`id1_type` int(10) unsigned NOT NULL DEFAULT '0' ,
`id2` bigint(20) unsigned NOT NULL DEFAULT '0' ,
`id2_type` int(10) unsigned NOT NULL DEFAULT '0' ,
`link_type` bigint(20) unsigned NOT NULL DEFAULT '0' ,
`visibility` tinyint(3) NOT NULL DEFAULT '0' ,
`data` varchar(255) COLLATE latin1_bin NOT NULL DEFAULT '' ,
`time` int(10) unsigned NOT NULL DEFAULT '0' ,
`version` bigint(20) unsigned NOT NULL DEFAULT '0' ,
PRIMARY KEY (`link_type` , `id1` , `id2`)
COMMENT 'cf_link' ,
KEY `id1_type` (`id1` , `link_type` , `visibility` , `time` , `id2` ,
`version` , `data`) COMMENT 'cf_link_id1_type'
) ENGINE=ROCKSDB DEFAULT CHARSET=latin1 COLLATE=latin1_bin
ROW_FORMAT=COMPRESSED KEY_BLOCK_SIZE=9;
Warnings:
Warning	1681	Integer display width is deprecated and will be removed in a future release.
Warning	1681	Integer display width is deprecated and will be removed in a future release.
Warning	1681	Integer display width is deprecated and will be removed in a future release.
Warning	1681	Integer display width is deprecated and will be removed in a future release.
Warning	1681	Integer display width is deprecated and will be removed in a future release.
Warning	1681	Integer display width is deprecated and will be removed in a future release.
Warning	1681	Integer display width is deprecated and will be removed in a future release.
Warning	1681	Integer display width is deprecated and will be removed in a future release.
insert into link_table values (1, 1, 1, 2, 3, 4, 'a10', 10, 125);
insert into link_table values (1, 1, 2, 2, 3, 3, 'a10', 10, 125);
insert into link_table values (1, 1, 3, 2, 3, 4, 'a11', 11, 125);
insert into link_table values (1, 1, 4, 2, 3, 4, 'a11', 11, 125);
insert into link_table values (1, 1, 5, 2, 3, 3, 'a12', 12, 125);
insert into link_table values (1, 1, 6, 2, 3, 4, 'a12', 12, 125);
insert into link_table values (1, 1, 7, 2, 3, 4, 'a12', 12, 125);
insert into link_table values (1, 1, 8, 2, 3, 4, 'a13', 13, 125);
insert into link_table values (1, 1, 9, 2, 3, 4, 'a14', 14, 125);
insert into link_table values (1, 1, 10, 2, 3, 4, 'a15', 15, 125);
insert into link_table values (2, 1, 1, 2, 3, 4, 'a10', 10, 125);
insert into link_table values (2, 1, 2, 2, 3, 4, 'a10', 10, 125);
insert into link_table values (2, 1, 3, 2, 3, 4, 'a11', 11, 125);
insert into link_table values (2, 1, 4, 2, 3, 4, 'a11', 11, 125);
insert into link_table values (2, 1, 5, 2, 3, 4, 'a12', 12, 125);
insert into link_table values (2, 1, 6, 2, 3, 4, 'a12', 12, 125);
insert into link_table values (2, 1, 7, 2, 3, 4, 'a12', 12, 125);
insert into link_table values (2, 1, 8, 2, 3, 4, 'a13', 13, 125);
insert into link_table values (2, 1, 9, 2, 3, 4, 'a14', 14, 125);
insert into link_table values (2, 1, 10, 2, 3, 4, 'a15', 15, 125);
insert into link_table values (2, 1, 1, 2, 4, 4, 'a10', 10, 125);
insert into link_table values (2, 1, 2, 2, 4, 4, 'a10', 10, 125);
insert into link_table values (2, 1, 3, 2, 4, 4, 'a11', 11, 125);
insert into link_table values (2, 1, 4, 2, 4, 4, 'a11', 11, 125);
insert into link_table values (2, 1, 5, 2, 4, 4, 'a12', 12, 125);
insert into link_table values (2, 1, 6, 2, 4, 4, 'a12', 12, 125);
insert into link_table values (2, 1, 7, 2, 4, 4, 'a12', 12, 125);
insert into link_table values (2, 1, 8, 2, 4, 4, 'a13', 13, 125);
insert into link_table values (2, 1, 9, 2, 4, 4, 'a14', 14, 125);
insert into link_table values (2, 1, 10, 2, 4, 4, 'a15', 15, 125);
insert into link_table values (3, 1, 10, 2, 3, 4, 'a10', 10, 125);
insert into link_table values (3, 1, 9, 2, 3, 4, 'a10', 10, 125);
insert into link_table values (3, 1, 8, 2, 3, 4, 'a11', 11, 125);
insert into link_table values (3, 1, 7, 2, 3, 4, 'a11', 11, 125);
insert into link_table values (3, 1, 6, 2, 3, 4, 'a12', 12, 125);
insert into link_table values (3, 1, 5, 2, 3, 4, 'a12', 12, 125);
insert into link_table values (3, 1, 4, 2, 3, 4, 'a12', 12, 125);
insert into link_table values (3, 1, 3, 2, 3, 4, 'a13', 13, 125);
insert into link_table values (3, 1, 2, 2, 3, 4, 'a14', 14, 125);
insert into link_table values (3, 1, 1, 2, 3, 4, 'a15', 15, 125);
insert into link_table values (9, 1, 9, 2, 5, 6, '0  ', 10, 125);
insert into link_table values (9, 1, 8, 2, 5, 6, '01  ', 11, 125);
insert into link_table values (9, 1, 7, 2, 5, 6, '012  ', 11, 125);
insert into link_table values (9, 1, 6, 2, 5, 6, '0123  ', 12, 125);
insert into link_table values (9, 1, 5, 2, 5, 6, '01234  ', 12, 125);
insert into link_table values (9, 1, 4, 2, 5, 6, '012345  ', 12, 125);
insert into link_table values (9, 1, 3, 2, 5, 6, '0123456  ', 13, 125);
insert into link_table values (9, 1, 2, 2, 5, 6, '01234567  ', 14, 125);
insert into link_table values (9, 1, 1, 2, 5, 6, '012345678  ', 15, 125);
insert into link_table values (9, 1, 0, 2, 5, 6, '0123456789  ', 15, 125);
insert into link_table2 select * from link_table;
CREATE TABLE `id_table` (
`id` bigint(20) NOT NULL DEFAULT '0',
`type` int(11) NOT NULL DEFAULT '0',
`row_created_time` int(11) NOT NULL DEFAULT '0',
`hash_key` varchar(255) NOT NULL DEFAULT '',
`is_deleted` tinyint(4) DEFAULT '0',
PRIMARY KEY (`id`),
KEY `type_id` (`type`,`id`)
) ENGINE=ROCKSDB DEFAULT CHARSET=latin1 ROW_FORMAT=COMPRESSED
KEY_BLOCK_SIZE=8;
Warnings:
Warning	1681	Integer display width is deprecated and will be removed in a future release.
Warning	1681	Integer display width is deprecated and will be removed in a future release.
Warning	1681	Integer display width is deprecated and will be removed in a future release.
Warning	1681	Integer display width is deprecated and will be removed in a future release.
insert into id_table values (1, 1, 10, '111', 0);
insert into id_table values (2, 1, 10, '111', 1);
insert into id_table values (3, 1, 10, '111', 0);
insert into id_table values (4, 1, 10, '111', 1);
insert into id_table values (5, 1, 10, '111', 0);
insert into id_table values (6, 1, 10, '111', 1);
insert into id_table values (7, 1, 10, '111', 0);
insert into id_table values (8, 1, 10, '111', 1);
insert into id_table values (9, 1, 10, '111', 0);
insert into id_table values (10, 1, 10, '111', 1);
CREATE TABLE `node_table` (
`id` bigint(20) unsigned NOT NULL DEFAULT '0',
`type` int(10) unsigned NOT NULL DEFAULT '0',
`version` bigint(20) unsigned NOT NULL DEFAULT '0',
`update_time` int(10) unsigned NOT NULL DEFAULT '0',
`data` mediumtext COLLATE latin1_bin NOT NULL,
PRIMARY KEY (`type`,`id`) COMMENT 'cf_node_type_id',
KEY `id` (`id`) COMMENT 'cf_node'
) ENGINE=ROCKSDB DEFAULT CHARSET=latin1 COLLATE=latin1_bin
ROW_FORMAT=COMPRESSED KEY_BLOCK_SIZE=8;
Warnings:
Warning	1681	Integer display width is deprecated and will be removed in a future release.
Warning	1681	Integer display width is deprecated and will be removed in a future release.
Warning	1681	Integer display width is deprecated and will be removed in a future release.
Warning	1681	Integer display width is deprecated and will be removed in a future release.
insert into node_table values (1, 1, 1, 10, 'data');
insert into node_table values (2, 1, 1, 10, 'data');
insert into node_table values (3, 1, 1, 10, 'data');
insert into node_table values (4, 1, 1, 10, 'data');
insert into node_table values (5, 1, 1, 10, 'data');
insert into node_table values (6, 1, 1, 10, 'data');
insert into node_table values (7, 1, 1, 10, 'data');
insert into node_table values (8, 1, 1, 10, 'data');
insert into node_table values (9, 1, 1, 10, 'data');
insert into node_table values (10, 1, 1, 10, 'data');
CREATE TABLE `count_table` (
`id` bigint(20) unsigned NOT NULL DEFAULT '0',
`type` int(10) unsigned NOT NULL DEFAULT '0',
`link_type` bigint(20) unsigned NOT NULL DEFAULT '0',
`count` int(10) unsigned NOT NULL DEFAULT '0',
`time` int(10) unsigned NOT NULL DEFAULT '0',
`version` bigint(20) unsigned NOT NULL DEFAULT '0',
PRIMARY KEY (`id`,`link_type`) COMMENT 'cf_count_table'
) ENGINE=ROCKSDB DEFAULT CHARSET=latin1 COLLATE=latin1_bin
ROW_FORMAT=COMPRESSED KEY_BLOCK_SIZE=8;
Warnings:
Warning	1681	Integer display width is deprecated and will be removed in a future release.
Warning	1681	Integer display width is deprecated and will be removed in a future release.
Warning	1681	Integer display width is deprecated and will be removed in a future release.
Warning	1681	Integer display width is deprecated and will be removed in a future release.
Warning	1681	Integer display width is deprecated and will be removed in a future release.
Warning	1681	Integer display width is deprecated and will be removed in a future release.
insert into count_table values (2, 1, 1, 1, 10, 20);
insert into count_table values (3, 1, 1, 1, 10, 20);
insert into count_table values (4, 1, 1, 1, 10, 20);
insert into count_table values (5, 1, 1, 1, 10, 20);
insert into count_table values (6, 1, 1, 1, 10, 20);
insert into count_table values (7, 1, 1, 1, 10, 20);
insert into count_table values (8, 1, 1, 1, 10, 20);
insert into count_table values (9, 1, 1, 1, 10, 20);
insert into count_table values (10, 1, 1, 1, 10, 20);
CREATE TABLE `link_table5` (
`id1` bigint(20) unsigned NOT NULL DEFAULT '0',
`id1_type` int(10) unsigned NOT NULL DEFAULT '0',
`id2` bigint(20) unsigned NOT NULL DEFAULT '0',
`id2_type` int(10) unsigned NOT NULL DEFAULT '0',
`link_type` bigint(20) unsigned NOT NULL DEFAULT '0',
`visibility` tinyint(3) NOT NULL DEFAULT '0',
`data` varchar(255) COLLATE latin1_bin NOT NULL DEFAULT '',
`time` int(10) unsigned NOT NULL DEFAULT '0',
`version` bigint(20) unsigned NOT NULL DEFAULT '0',
PRIMARY KEY (`link_type`,`id1`,`id2`) COMMENT 'cf_link'
) ENGINE=ROCKSDB DEFAULT CHARSET=latin1 COLLATE=latin1_bin
ROW_FORMAT=COMPRESSED KEY_BLOCK_SIZE=8;
Warnings:
Warning	1681	Integer display width is deprecated and will be removed in a future release.
Warning	1681	Integer display width is deprecated and will be removed in a future release.
Warning	1681	Integer display width is deprecated and will be removed in a future release.
Warning	1681	Integer display width is deprecated and will be removed in a future release.
Warning	1681	Integer display width is deprecated and will be removed in a future release.
Warning	1681	Integer display width is deprecated and will be removed in a future release.
Warning	1681	Integer display width is deprecated and will be removed in a future release.
Warning	1681	Integer display width is deprecated and will be removed in a future release.
insert into link_table5 values (1, 1, 2, 2, 1, 1, 'data12', 1, 1);
insert into link_table5 values (1, 1, 3, 2, 1, 2, 'data13', 1, 1);
insert into link_table5 values (1, 1, 4, 2, 1, 2, 'data14', 1, 1);
insert into link_table5 values (1, 1, 5, 2, 1, 1, 'data15', 1, 1);
insert into link_table5 values (2, 1, 1, 2, 1, 1, 'data21', 1, 1);
insert into link_table5 values (2, 1, 2, 2, 1, 1, 'data22', 1, 1);
insert into link_table5 values (2, 1, 3, 2, 1, 1, 'data32', 1, 1);
CREATE TABLE `link_table3` (
`id1` bigint(20) unsigned NOT NULL DEFAULT '0',
`id1_type` int(10) unsigned NOT NULL DEFAULT '0',
`id2` bigint(20) unsigned NOT NULL DEFAULT '0',
`id2_type` int(10) unsigned NOT NULL DEFAULT '0',
`link_type` bigint(20) unsigned NOT NULL DEFAULT '0',
`visibility` tinyint(4) NOT NULL DEFAULT '0',
`data` text COLLATE latin1_bin NOT NULL,
`time` int(10) unsigned NOT NULL DEFAULT '0',
`version` bigint(20) unsigned NOT NULL DEFAULT '0',
PRIMARY KEY (`link_type`,`id1`,`id2`) COMMENT 'cf_link',
KEY `id1_type` (`id1`,`link_type`,`visibility`,`time`,`id2`,`version`)
COMMENT 'rev:cf_link_id1_type'
) ENGINE=ROCKSDB DEFAULT CHARSET=latin1 COLLATE=latin1_bin
ROW_FORMAT=COMPRESSED KEY_BLOCK_SIZE=4;
Warnings:
Warning	1681	Integer display width is deprecated and will be removed in a future release.
Warning	1681	Integer display width is deprecated and will be removed in a future release.
Warning	1681	Integer display width is deprecated and will be removed in a future release.
Warning	1681	Integer display width is deprecated and will be removed in a future release.
Warning	1681	Integer display width is deprecated and will be removed in a future release.
Warning	1681	Integer display width is deprecated and will be removed in a future release.
Warning	1681	Integer display width is deprecated and will be removed in a future release.
Warning	1681	Integer display width is deprecated and will be removed in a future release.
insert into link_table3 values (1, 1, 2, 2, 1, 1, 'data12', 1, 1);
insert into link_table3 values (1, 1, 3, 2, 1, 2, 'data13', 1, 1);
insert into link_table3 values (1, 1, 4, 2, 1, 2, 'data14', 1, 1);
insert into link_table3 values (1, 1, 5, 2, 1, 1, 'data15', 1, 1);
insert into link_table3 values (2, 1, 1, 2, 1, 1, 'data21', 1, 1);
insert into link_table3 values (2, 1, 2, 2, 1, 1, 'data22', 1, 1);
insert into link_table3 values (2, 1, 3, 2, 1, 1, 'data32', 1, 1);
CREATE TABLE `link_table6` (
`id1` bigint(20) unsigned NOT NULL DEFAULT '0',
`id1_type` int(10) unsigned NOT NULL DEFAULT '0',
`id2` bigint(20) unsigned NOT NULL DEFAULT '0',
`id2_type` int(10) unsigned NOT NULL DEFAULT '0',
`link_type` bigint(20) unsigned NOT NULL DEFAULT '0',
`visibility` tinyint(4) NOT NULL DEFAULT '0',
`data` text COLLATE latin1_bin NOT NULL,
`time` int(10) unsigned NOT NULL DEFAULT '0',
`version` bigint(20) unsigned NOT NULL DEFAULT '0',
PRIMARY KEY (`link_type`,`id1`,`id2`) COMMENT 'cf_link',
KEY `id1_type` (`id1`,`link_type`,`visibility`,`time`,`id2`,`version`,
`data`(255)) COMMENT 'rev:cf_link_id1_type'
) ENGINE=ROCKSDB DEFAULT CHARSET=latin1 COLLATE=latin1_bin
ROW_FORMAT=COMPRESSED KEY_BLOCK_SIZE=4;
Warnings:
Warning	1681	Integer display width is deprecated and will be removed in a future release.
Warning	1681	Integer display width is deprecated and will be removed in a future release.
Warning	1681	Integer display width is deprecated and will be removed in a future release.
Warning	1681	Integer display width is deprecated and will be removed in a future release.
Warning	1681	Integer display width is deprecated and will be removed in a future release.
Warning	1681	Integer display width is deprecated and will be removed in a future release.
Warning	1681	Integer display width is deprecated and will be removed in a future release.
Warning	1681	Integer display width is deprecated and will be removed in a future release.
insert into link_table6 values (1, 1, 2, 2, 1, 1,
'data12_12345678901234567890123456789012345678901234567890123456789'
  '0123456789012345678901234567890123456789012345678901234567890123456789'
  '0123456789012345678901234567890123456789012345678901234567890123456789'
  '0123456789012345678901234567890123456789012345678901234567890123456789'
  '0123456789012345678901234567890', 1, 1);
insert into link_table6 values (1, 1, 3, 2, 1, 2,
'data13_12345678901234567890123456789012345678901234567890123456789'
  '0123456789012345678901234567890123456789012345678901234567890123456789'
  '0123456789012345678901234567890123456789012345678901234567890123456789'
  '0123456789012345678901234567890123456789012345678901234567890123456789'
  '0123456789012345678901234567890', 1, 1);
insert into link_table6 values (1, 1, 4, 2, 1, 2,
'data14_12345678901234567890123456789012345678901234567890123456789'
  '0123456789012345678901234567890123456789012345678901234567890123456789'
  '0123456789012345678901234567890123456789012345678901234567890123456789'
  '0123456789012345678901234567890123456789012345678901234567890123456789'
  '0123456789012345678901234567890', 1, 1);
insert into link_table6 values (1, 1, 5, 2, 1, 1,
'data15_12345678901234567890123456789012345678901234567890123456789'
  '0123456789012345678901234567890123456789012345678901234567890123456789'
  '0123456789012345678901234567890123456789012345678901234567890123456789'
  '0123456789012345678901234567890123456789012345678901234567890123456789'
  '0123456789012345678901234567890', 1, 1);
insert into link_table6 values (2, 1, 1, 2, 1, 1,
'data21_12345678901234567890123456789012345678901234567890123456789'
  '0123456789012345678901234567890123456789012345678901234567890123456789'
  '0123456789012345678901234567890123456789012345678901234567890123456789'
  '0123456789012345678901234567890123456789012345678901234567890123456789'
  '0123456789012345678901234567890', 1, 1);
insert into link_table6 values (2, 1, 2, 2, 1, 1,
'data22_12345678901234567890123456789012345678901234567890123456789'
  '0123456789012345678901234567890123456789012345678901234567890123456789'
  '0123456789012345678901234567890123456789012345678901234567890123456789'
  '0123456789012345678901234567890123456789012345678901234567890123456789'
  '0123456789012345678901234567890', 1, 1);
insert into link_table6 values (2, 1, 3, 2, 1, 1,
'data32_12345678901234567890123456789012345678901234567890123456789'
  '0123456789012345678901234567890123456789012345678901234567890123456789'
  '0123456789012345678901234567890123456789012345678901234567890123456789'
  '0123456789012345678901234567890123456789012345678901234567890123456789'
  '0123456789012345678901234567890', 1, 1);
CREATE TABLE `link_table4` (
`id1` binary(16) NOT NULL DEFAULT '\0\0\0\0\0\0\0\0\0\0\0\0\0\0\0\0',
`raw_key` text COLLATE latin1_bin,
`id2` bigint(20) unsigned NOT NULL DEFAULT '0',
`id2_type` int(10) unsigned NOT NULL DEFAULT '0',
`link_type` bigint(20) unsigned NOT NULL DEFAULT '0',
`visibility` tinyint(3) NOT NULL DEFAULT '0',
`data` varchar(255) COLLATE latin1_bin NOT NULL DEFAULT '',
`time` int(10) unsigned NOT NULL DEFAULT '0',
`version` bigint(20) unsigned NOT NULL DEFAULT '0',
PRIMARY KEY (`link_type`,`id1`,`id2`) COMMENT 'cf_link',
KEY `id1_type` (`id1`,`link_type`,`visibility`,`time`,`id2`,`version`,`data`)
COMMENT 'rev:cf_link_id1_type'
) ENGINE=ROCKSDB DEFAULT CHARSET=latin1 COLLATE=latin1_bin
ROW_FORMAT=COMPRESSED KEY_BLOCK_SIZE=8;
Warnings:
Warning	1681	Integer display width is deprecated and will be removed in a future release.
Warning	1681	Integer display width is deprecated and will be removed in a future release.
Warning	1681	Integer display width is deprecated and will be removed in a future release.
Warning	1681	Integer display width is deprecated and will be removed in a future release.
Warning	1681	Integer display width is deprecated and will be removed in a future release.
Warning	1681	Integer display width is deprecated and will be removed in a future release.
insert into link_table4 values ('a1', "rk1", 2, 2, 1, 1, 'data12', 1, 1);
insert into link_table4 values ('a1', "rk2", 3, 2, 1, 2, 'data13', 1, 1);
insert into link_table4 values ('a1', "rk3", 4, 2, 1, 2, 'data14', 1, 1);
insert into link_table4 values ('a1', "rk4", 5, 2, 1, 1, 'data15', 1, 1);
insert into link_table4 values ('b1', "rk5", 1, 2, 1, 1, 'data21', 1, 1);
insert into link_table4 values ('b1', "rk6", 2, 2, 1, 1, 'data22', 1, 1);
insert into link_table4 values ('b1', "rk7", 3, 2, 1, 1, 'data32', 1, 1);
# Default
SELECT @@rocksdb_select_bypass_policy;
@@rocksdb_select_bypass_policy
0
SELECT @@rocksdb_select_bypass_policy INTO @save_rocksdb_select_bypass_policy;
# Always off
SELECT @@rocksdb_select_bypass_policy;
@@rocksdb_select_bypass_policy
0
SET GLOBAL rocksdb_select_bypass_policy=0;
SELECT @@rocksdb_select_bypass_policy;
@@rocksdb_select_bypass_policy
0
SELECT variable_value INTO @a FROM performance_schema.global_status WHERE
variable_name="rocksdb_select_bypass_executed";
SELECT /*+ bypass */ id1,id2,id1_type,id2_type,data,version FROM link_table
WHERE id1=1 AND id2=2 AND link_type=3;
id1	id2	id1_type	id2_type	data	version
1	2	1	2	a10	125
SELECT /*+ no_bypass */ id1,id2,id1_type,id2_type,data,version FROM link_table
WHERE id1=1 AND id2=2 AND link_type=3;
id1	id2	id1_type	id2_type	data	version
1	2	1	2	a10	125
SELECT id1,id2,id1_type,id2_type,data,version FROM link_table
WHERE id1=1 AND id2=2 AND link_type=3;
id1	id2	id1_type	id2_type	data	version
1	2	1	2	a10	125
SELECT variable_value INTO @b FROM performance_schema.global_status WHERE
variable_name="rocksdb_select_bypass_executed";
# Should be 0
SELECT @b-@a;
@b-@a
0
# Always on
SELECT @@rocksdb_select_bypass_policy;
@@rocksdb_select_bypass_policy
0
SET GLOBAL rocksdb_select_bypass_policy=1;
SELECT @@rocksdb_select_bypass_policy;
@@rocksdb_select_bypass_policy
1
SELECT variable_value INTO @a FROM performance_schema.global_status WHERE
variable_name="rocksdb_select_bypass_executed";
SELECT /*+ bypass */ id1,id2,id1_type,id2_type,data,version FROM link_table
WHERE id1=1 AND id2=2 AND link_type=3;
Dump
Index=0, Order=ASC, Fields={ (Name=id1, Index=0), (Name=id2, Index=2), (Name=id1_type, Index=1), (Name=id2_type, Index=3), (Name=data, Index=6), (Name=version, Index=8) }, Cond={ (id1 == 1), (id2 == 2), (link_type == 3) }
SELECT /*+ abc */ id1,id2,id1_type,id2_type,data,version FROM link_table
WHERE id1=1 AND id2=2 AND link_type=3;
Dump
Index=0, Order=ASC, Fields={ (Name=id1, Index=0), (Name=id2, Index=2), (Name=id1_type, Index=1), (Name=id2_type, Index=3), (Name=data, Index=6), (Name=version, Index=8) }, Cond={ (id1 == 1), (id2 == 2), (link_type == 3) }
Warnings:
Warning	1064	Optimizer hint syntax error near 'abc */ id1,id2,id1_type,id2_type,data,version FROM link_table
WHERE id1=1 AND id' at line 1
SELECT /*+ no_bypass*/ id1,id2,id1_type,id2_type,data,version FROM link_table
WHERE id1=1 AND id2=2 AND link_type=3;
Dump
Index=0, Order=ASC, Fields={ (Name=id1, Index=0), (Name=id2, Index=2), (Name=id1_type, Index=1), (Name=id2_type, Index=3), (Name=data, Index=6), (Name=version, Index=8) }, Cond={ (id1 == 1), (id2 == 2), (link_type == 3) }
Warnings:
Warning	1064	Optimizer hint syntax error near 'no_bypass*/ id1,id2,id1_type,id2_type,data,version FROM link_table
WHERE id1=1 A' at line 1
SELECT id1,id2,id1_type,id2_type,data,version FROM link_table
WHERE id1=1 AND id2=2 AND link_type=3;
Dump
Index=0, Order=ASC, Fields={ (Name=id1, Index=0), (Name=id2, Index=2), (Name=id1_type, Index=1), (Name=id2_type, Index=3), (Name=data, Index=6), (Name=version, Index=8) }, Cond={ (id1 == 1), (id2 == 2), (link_type == 3) }
SELECT variable_value INTO @b FROM performance_schema.global_status WHERE
variable_name="rocksdb_select_bypass_executed";
# Should be 4
SELECT @b-@a;
@b-@a
4
# Opt-in
SELECT @@rocksdb_select_bypass_policy;
@@rocksdb_select_bypass_policy
1
SET GLOBAL rocksdb_select_bypass_policy=2;
SELECT @@rocksdb_select_bypass_policy;
@@rocksdb_select_bypass_policy
2
SELECT variable_value into @a FROM performance_schema.global_status WHERE
variable_name="rocksdb_select_bypass_executed";
SELECT /*+ bypass */ id1,id2,id1_type,id2_type,data,version FROM link_table
WHERE id1=1 AND id2=2 AND link_type=3;
Dump
Index=0, Order=ASC, Fields={ (Name=id1, Index=0), (Name=id2, Index=2), (Name=id1_type, Index=1), (Name=id2_type, Index=3), (Name=data, Index=6), (Name=version, Index=8) }, Cond={ (id1 == 1), (id2 == 2), (link_type == 3) }
SELECT /*+ no_bypass */ id1,id2,id1_type,id2_type,data,version FROM link_table
WHERE id1=1 AND id2=2 AND link_type=3;
id1	id2	id1_type	id2_type	data	version
1	2	1	2	a10	125
SELECT id1,id2,id1_type,id2_type,data,version FROM link_table
WHERE id1=1 AND id2=2 AND link_type=3;
id1	id2	id1_type	id2_type	data	version
1	2	1	2	a10	125
SELECT /*+bypassabc*/ id1,id2,id1_type,id2_type,data,version FROM link_table
WHERE id1=1 AND id2=2 AND link_type=3;
id1	id2	id1_type	id2_type	data	version
1	2	1	2	a10	125
Warnings:
Warning	1064	Optimizer hint syntax error near 'bypassabc*/ id1,id2,id1_type,id2_type,data,version FROM link_table
WHERE id1=1 A' at line 1
SELECT /*+bypass */ id1,id2,id1_type,id2_type,data,version FROM link_table
WHERE id1=1 AND id2=2 AND link_type=3;
id1	id2	id1_type	id2_type	data	version
1	2	1	2	a10	125
Warnings:
Warning	1064	Optimizer hint syntax error near 'bypass */ id1,id2,id1_type,id2_type,data,version FROM link_table
WHERE id1=1 AND' at line 1
SELECT /*+ bypass*/ id1,id2,id1_type,id2_type,data,version FROM link_table
WHERE id1=1 AND id2=2 AND link_type=3;
id1	id2	id1_type	id2_type	data	version
1	2	1	2	a10	125
Warnings:
Warning	1064	Optimizer hint syntax error near 'bypass*/ id1,id2,id1_type,id2_type,data,version FROM link_table
WHERE id1=1 AND ' at line 1
SELECT /* +bypassabc*/ id1,id2,id1_type,id2_type,data,version FROM link_table
WHERE id1=1 AND id2=2 AND link_type=3;
id1	id2	id1_type	id2_type	data	version
1	2	1	2	a10	125
SELECT /*aaaaaaaaabbbbbbbbb*/ id1,id2,id1_type,id2_type,data,version
FROM link_table WHERE id1=1 AND id2=2 AND link_type=3;
id1	id2	id1_type	id2_type	data	version
1	2	1	2	a10	125
SELECT /*+*/ id1,id2,id1_type,id2_type,data,version FROM link_table
WHERE id1=1 AND id2=2 AND link_type=3;
id1	id2	id1_type	id2_type	data	version
1	2	1	2	a10	125
Warnings:
Warning	1064	Optimizer hint syntax error near '*/' at line 1
SELECT /*+b*/ id1,id2,id1_type,id2_type,data,version FROM link_table
WHERE id1=1 AND id2=2 AND link_type=3;
id1	id2	id1_type	id2_type	data	version
1	2	1	2	a10	125
Warnings:
Warning	1064	Optimizer hint syntax error near 'b*/ id1,id2,id1_type,id2_type,data,version FROM link_table
WHERE id1=1 AND id2=2' at line 1
SELECT /*+byp*/ id1,id2,id1_type,id2_type,data,version FROM link_table
WHERE id1=1 AND id2=2 AND link_type=3;
id1	id2	id1_type	id2_type	data	version
1	2	1	2	a10	125
Warnings:
Warning	1064	Optimizer hint syntax error near 'byp*/ id1,id2,id1_type,id2_type,data,version FROM link_table
WHERE id1=1 AND id2' at line 1
SELECT /*+bypw*/ id1,id2,id1_type,id2_type,data,version FROM link_table
WHERE id1=1 AND id2=2 AND link_type=3;
id1	id2	id1_type	id2_type	data	version
1	2	1	2	a10	125
Warnings:
Warning	1064	Optimizer hint syntax error near 'bypw*/ id1,id2,id1_type,id2_type,data,version FROM link_table
WHERE id1=1 AND id' at line 1
SELECT /*-b*/ id1,id2,id1_type,id2_type,data,version FROM link_table
WHERE id1=1 AND id2=2 AND link_type=3;
id1	id2	id1_type	id2_type	data	version
1	2	1	2	a10	125
SELECT /**/ id1,id2,id1_type,id2_type,data,version FROM link_table
WHERE id1=1 AND id2=2 AND link_type=3;
id1	id2	id1_type	id2_type	data	version
1	2	1	2	a10	125
SELECT variable_value INTO @b FROM performance_schema.global_status WHERE
variable_name="rocksdb_select_bypass_executed";
# Should be 1
SELECT @b-@a;
@b-@a
1
# Opt-out
select @@rocksdb_select_bypass_policy;
@@rocksdb_select_bypass_policy
2
set global rocksdb_select_bypass_policy=3;
select @@rocksdb_select_bypass_policy;
@@rocksdb_select_bypass_policy
3
SELECT variable_value INTO @a FROM performance_schema.global_status WHERE
variable_name="rocksdb_select_bypass_executed";
SELECT /*+ bypass */ id1,id2,id1_type,id2_type,data,version FROM link_table
WHERE id1=1 AND id2=2 AND link_type=3;
Dump
Index=0, Order=ASC, Fields={ (Name=id1, Index=0), (Name=id2, Index=2), (Name=id1_type, Index=1), (Name=id2_type, Index=3), (Name=data, Index=6), (Name=version, Index=8) }, Cond={ (id1 == 1), (id2 == 2), (link_type == 3) }
SELECT /*+bypass */ id1,id2,id1_type,id2_type,data,version FROM link_table
WHERE id1=1 AND id2=2 AND link_type=3;
Dump
Index=0, Order=ASC, Fields={ (Name=id1, Index=0), (Name=id2, Index=2), (Name=id1_type, Index=1), (Name=id2_type, Index=3), (Name=data, Index=6), (Name=version, Index=8) }, Cond={ (id1 == 1), (id2 == 2), (link_type == 3) }
Warnings:
Warning	1064	Optimizer hint syntax error near 'bypass */ id1,id2,id1_type,id2_type,data,version FROM link_table
WHERE id1=1 AND' at line 1
SELECT /*+*/ id1,id2,id1_type,id2_type,data,version FROM link_table
WHERE id1=1 AND id2=2 AND link_type=3;
Dump
Index=0, Order=ASC, Fields={ (Name=id1, Index=0), (Name=id2, Index=2), (Name=id1_type, Index=1), (Name=id2_type, Index=3), (Name=data, Index=6), (Name=version, Index=8) }, Cond={ (id1 == 1), (id2 == 2), (link_type == 3) }
Warnings:
Warning	1064	Optimizer hint syntax error near '*/' at line 1
SELECT id1,id2,id1_type,id2_type,data,version FROM link_table
WHERE id1=1 AND id2=2 AND link_type=3;
Dump
Index=0, Order=ASC, Fields={ (Name=id1, Index=0), (Name=id2, Index=2), (Name=id1_type, Index=1), (Name=id2_type, Index=3), (Name=data, Index=6), (Name=version, Index=8) }, Cond={ (id1 == 1), (id2 == 2), (link_type == 3) }
SELECT variable_value INTO @b FROM performance_schema.global_status WHERE
variable_name="rocksdb_select_bypass_executed";
# Should be 4
SELECT @b-@a;
@b-@a
4
SELECT /*+ no_bypass */ id1,id2,id1_type,id2_type,data,version FROM link_table
WHERE id1=1 AND id2=2 AND link_type=3;
id1	id2	id1_type	id2_type	data	version
1	2	1	2	a10	125
SELECT /*+ no_bypass*/ id1,id2,id1_type,id2_type,data,version FROM link_table
WHERE id1=1 AND id2=2 AND link_type=3;
Dump
Index=0, Order=ASC, Fields={ (Name=id1, Index=0), (Name=id2, Index=2), (Name=id1_type, Index=1), (Name=id2_type, Index=3), (Name=data, Index=6), (Name=version, Index=8) }, Cond={ (id1 == 1), (id2 == 2), (link_type == 3) }
Warnings:
Warning	1064	Optimizer hint syntax error near 'no_bypass*/ id1,id2,id1_type,id2_type,data,version FROM link_table
WHERE id1=1 A' at line 1
SELECT /*+no_bypass */ id1,id2,id1_type,id2_type,data,version FROM link_table
WHERE id1=1 AND id2=2 AND link_type=3;
Dump
Index=0, Order=ASC, Fields={ (Name=id1, Index=0), (Name=id2, Index=2), (Name=id1_type, Index=1), (Name=id2_type, Index=3), (Name=data, Index=6), (Name=version, Index=8) }, Cond={ (id1 == 1), (id2 == 2), (link_type == 3) }
Warnings:
Warning	1064	Optimizer hint syntax error near 'no_bypass */ id1,id2,id1_type,id2_type,data,version FROM link_table
WHERE id1=1 ' at line 1
SELECT /*+no_bypassabc */ id1,id2,id1_type,id2_type,data,version FROM link_table
WHERE id1=1 AND id2=2 AND link_type=3;
Dump
Index=0, Order=ASC, Fields={ (Name=id1, Index=0), (Name=id2, Index=2), (Name=id1_type, Index=1), (Name=id2_type, Index=3), (Name=data, Index=6), (Name=version, Index=8) }, Cond={ (id1 == 1), (id2 == 2), (link_type == 3) }
Warnings:
Warning	1064	Optimizer hint syntax error near 'no_bypassabc */ id1,id2,id1_type,id2_type,data,version FROM link_table
WHERE id1' at line 1
SELECT variable_value INTO @c FROM performance_schema.global_status WHERE
variable_name="rocksdb_select_bypass_executed";
# Should be 3
SELECT @c-@b;
@c-@b
3
# Point query
SELECT /*+ bypass */ id1,id2,id1_type,id2_type,data,version FROM link_table
WHERE id1=1 AND id2=2 AND link_type=3;
Dump
Index=0, Order=ASC, Fields={ (Name=id1, Index=0), (Name=id2, Index=2), (Name=id1_type, Index=1), (Name=id2_type, Index=3), (Name=data, Index=6), (Name=version, Index=8) }, Cond={ (id1 == 1), (id2 == 2), (link_type == 3) }
SELECT /*+ bypass */ id1,id2,id1_type,id2_type,data,version FROM link_table
WHERE id1=1 AND id2 IN (2, 3, 4) AND link_type=3;
Dump
Index=0, Order=ASC, Fields={ (Name=id1, Index=0), (Name=id2, Index=2), (Name=id1_type, Index=1), (Name=id2_type, Index=3), (Name=data, Index=6), (Name=version, Index=8) }, Cond={ (id1 == 1), (id2 IN (2,3,4)), (link_type == 3) }
SELECT /*+ bypass */ id1,id2,id1_type,id2_type,data,version FROM link_table
WHERE id1=1 AND id2 IN (2) AND link_type=3;
Dump
Index=0, Order=ASC, Fields={ (Name=id1, Index=0), (Name=id2, Index=2), (Name=id1_type, Index=1), (Name=id2_type, Index=3), (Name=data, Index=6), (Name=version, Index=8) }, Cond={ (id1 == 1), (id2 == 2), (link_type == 3) }
SELECT /*+ bypass */ id1,id2,id1_type,id2_type,data,version FROM link_table
WHERE id1 IN (1) AND id2 IN (2) AND link_type=3;
Dump
Index=0, Order=ASC, Fields={ (Name=id1, Index=0), (Name=id2, Index=2), (Name=id1_type, Index=1), (Name=id2_type, Index=3), (Name=data, Index=6), (Name=version, Index=8) }, Cond={ (id1 == 1), (id2 == 2), (link_type == 3) }
SELECT /*+ bypass */ id1,id2,id1_type,id2_type,data,version FROM link_table
WHERE id1 IN (1, 2) AND id2 IN (2, 3, 4) AND link_type=3;
Dump
Index=0, Order=ASC, Fields={ (Name=id1, Index=0), (Name=id2, Index=2), (Name=id1_type, Index=1), (Name=id2_type, Index=3), (Name=data, Index=6), (Name=version, Index=8) }, Cond={ (id1 IN (1,2)), (id2 IN (2,3,4)), (link_type == 3) }
# Prefix range query
# Prefix range query with SK
SELECT /*+ bypass */ id1, id2, link_type, visibility, data, time, version
FROM link_table FORCE INDEX (id1_type)
WHERE link_type = 3 AND id1 = 1 AND visibility = 3 AND time = 10
ORDER BY TIME DESC LIMIT 10;
Dump
Index=1, Order=DESC, Fields={ (Name=id1, Index=0), (Name=id2, Index=2), (Name=link_type, Index=4), (Name=visibility, Index=5), (Name=data, Index=6), (Name=time, Index=7), (Name=version, Index=8) }, Cond={ (link_type == 3), (id1 == 1), (visibility == 3), (time == 10) }
SELECT /*+ bypass */ id1, id2, link_type, visibility, data, time, version
FROM link_table FORCE INDEX (id1_type)
WHERE link_type = 3 AND id1 = 1 AND visibility = 3 AND time = 10
ORDER BY TIME ASC LIMIT 10;
Dump
Index=1, Order=ASC, Fields={ (Name=id1, Index=0), (Name=id2, Index=2), (Name=link_type, Index=4), (Name=visibility, Index=5), (Name=data, Index=6), (Name=time, Index=7), (Name=version, Index=8) }, Cond={ (link_type == 3), (id1 == 1), (visibility == 3), (time == 10) }
# Prefix range query with SK with limits
SELECT /*+ bypass */ id1, id2, link_type, visibility, data, time, version
FROM link_table FORCE INDEX (id1_type)
WHERE link_type = 3 AND id1 = 1 AND visibility = 4 AND time >= 10
ORDER BY TIME DESC;
Dump
Index=1, Order=DESC, Fields={ (Name=id1, Index=0), (Name=id2, Index=2), (Name=link_type, Index=4), (Name=visibility, Index=5), (Name=data, Index=6), (Name=time, Index=7), (Name=version, Index=8) }, Cond={ (link_type == 3), (id1 == 1), (visibility == 4), (time >= 10) }
SELECT /*+ bypass */ id1, id2, link_type, visibility, data, time, version
FROM link_table FORCE INDEX (id1_type)
WHERE link_type = 3 AND id1 = 1 AND visibility = 4 AND time >= 10
ORDER BY TIME DESC LIMIT 10;
Dump
Index=1, Order=DESC, Fields={ (Name=id1, Index=0), (Name=id2, Index=2), (Name=link_type, Index=4), (Name=visibility, Index=5), (Name=data, Index=6), (Name=time, Index=7), (Name=version, Index=8) }, Cond={ (link_type == 3), (id1 == 1), (visibility == 4), (time >= 10) }
SELECT /*+ bypass */ id1, id2, link_type, visibility, data, time, version
FROM link_table FORCE INDEX (id1_type)
WHERE link_type = 3 AND id1 = 1 AND visibility = 4 AND time >= 10
ORDER BY TIME DESC LIMIT 5;
Dump
Index=1, Order=DESC, Fields={ (Name=id1, Index=0), (Name=id2, Index=2), (Name=link_type, Index=4), (Name=visibility, Index=5), (Name=data, Index=6), (Name=time, Index=7), (Name=version, Index=8) }, Cond={ (link_type == 3), (id1 == 1), (visibility == 4), (time >= 10) }
SELECT /*+ bypass */ id1, id2, link_type, visibility, data, time, version
FROM link_table FORCE INDEX (id1_type)
WHERE link_type = 3 AND id1 = 1 AND visibility = 4 AND time >= 10
ORDER BY TIME DESC LIMIT 1;
Dump
Index=1, Order=DESC, Fields={ (Name=id1, Index=0), (Name=id2, Index=2), (Name=link_type, Index=4), (Name=visibility, Index=5), (Name=data, Index=6), (Name=time, Index=7), (Name=version, Index=8) }, Cond={ (link_type == 3), (id1 == 1), (visibility == 4), (time >= 10) }
SELECT /*+ bypass */ id1, id2, link_type, visibility, data, time, version
FROM link_table FORCE INDEX (id1_type)
WHERE link_type = 3 AND id1 = 1 AND visibility = 4 AND time >= 10
ORDER BY TIME DESC LIMIT 0;
Dump
Index=1, Order=DESC, Fields={ (Name=id1, Index=0), (Name=id2, Index=2), (Name=link_type, Index=4), (Name=visibility, Index=5), (Name=data, Index=6), (Name=time, Index=7), (Name=version, Index=8) }, Cond={ (link_type == 3), (id1 == 1), (visibility == 4), (time >= 10) }
SELECT /*+ bypass */ id1, id2, link_type, visibility, data, time, version
FROM link_table FORCE INDEX (id1_type)
WHERE link_type = 3 AND id1 = 1 AND visibility = 4 AND time >= 10
ORDER BY TIME DESC LIMIT 0,10;
Dump
Index=1, Order=DESC, Fields={ (Name=id1, Index=0), (Name=id2, Index=2), (Name=link_type, Index=4), (Name=visibility, Index=5), (Name=data, Index=6), (Name=time, Index=7), (Name=version, Index=8) }, Cond={ (link_type == 3), (id1 == 1), (visibility == 4), (time >= 10) }
SELECT /*+ bypass */ id1, id2, link_type, visibility, data, time, version
FROM link_table FORCE INDEX (id1_type)
WHERE link_type = 3 AND id1 = 1 AND visibility = 4 AND time >= 10
ORDER BY TIME DESC LIMIT 0,5;
Dump
Index=1, Order=DESC, Fields={ (Name=id1, Index=0), (Name=id2, Index=2), (Name=link_type, Index=4), (Name=visibility, Index=5), (Name=data, Index=6), (Name=time, Index=7), (Name=version, Index=8) }, Cond={ (link_type == 3), (id1 == 1), (visibility == 4), (time >= 10) }
SELECT /*+ bypass */ id1, id2, link_type, visibility, data, time, version
FROM link_table FORCE INDEX (id1_type)
WHERE link_type = 3 AND id1 = 1 AND visibility = 4 AND time >= 10
ORDER BY TIME DESC LIMIT 0,1;
Dump
Index=1, Order=DESC, Fields={ (Name=id1, Index=0), (Name=id2, Index=2), (Name=link_type, Index=4), (Name=visibility, Index=5), (Name=data, Index=6), (Name=time, Index=7), (Name=version, Index=8) }, Cond={ (link_type == 3), (id1 == 1), (visibility == 4), (time >= 10) }
SELECT /*+ bypass */ id1, id2, link_type, visibility, data, time, version
FROM link_table FORCE INDEX (id1_type)
WHERE link_type = 3 AND id1 = 1 AND visibility = 4 AND time >= 10
ORDER BY TIME DESC LIMIT 1,0;
Dump
Index=1, Order=DESC, Fields={ (Name=id1, Index=0), (Name=id2, Index=2), (Name=link_type, Index=4), (Name=visibility, Index=5), (Name=data, Index=6), (Name=time, Index=7), (Name=version, Index=8) }, Cond={ (link_type == 3), (id1 == 1), (visibility == 4), (time >= 10) }
SELECT /*+ bypass */ id1, id2, link_type, visibility, data, time, version
FROM link_table FORCE INDEX (id1_type)
WHERE link_type = 3 AND id1 = 1 AND visibility = 4 AND time >= 10
ORDER BY TIME DESC LIMIT 1,10;
Dump
Index=1, Order=DESC, Fields={ (Name=id1, Index=0), (Name=id2, Index=2), (Name=link_type, Index=4), (Name=visibility, Index=5), (Name=data, Index=6), (Name=time, Index=7), (Name=version, Index=8) }, Cond={ (link_type == 3), (id1 == 1), (visibility == 4), (time >= 10) }
SELECT /*+ bypass */ id1, id2, link_type, visibility, data, time, version
FROM link_table FORCE INDEX (id1_type)
WHERE link_type = 3 AND id1 = 1 AND visibility = 4 AND time >= 10
ORDER BY TIME DESC LIMIT 1,5;
Dump
Index=1, Order=DESC, Fields={ (Name=id1, Index=0), (Name=id2, Index=2), (Name=link_type, Index=4), (Name=visibility, Index=5), (Name=data, Index=6), (Name=time, Index=7), (Name=version, Index=8) }, Cond={ (link_type == 3), (id1 == 1), (visibility == 4), (time >= 10) }
SELECT /*+ bypass */ id1, id2, link_type, visibility, data, time, version
FROM link_table FORCE INDEX (id1_type)
WHERE link_type = 3 AND id1 = 1 AND visibility = 4 AND time >= 10
ORDER BY TIME DESC LIMIT 1,1;
Dump
Index=1, Order=DESC, Fields={ (Name=id1, Index=0), (Name=id2, Index=2), (Name=link_type, Index=4), (Name=visibility, Index=5), (Name=data, Index=6), (Name=time, Index=7), (Name=version, Index=8) }, Cond={ (link_type == 3), (id1 == 1), (visibility == 4), (time >= 10) }
SELECT /*+ bypass */ id1, id2, link_type, visibility, data, time, version
FROM link_table FORCE INDEX (id1_type)
WHERE link_type = 3 AND id1 = 1 AND visibility = 4 AND time >= 10
ORDER BY TIME DESC LIMIT 1,0;
Dump
Index=1, Order=DESC, Fields={ (Name=id1, Index=0), (Name=id2, Index=2), (Name=link_type, Index=4), (Name=visibility, Index=5), (Name=data, Index=6), (Name=time, Index=7), (Name=version, Index=8) }, Cond={ (link_type == 3), (id1 == 1), (visibility == 4), (time >= 10) }
SELECT /*+ bypass */ id1, id2, link_type, visibility, data, time, version
FROM link_table FORCE INDEX (id1_type)
WHERE link_type = 3 AND id1 = 1 AND visibility = 4 AND time >= 10
ORDER BY TIME DESC LIMIT 5,10;
Dump
Index=1, Order=DESC, Fields={ (Name=id1, Index=0), (Name=id2, Index=2), (Name=link_type, Index=4), (Name=visibility, Index=5), (Name=data, Index=6), (Name=time, Index=7), (Name=version, Index=8) }, Cond={ (link_type == 3), (id1 == 1), (visibility == 4), (time >= 10) }
SELECT /*+ bypass */ id1, id2, link_type, visibility, data, time, version
FROM link_table FORCE INDEX (id1_type)
WHERE link_type = 3 AND id1 = 1 AND visibility = 4 AND time >= 10
ORDER BY TIME DESC LIMIT 5,5;
Dump
Index=1, Order=DESC, Fields={ (Name=id1, Index=0), (Name=id2, Index=2), (Name=link_type, Index=4), (Name=visibility, Index=5), (Name=data, Index=6), (Name=time, Index=7), (Name=version, Index=8) }, Cond={ (link_type == 3), (id1 == 1), (visibility == 4), (time >= 10) }
SELECT /*+ bypass */ id1, id2, link_type, visibility, data, time, version
FROM link_table FORCE INDEX (id1_type)
WHERE link_type = 3 AND id1 = 1 AND visibility = 4 AND time >= 10
ORDER BY TIME DESC LIMIT 5,1;
Dump
Index=1, Order=DESC, Fields={ (Name=id1, Index=0), (Name=id2, Index=2), (Name=link_type, Index=4), (Name=visibility, Index=5), (Name=data, Index=6), (Name=time, Index=7), (Name=version, Index=8) }, Cond={ (link_type == 3), (id1 == 1), (visibility == 4), (time >= 10) }
SELECT /*+ bypass */ id1, id2, link_type, visibility, data, time, version
FROM link_table FORCE INDEX (id1_type)
WHERE link_type = 3 AND id1 = 1 AND visibility = 4 AND time >= 10
ORDER BY TIME DESC LIMIT 5,0;
Dump
Index=1, Order=DESC, Fields={ (Name=id1, Index=0), (Name=id2, Index=2), (Name=link_type, Index=4), (Name=visibility, Index=5), (Name=data, Index=6), (Name=time, Index=7), (Name=version, Index=8) }, Cond={ (link_type == 3), (id1 == 1), (visibility == 4), (time >= 10) }
SELECT /*+ bypass */ id1, id2, link_type, visibility, data, time, version
FROM link_table FORCE INDEX (id1_type)
WHERE link_type = 3 AND id1 = 1 AND visibility = 4 AND time >= 10
ORDER BY TIME DESC LIMIT 10,10;
Dump
Index=1, Order=DESC, Fields={ (Name=id1, Index=0), (Name=id2, Index=2), (Name=link_type, Index=4), (Name=visibility, Index=5), (Name=data, Index=6), (Name=time, Index=7), (Name=version, Index=8) }, Cond={ (link_type == 3), (id1 == 1), (visibility == 4), (time >= 10) }
SELECT /*+ bypass */ id1, id2, link_type, visibility, data, time, version
FROM link_table FORCE INDEX (id1_type)
WHERE link_type = 3 AND id1 = 1 AND visibility = 4 AND time >= 10
ORDER BY TIME DESC LIMIT 10,5;
Dump
Index=1, Order=DESC, Fields={ (Name=id1, Index=0), (Name=id2, Index=2), (Name=link_type, Index=4), (Name=visibility, Index=5), (Name=data, Index=6), (Name=time, Index=7), (Name=version, Index=8) }, Cond={ (link_type == 3), (id1 == 1), (visibility == 4), (time >= 10) }
SELECT /*+ bypass */ id1, id2, link_type, visibility, data, time, version
FROM link_table FORCE INDEX (id1_type)
WHERE link_type = 3 AND id1 = 1 AND visibility = 4 AND time >= 10
ORDER BY TIME DESC LIMIT 10,1;
Dump
Index=1, Order=DESC, Fields={ (Name=id1, Index=0), (Name=id2, Index=2), (Name=link_type, Index=4), (Name=visibility, Index=5), (Name=data, Index=6), (Name=time, Index=7), (Name=version, Index=8) }, Cond={ (link_type == 3), (id1 == 1), (visibility == 4), (time >= 10) }
SELECT /*+ bypass */ id1, id2, link_type, visibility, data, time, version
FROM link_table FORCE INDEX (id1_type)
WHERE link_type = 3 AND id1 = 1 AND visibility = 4 AND time >= 10
ORDER BY TIME DESC LIMIT 10,0;
Dump
Index=1, Order=DESC, Fields={ (Name=id1, Index=0), (Name=id2, Index=2), (Name=link_type, Index=4), (Name=visibility, Index=5), (Name=data, Index=6), (Name=time, Index=7), (Name=version, Index=8) }, Cond={ (link_type == 3), (id1 == 1), (visibility == 4), (time >= 10) }
# Prefix range query with PK
SELECT /*+ bypass */ id1, id2, link_type FROM link_table FORCE INDEX (PRIMARY)
WHERE link_type=3 AND id1=1 ORDER BY id2 DESC;
Dump
Index=0, Order=DESC, Fields={ (Name=id1, Index=0), (Name=id2, Index=2), (Name=link_type, Index=4) }, Cond={ (link_type == 3), (id1 == 1) }
SELECT /*+ bypass */ id1, id2, link_type FROM link_table FORCE INDEX (PRIMARY)
WHERE link_type=3 AND id1=1 ORDER BY id2 ASC;
Dump
Index=0, Order=ASC, Fields={ (Name=id1, Index=0), (Name=id2, Index=2), (Name=link_type, Index=4) }, Cond={ (link_type == 3), (id1 == 1) }
# Prefix range query with PK + value
SELECT /*+ bypass */ id1, id2, link_type, visibility, data, time, version
FROM link_table FORCE INDEX (PRIMARY)
WHERE link_type=3 AND id1=1 ORDER BY id2 DESC;
Dump
Index=0, Order=DESC, Fields={ (Name=id1, Index=0), (Name=id2, Index=2), (Name=link_type, Index=4), (Name=visibility, Index=5), (Name=data, Index=6), (Name=time, Index=7), (Name=version, Index=8) }, Cond={ (link_type == 3), (id1 == 1) }
SELECT /*+ bypass */ id1, id2, link_type, visibility, data, time, version
FROM link_table FORCE INDEX (PRIMARY)
WHERE link_type=3 AND id1=1 ORDER BY id2 ASC;
Dump
Index=0, Order=ASC, Fields={ (Name=id1, Index=0), (Name=id2, Index=2), (Name=link_type, Index=4), (Name=visibility, Index=5), (Name=data, Index=6), (Name=time, Index=7), (Name=version, Index=8) }, Cond={ (link_type == 3), (id1 == 1) }
# Transaction
BEGIN;
SELECT /*+ bypass */ id1,id2,id1_type,id2_type,data,version FROM link_table
WHERE id1=1 AND id2=2 AND link_type=3;
Dump
Index=0, Order=ASC, Fields={ (Name=id1, Index=0), (Name=id2, Index=2), (Name=id1_type, Index=1), (Name=id2_type, Index=3), (Name=data, Index=6), (Name=version, Index=8) }, Cond={ (id1 == 1), (id2 == 2), (link_type == 3) }
UPDATE link_table set data="bcd" WHERE id1=1 AND id2=2 AND link_type = 3;
SELECT /*+ bypass */ id1,id2,id1_type,id2_type,data,version FROM link_table
WHERE id1=1 AND id2=2 AND link_type=3;
Dump
Index=0, Order=ASC, Fields={ (Name=id1, Index=0), (Name=id2, Index=2), (Name=id1_type, Index=1), (Name=id2_type, Index=3), (Name=data, Index=6), (Name=version, Index=8) }, Cond={ (id1 == 1), (id2 == 2), (link_type == 3) }
COMMIT;
BEGIN;
SELECT /*+ bypass */ id1,id2,id1_type,id2_type,data,version FROM link_table
WHERE id1=1 AND id2=2 AND link_type=3;
Dump
Index=0, Order=ASC, Fields={ (Name=id1, Index=0), (Name=id2, Index=2), (Name=id1_type, Index=1), (Name=id2_type, Index=3), (Name=data, Index=6), (Name=version, Index=8) }, Cond={ (id1 == 1), (id2 == 2), (link_type == 3) }
UPDATE link_table set data="cde" WHERE id1=1 AND id2=2 AND link_type = 3;
SELECT /*+ bypass */ id1,id2,id1_type,id2_type,data,version FROM link_table
WHERE id1=1 AND id2=2 AND link_type=3;
Dump
Index=0, Order=ASC, Fields={ (Name=id1, Index=0), (Name=id2, Index=2), (Name=id1_type, Index=1), (Name=id2_type, Index=3), (Name=data, Index=6), (Name=version, Index=8) }, Cond={ (id1 == 1), (id2 == 2), (link_type == 3) }
ROLLBACK;
SELECT /*+ bypass */ id1,id2,id1_type,id2_type,data,version FROM link_table
WHERE id1=1 AND id2=2 AND link_type=3;
Dump
Index=0, Order=ASC, Fields={ (Name=id1, Index=0), (Name=id2, Index=2), (Name=id1_type, Index=1), (Name=id2_type, Index=3), (Name=data, Index=6), (Name=version, Index=8) }, Cond={ (id1 == 1), (id2 == 2), (link_type == 3) }
# Data types
SELECT /*+ bypass */ id1 FROM link_table where link_type="3";
Dump
Index=0, Order=ASC, Fields={ (Name=id1, Index=0) }, Cond={ (link_type == 3) }
SELECT /*+ bypass */ id1 FROM link_table where link_type="3" AND id1="1";
Dump
Index=0, Order=ASC, Fields={ (Name=id1, Index=0) }, Cond={ (link_type == 3), (id1 == 1) }
SELECT /*+ bypass */ id1 FROM link_table where link_type="3" AND id1=True;
Dump
Index=0, Order=ASC, Fields={ (Name=id1, Index=0) }, Cond={ (link_type == 3), (id1 == 1) }
SELECT /*+ bypass */ id1 FROM link_table where link_type="3" AND id1=b'1';
Dump
Index=0, Order=ASC, Fields={ (Name=id1, Index=0) }, Cond={ (link_type == 3), (id1 == 1) }
SELECT /*+ bypass */ id1 FROM link_table where link_type="3" AND id1=x'61';
Dump
Index=0, Order=ASC, Fields={ (Name=id1, Index=0) }, Cond={ (link_type == 3), (id1 == 97) }
SELECT /*+ bypass */ id1 FROM link_table where link_type="3" AND id1=NULL;
Dump
Index=0, Order=ASC, Fields={ (Name=id1, Index=0) }, Cond={ (link_type == 3), (id1 == NULL) }
# Full table scan
SELECT /*+ bypass */ id1,id2,id1_type,id2_type,data,version FROM link_table
WHERE id1_type=1;
Dump
Index=0, Order=ASC, Fields={ (Name=id1, Index=0), (Name=id2, Index=2), (Name=id1_type, Index=1), (Name=id2_type, Index=3), (Name=data, Index=6), (Name=version, Index=8) }, Cond={ (id1_type == 1) }
DROP TABLE count_table;
DROP TABLE link_table;
DROP TABLE link_table3;
DROP TABLE link_table2;
DROP TABLE id_table;
DROP TABLE node_table;
DROP TABLE link_table5;
DROP TABLE link_table6;
DROP TABLE link_table4;
SELECT @@rocksdb_select_bypass_policy;
@@rocksdb_select_bypass_policy
3
set global rocksdb_select_bypass_policy=@save_rocksdb_select_bypass_policy;
SELECT @@rocksdb_select_bypass_policy;
@@rocksdb_select_bypass_policy
0
