DROP TABLE IF EXISTS t1;
create table t1(
id bigint not null primary key, 
i1 bigint, #unique
i2 bigint, #repeating
c1 varchar(20), #unique
c2 varchar(20) #repeating
) engine=rocksdb;
create index t1_1 on t1 (id, i1);
create index t1_2 on t1 (i1, i2);
create index t1_3 on t1 (i2, i1);
create index t1_4 on t1 (c1, c2);
create index t1_5 on t1 (c2, c1);
SET GLOBAL rocksdb_force_flush_memtable_now = 1;
show index in t1;
Table	Non_unique	Key_name	Seq_in_index	Column_name	Collation	Cardinality	Sub_part	Packed	Null	Index_type	Comment	Index_comment
t1	0	PRIMARY	1	id	A	100000	NULL	NULL		BTREE		
t1	1	t1_1	1	id	A	100000	NULL	NULL		BTREE		
t1	1	t1_1	2	i1	A	100000	NULL	NULL	YES	BTREE		
t1	1	t1_2	1	i1	A	100000	NULL	NULL	YES	BTREE		
t1	1	t1_2	2	i2	A	100000	NULL	NULL	YES	BTREE		
t1	1	t1_3	1	i2	A	11111	NULL	NULL	YES	BTREE		
t1	1	t1_3	2	i1	A	100000	NULL	NULL	YES	BTREE		
t1	1	t1_4	1	c1	A	100000	NULL	NULL	YES	BTREE		
t1	1	t1_4	2	c2	A	100000	NULL	NULL	YES	BTREE		
t1	1	t1_5	1	c2	A	11111	NULL	NULL	YES	BTREE		
t1	1	t1_5	2	c1	A	100000	NULL	NULL	YES	BTREE		
SELECT table_name, table_rows FROM information_schema.tables WHERE table_schema = DATABASE();
table_name	table_rows
t1	100000
update t1 set i1=i1+1;
SET GLOBAL rocksdb_force_flush_memtable_now = 1;
show index in t1;
Table	Non_unique	Key_name	Seq_in_index	Column_name	Collation	Cardinality	Sub_part	Packed	Null	Index_type	Comment	Index_comment
t1	0	PRIMARY	1	id	A	200000	NULL	NULL		BTREE		
t1	1	t1_1	1	id	A	200000	NULL	NULL		BTREE		
t1	1	t1_1	2	i1	A	200000	NULL	NULL	YES	BTREE		
t1	1	t1_2	1	i1	A	200000	NULL	NULL	YES	BTREE		
t1	1	t1_2	2	i2	A	200000	NULL	NULL	YES	BTREE		
t1	1	t1_3	1	i2	A	22222	NULL	NULL	YES	BTREE		
t1	1	t1_3	2	i1	A	200000	NULL	NULL	YES	BTREE		
t1	1	t1_4	1	c1	A	200000	NULL	NULL	YES	BTREE		
t1	1	t1_4	2	c2	A	200000	NULL	NULL	YES	BTREE		
t1	1	t1_5	1	c2	A	22222	NULL	NULL	YES	BTREE		
t1	1	t1_5	2	c1	A	200000	NULL	NULL	YES	BTREE		
SELECT table_name, table_rows FROM information_schema.tables WHERE table_schema = DATABASE();
table_name	table_rows
t1	200000
delete from t1 where i1%2 =0;
SET GLOBAL rocksdb_force_flush_memtable_now = 1;
show index in t1;
Table	Non_unique	Key_name	Seq_in_index	Column_name	Collation	Cardinality	Sub_part	Packed	Null	Index_type	Comment	Index_comment
t1	0	PRIMARY	1	id	A	350000	NULL	NULL		BTREE		
t1	1	t1_1	1	id	A	350000	NULL	NULL		BTREE		
t1	1	t1_1	2	i1	A	350000	NULL	NULL	YES	BTREE		
t1	1	t1_2	1	i1	A	350000	NULL	NULL	YES	BTREE		
t1	1	t1_2	2	i2	A	350000	NULL	NULL	YES	BTREE		
t1	1	t1_3	1	i2	A	38888	NULL	NULL	YES	BTREE		
t1	1	t1_3	2	i1	A	350000	NULL	NULL	YES	BTREE		
t1	1	t1_4	1	c1	A	350000	NULL	NULL	YES	BTREE		
t1	1	t1_4	2	c2	A	350000	NULL	NULL	YES	BTREE		
t1	1	t1_5	1	c2	A	38888	NULL	NULL	YES	BTREE		
t1	1	t1_5	2	c1	A	350000	NULL	NULL	YES	BTREE		
SELECT table_name, table_rows FROM information_schema.tables WHERE table_schema = DATABASE();
table_name	table_rows
t1	350000
restarting...
show index in t1;
Table	Non_unique	Key_name	Seq_in_index	Column_name	Collation	Cardinality	Sub_part	Packed	Null	Index_type	Comment	Index_comment
t1	0	PRIMARY	1	id	A	300000	NULL	NULL		BTREE		
t1	1	t1_1	1	id	A	300000	NULL	NULL		BTREE		
t1	1	t1_1	2	i1	A	300000	NULL	NULL	YES	BTREE		
t1	1	t1_2	1	i1	A	300000	NULL	NULL	YES	BTREE		
t1	1	t1_2	2	i2	A	300000	NULL	NULL	YES	BTREE		
t1	1	t1_3	1	i2	A	18750	NULL	NULL	YES	BTREE		
t1	1	t1_3	2	i1	A	300000	NULL	NULL	YES	BTREE		
t1	1	t1_4	1	c1	A	300000	NULL	NULL	YES	BTREE		
t1	1	t1_4	2	c2	A	300000	NULL	NULL	YES	BTREE		
t1	1	t1_5	1	c2	A	33333	NULL	NULL	YES	BTREE		
t1	1	t1_5	2	c1	A	300000	NULL	NULL	YES	BTREE		
SELECT table_name, table_rows FROM information_schema.tables WHERE table_schema = DATABASE();
table_name	table_rows
t1	300000
drop table t1;
