DROP TABLE IF EXISTS T1;

#VARCHAR Index with total VARCHAR keys > MAX_REF_PARTS(16)

CREATE TABLE T1 (
P1 VARCHAR(64), P2 VARCHAR(64), P3 VARCHAR(64), P4 VARCHAR(64),
S1 VARCHAR(64), S2 VARCHAR(64), S3 VARCHAR(64), S4 VARCHAR(64),
S5 VARCHAR(64), S6 VARCHAR(64), S7 VARCHAR(64), S8 VARCHAR(64),
S9 VARCHAR(64), S10 VARCHAR(64), S11 VARCHAR(64), S12 VARCHAR(64),
S13 VARCHAR(64), S14 VARCHAR(64), S15 VARCHAR(64), S16 VARCHAR(64),
PRIMARY KEY (P1(8), P2(8), P3(8), P4(8)),
KEY SK (S1(8), S2(8), S3(8), S4(8),
S5(8), S6(8), S7(8), S8(8),
S9(8), S10(8), S11(8), S12(8),
S13(8), S14(8), S15(8), S16(8))
) ENGINE=rocksdb;
INSERT INTO T1 VALUES ('1', '2', '3', '4',
'5', '6', '7', '8',
'9', '10', '11', '12',
'13', '14', '15', '16',
'17', '18', '19', '20');
SELECT * FROM T1;
P1	P2	P3	P4	S1	S2	S3	S4	S5	S6	S7	S8	S9	S10	S11	S12	S13	S14	S15	S16
1	2	3	4	5	6	7	8	9	10	11	12	13	14	15	16	17	18	19	20
# Not eligible for optimization, shorter than prefix length.
SELECT P4, S2 FROM T1 FORCE INDEX(SK) WHERE S1='5';
P4	S2
4	6
include/assert.inc [Not eligible for optimization, shorter than prefix length.: 0 rocksdb_covered_secondary_key_lookups]
DELETE FROM T1;
INSERT INTO T1 VALUES ('100000000', '200000000', '300000000', '400000000',
'500000000', '600000000', '700000000', '800000000',
'900000000', '100000000', '110000000', '120000000',
'130000000', '140000000', '150000000', '160000000',
'170000000', '180000000', '190000000', '200000000');
# Not eligible for optimization, longer than prefix length.
SELECT P4, S2 FROM T1 FORCE INDEX(SK) WHERE S1='500000000';
P4	S2
400000000	600000000
include/assert.inc [Not eligible for optimization, longer than prefix length.: 0 rocksdb_covered_secondary_key_lookups]
DROP TABLE T1;

#TEXT Index with total TEXT keys > MAX_REF_PARTS(16)

CREATE TABLE T1 (
P1 TEXT, P2 TEXT, P3 TEXT, P4 TEXT,
S1 TEXT, S2 TEXT, S3 TEXT, S4 TEXT,
S5 TEXT, S6 TEXT, S7 TEXT, S8 TEXT,
S9 TEXT, S10 TEXT, S11 TEXT, S12 TEXT,
S13 TEXT, S14 TEXT, S15 TEXT, S16 TEXT,
PRIMARY KEY (P1(8), P2(8), P3(8), P4(8)),
KEY SK (S1(8), S2(8), S3(8), S4(8),
S5(8), S6(8), S7(8), S8(8),
S9(8), S10(8), S11(8), S12(8),
S13(8), S14(8), S15(8), S16(8))
) ENGINE=rocksdb;
INSERT INTO T1 VALUES ('1', '2', '3', '4',
'5', '6', '7', '8',
'9', '10', '11', '12',
'13', '14', '15', '16',
'17', '18', '19', '20');
SELECT * FROM T1;
P1	P2	P3	P4	S1	S2	S3	S4	S5	S6	S7	S8	S9	S10	S11	S12	S13	S14	S15	S16
1	2	3	4	5	6	7	8	9	10	11	12	13	14	15	16	17	18	19	20
# Not eligible for optimization, shorter than prefix length.
SELECT P4, S2 FROM T1 FORCE INDEX(SK) WHERE S1='5';
P4	S2
4	6
include/assert.inc [Not eligible for optimization, shorter than prefix length.: 0 rocksdb_covered_secondary_key_lookups]
DELETE FROM T1;
INSERT INTO T1 VALUES ('100000000', '200000000', '300000000', '400000000',
'500000000', '600000000', '700000000', '800000000',
'900000000', '100000000', '110000000', '120000000',
'130000000', '140000000', '150000000', '160000000',
'170000000', '180000000', '190000000', '200000000');
# Not eligible for optimization, longer than prefix length.
SELECT P4, S2 FROM T1 FORCE INDEX(SK) WHERE S1='500000000';
P4	S2
400000000	600000000
include/assert.inc [Not eligible for optimization, longer than prefix length.: 0 rocksdb_covered_secondary_key_lookups]
DELETE FROM T1;
INSERT INTO T1 VALUES ('10000000', '20000000', '30000000', '40000000',
'50000000', '60000000', '70000000', '80000000',
'90000000', '10000000', '11000000', '12000000',
'13000000', '14000000', '15000000', '16000000',
'17000000', '18000000', '19000000', '20000000');
# Not eligible for optimization, equal to prefix length.
SELECT P4, S2 FROM T1 FORCE INDEX(SK) WHERE S1='50000000';
P4	S2
40000000	60000000
include/assert.inc [Not eligible for optimization, equal to prefix length.: 0 rocksdb_covered_secondary_key_lookups]
DROP TABLE T1;
#VARCHAR Index with total VARCHAR keys = MAX_REF_PARTS(16)
CREATE TABLE T1 (
P1 INT,
S1 VARCHAR(64), S2 VARCHAR(64), S3 VARCHAR(64), S4 VARCHAR(64),
S5 VARCHAR(64), S6 VARCHAR(64), S7 VARCHAR(64), S8 VARCHAR(64),
S9 VARCHAR(64), S10 VARCHAR(64), S11 VARCHAR(64), S12 VARCHAR(64),
S13 VARCHAR(64), S14 VARCHAR(64), S15 VARCHAR(64), S16 VARCHAR(64),
PRIMARY KEY (P1),
KEY SK (S1(8), S2(8), S3(8), S4(8),
S5(8), S6(8), S7(8), S8(8),
S9(8), S10(8), S11(8), S12(8),
S13(8), S14(8), S15(8), S16(8))
) ENGINE=rocksdb CHARACTER SET UTF8 COLLATE UTF8_BIN;
Warnings:
Warning	3719	'utf8' is currently an alias for the character set UTF8MB3, but will be an alias for UTF8MB4 in a future release. Please consider using UTF8MB4 in order to be unambiguous.
Warning	3778	'utf8mb3_bin' is a collation of the deprecated character set UTF8MB3. Please consider using UTF8MB4 with an appropriate collation instead.
INSERT INTO T1 VALUES (10000000,
'50000000', '60000000', '70000000', '80000000',
'90000000', '10000000', '11000000', '12000000',
'13000000', '14000000', '15000000', '16000000',
'17000000', '18000000', '19000000', '20000000');
INSERT INTO T1 VALUES (10000001,
'50000001', '60000001', '70000001', '80000001',
'90000001', '10000001', '11000001', '12000001',
'13000001', '14000001', '15000001', '16000001',
'17000001', '18000001', '19000001', '20000001');
INSERT INTO T1 VALUES (10000002,
'50000002', '60000002', '70000002', '80000002',
'90000002', '10000002', '11000002', '12000002',
'13000002', '14000002', '15000002', '16000002',
'17000002', '18000002', '19000002', '20000002');
INSERT INTO T1 VALUES (100000000,
'50000000', '600000000', '700000000', '800000000',
'900000000', '100000000', '110000000', '120000000',
'130000000', '140000000', '150000000', '160000000',
'170000000', '180000000', '190000000', '200000000');
# Eligible for optimization.
SELECT * FROM T1 FORCE INDEX(SK) WHERE S1<='50000002';
P1	S1	S2	S3	S4	S5	S6	S7	S8	S9	S10	S11	S12	S13	S14	S15	S16
10000000	50000000	60000000	70000000	80000000	90000000	10000000	11000000	12000000	13000000	14000000	15000000	16000000	17000000	18000000	19000000	20000000
100000000	50000000	600000000	700000000	800000000	900000000	100000000	110000000	120000000	130000000	140000000	150000000	160000000	170000000	180000000	190000000	200000000
10000001	50000001	60000001	70000001	80000001	90000001	10000001	11000001	12000001	13000001	14000001	15000001	16000001	17000001	18000001	19000001	20000001
10000002	50000002	60000002	70000002	80000002	90000002	10000002	11000002	12000002	13000002	14000002	15000002	16000002	17000002	18000002	19000002	20000002
include/assert.inc [Eligible for optimization.: 3 rocksdb_covered_secondary_key_lookups]
DROP TABLE T1;

#TEXT Index with total TEXT keys = MAX_REF_PARTS(16)

CREATE TABLE T1 (
P1 INT,
S1 TEXT, S2 TEXT, S3 TEXT, S4 TEXT,
S5 TEXT, S6 TEXT, S7 TEXT, S8 TEXT,
S9 TEXT, S10 TEXT, S11 TEXT, S12 TEXT,
S13 TEXT, S14 TEXT, S15 TEXT, S16 TEXT,
PRIMARY KEY (P1),
KEY SK (S1(8), S2(8), S3(8), S4(8),
S5(8), S6(8), S7(8), S8(8),
S9(8), S10(8), S11(8), S12(8),
S13(8), S14(8), S15(8), S16(8))
) ENGINE=rocksdb CHARACTER SET UTF8 COLLATE UTF8_BIN;
Warnings:
Warning	3719	'utf8' is currently an alias for the character set UTF8MB3, but will be an alias for UTF8MB4 in a future release. Please consider using UTF8MB4 in order to be unambiguous.
Warning	3778	'utf8mb3_bin' is a collation of the deprecated character set UTF8MB3. Please consider using UTF8MB4 with an appropriate collation instead.
INSERT INTO T1 VALUES (10000000,
'50000000', '60000000', '70000000', '80000000',
'90000000', '10000000', '11000000', '12000000',
'13000000', '14000000', '15000000', '16000000',
'17000000', '18000000', '19000000', '20000000');
INSERT INTO T1 VALUES (10000001,
'50000001', '60000001', '70000001', '80000001',
'90000001', '10000001', '11000001', '12000001',
'13000001', '14000001', '15000001', '16000001',
'17000001', '18000001', '19000001', '20000001');
INSERT INTO T1 VALUES (10000002,
'50000002', '60000002', '70000002', '80000002',
'90000002', '10000002', '11000002', '12000002',
'13000002', '14000002', '15000002', '16000002',
'17000002', '18000002', '19000002', '20000002');
INSERT INTO T1 VALUES (100000000,
'50000000', '600000000', '700000000', '800000000',
'900000000', '100000000', '110000000', '120000000',
'130000000', '140000000', '150000000', '160000000',
'170000000', '180000000', '190000000', '200000000');
# Eligible for optimization.
SELECT * FROM T1 FORCE INDEX(SK) WHERE S1<='50000002';
P1	S1	S2	S3	S4	S5	S6	S7	S8	S9	S10	S11	S12	S13	S14	S15	S16
10000000	50000000	60000000	70000000	80000000	90000000	10000000	11000000	12000000	13000000	14000000	15000000	16000000	17000000	18000000	19000000	20000000
100000000	50000000	600000000	700000000	800000000	900000000	100000000	110000000	120000000	130000000	140000000	150000000	160000000	170000000	180000000	190000000	200000000
10000001	50000001	60000001	70000001	80000001	90000001	10000001	11000001	12000001	13000001	14000001	15000001	16000001	17000001	18000001	19000001	20000001
10000002	50000002	60000002	70000002	80000002	90000002	10000002	11000002	12000002	13000002	14000002	15000002	16000002	17000002	18000002	19000002	20000002
include/assert.inc [Eligible for optimization.: 3 rocksdb_covered_secondary_key_lookups]
DROP TABLE T1;
