DROP TABLE IF EXISTS t1;
SET @@global.rocksdb_update_cf_options = 'default={disable_auto_compactions=true;};';
CREATE TABLE t1 (
`a` binary(8) NOT NULL,
`b` varbinary(64) NOT NULL,
`c` varbinary(256) NOT NULL,
`ts` bigint(20) UNSIGNED NOT NULL,
`value` mediumblob NOT NULL,
PRIMARY KEY (`b`,`a`,`c`)
) ENGINE=ROCKSDB DEFAULT CHARSET=latin1
COMMENT='ttl_duration=1;ttl_col=ts;';
INSERT INTO t1 values ('a', 'b', 'c', UNIX_TIMESTAMP(), 'd');
INSERT INTO t1 values ('d', 'e', 'f', UNIX_TIMESTAMP(), 'g');
SELECT COUNT(*) FROM t1;
COUNT(*)
2
set global rocksdb_force_flush_memtable_now=1;
set global rocksdb_compact_cf='default';
SELECT COUNT(*) FROM t1;
COUNT(*)
0
DROP TABLE t1;
CREATE TABLE t1 (
a bigint(20) NOT NULL,
b int NOT NULL,
ts bigint(20) UNSIGNED NOT NULL,
c int NOT NULL,
PRIMARY KEY (a)
) ENGINE=rocksdb
COMMENT='ttl_duration=1;ttl_col=ts;';
INSERT INTO t1 values (1, 3, UNIX_TIMESTAMP(), 5);
INSERT INTO t1 values (2, 4, UNIX_TIMESTAMP(), 6);
SELECT COUNT(*) FROM t1;
COUNT(*)
2
set global rocksdb_force_flush_memtable_now=1;
set global rocksdb_compact_cf='default';
SELECT COUNT(*) FROM t1;
COUNT(*)
0
DROP TABLE t1;
CREATE TABLE t1 (
a bigint(20) NOT NULL,
b int NOT NULL,
c int NOT NULL,
ts bigint(20) UNSIGNED NOT NULL,
PRIMARY KEY (a,c)
) ENGINE=rocksdb
COMMENT='ttl_duration=1;ttl_col=ts;';
INSERT INTO t1 values (1, 3, 5, UNIX_TIMESTAMP());
INSERT INTO t1 values (2, 4, 6, UNIX_TIMESTAMP());
SELECT COUNT(*) FROM t1;
COUNT(*)
2
set global rocksdb_force_flush_memtable_now=1;
set global rocksdb_compact_cf='default';
SELECT COUNT(*) FROM t1;
COUNT(*)
0
DROP TABLE t1;
CREATE TABLE t1 (
a bigint(20) NOT NULL,
b int NOT NULL,
c int NOT NULL,
ts bigint(20) UNSIGNED NOT NULL,
PRIMARY KEY (a,c)
) ENGINE=rocksdb
COMMENT='ttl_duration=1;ttl_col=ts;';
INSERT INTO t1 values (1, 3, 5, UNIX_TIMESTAMP());
INSERT INTO t1 values (2, 4, 6, UNIX_TIMESTAMP());
SELECT COUNT(*) FROM t1;
COUNT(*)
2
set global rocksdb_force_flush_memtable_now=1;
set global rocksdb_compact_cf='default';
SELECT COUNT(*) FROM t1;
COUNT(*)
0
DROP TABLE t1;
CREATE TABLE t1 (
a bigint(20) NOT NULL,
b int,
c int,
ts bigint(20) UNSIGNED NOT NULL,
PRIMARY KEY (a)
) ENGINE=rocksdb
COMMENT='ttl_duration=1;ttl_col=ts;';
INSERT INTO t1 values (1, NULL, NULL, UNIX_TIMESTAMP());
INSERT INTO t1 values (2, NULL, NULL, UNIX_TIMESTAMP());
SELECT COUNT(*) FROM t1;
COUNT(*)
2
set global rocksdb_force_flush_memtable_now=1;
set global rocksdb_compact_cf='default';
SELECT COUNT(*) FROM t1;
COUNT(*)
0
DROP TABLE t1;
CREATE TABLE t1 (
`a` binary(8) NOT NULL,
`b` varbinary(64),
`c` varbinary(256),
`ts` bigint(20) UNSIGNED NOT NULL,
`value` mediumblob NOT NULL,
PRIMARY KEY (`a`)
) ENGINE=ROCKSDB DEFAULT CHARSET=latin1
COMMENT='ttl_duration=1;ttl_col=ts;';
INSERT INTO t1 values ('a', NULL, 'bc', UNIX_TIMESTAMP(), 'd');
INSERT INTO t1 values ('d', 'efghijk', NULL, UNIX_TIMESTAMP(), 'l');
SELECT COUNT(*) FROM t1;
COUNT(*)
2
set global rocksdb_force_flush_memtable_now=1;
set global rocksdb_compact_cf='default';
SELECT COUNT(*) FROM t1;
COUNT(*)
0
DROP TABLE t1;
CREATE TABLE t1 (
a bigint(20) NOT NULL,
b int NOT NULL,
c int NOT NULL,
PRIMARY KEY (a)
) ENGINE=rocksdb
COMMENT='ttl_duration=1;';
INSERT INTO t1 values (1, 3, 5);
INSERT INTO t1 values (2, 4, 6);
SELECT COUNT(*) FROM t1;
COUNT(*)
2
set global rocksdb_force_flush_memtable_now=1;
set global rocksdb_compact_cf='default';
SELECT COUNT(*) FROM t1;
COUNT(*)
0
DROP TABLE t1;
CREATE TABLE t1 (
ts bigint(20) UNSIGNED NOT NULL,
PRIMARY KEY (ts)
) ENGINE=rocksdb
COMMENT='ttl_duration=5;ttl_col=ts;';
INSERT INTO t1 values (UNIX_TIMESTAMP());
INSERT INTO t1 values (UNIX_TIMESTAMP());
SELECT COUNT(*) FROM t1;
COUNT(*)
2
set global rocksdb_force_flush_memtable_now=1;
set global rocksdb_compact_cf='default';
SELECT COUNT(*) FROM t1;
COUNT(*)
2
set global rocksdb_compact_cf='default';
SELECT COUNT(*) FROM t1;
COUNT(*)
0
DROP TABLE t1;
CREATE TABLE t1 (
a bigint(20) NOT NULL,
b int NOT NULL,
ts bigint(20) UNSIGNED NOT NULL,
c int NOT NULL,
PRIMARY KEY (a, ts)
) ENGINE=rocksdb
COMMENT='ttl_duration=1;ttl_col=ts;';
INSERT INTO t1 values (1, 3, UNIX_TIMESTAMP(), 5);
INSERT INTO t1 values (2, 4, UNIX_TIMESTAMP(), 6);
SELECT COUNT(*) FROM t1;
COUNT(*)
2
set global rocksdb_force_flush_memtable_now=1;
set global rocksdb_compact_cf='default';
SELECT COUNT(*) FROM t1;
COUNT(*)
0
DROP TABLE t1;
CREATE TABLE t1 (
`a` binary(8) NOT NULL,
`b` varbinary(64),
`c` varbinary(256),
`ts` bigint(20) UNSIGNED NOT NULL,
`value` mediumblob NOT NULL,
PRIMARY KEY (`a`, `ts`)
) ENGINE=ROCKSDB DEFAULT CHARSET=latin1
COMMENT='ttl_duration=1;ttl_col=ts;';
INSERT INTO t1 values ('a', NULL, 'bc', UNIX_TIMESTAMP(), 'd');
INSERT INTO t1 values ('de', 'fghijk', NULL, UNIX_TIMESTAMP(), 'l');
SELECT COUNT(*) FROM t1;
COUNT(*)
2
set global rocksdb_force_flush_memtable_now=1;
set global rocksdb_compact_cf='default';
SELECT COUNT(*) FROM t1;
COUNT(*)
0
DROP TABLE t1;
CREATE TABLE t1 (
a INT NOT NULL,
b varbinary(64) NOT NULL,
c varbinary(256) NOT NULL,
ts bigint(20) UNSIGNED NOT NULL,
value mediumblob NOT NULL,
PRIMARY KEY (b,a,c)
) ENGINE=ROCKSDB DEFAULT CHARSET=latin1
COMMENT='ttl_duration=10;ttl_col=ts;';
INSERT INTO t1 values (1, 'b', 'c', UNIX_TIMESTAMP(), 'd');
INSERT INTO t1 values (2, 'e', 'f', UNIX_TIMESTAMP(), 'g');
INSERT INTO t1 values (3, 'i', 'j', UNIX_TIMESTAMP(), 'k');
INSERT INTO t1 values (4, 'm', 'n', UNIX_TIMESTAMP(), 'o');
set global rocksdb_force_flush_memtable_now=1;
set global rocksdb_compact_cf='default';
SELECT a FROM t1;
a
1
2
3
4
set global rocksdb_compact_cf='default';
SELECT a FROM t1;
a
3
4
set global rocksdb_compact_cf='default';
SELECT a FROM t1;
a
DROP TABLE t1;
CREATE TABLE t1 (
a bigint(20) UNSIGNED NOT NULL,
b int NOT NULL,
c int NOT NULL,
ts bigint(20),
PRIMARY KEY (a,c)
) ENGINE=rocksdb
COMMENT='ttl_duration=1;ttl_col=ts;';
ERROR HY000: TTL column (ts) in MyRocks must be an unsigned non-null 64-bit integer, exist inside the table, and have an accompanying ttl duration.
CREATE TABLE t1 (
a bigint(20) UNSIGNED NOT NULL,
b int NOT NULL,
c int NOT NULL,
ts int,
PRIMARY KEY (a,c)
) ENGINE=rocksdb
COMMENT='ttl_duration=1;ttl_col=ts;';
ERROR HY000: TTL column (ts) in MyRocks must be an unsigned non-null 64-bit integer, exist inside the table, and have an accompanying ttl duration.
CREATE TABLE t1 (
a bigint(20) UNSIGNED NOT NULL,
b int NOT NULL,
c int NOT NULL,
PRIMARY KEY (a,c)
) ENGINE=rocksdb
COMMENT='ttl_duration=abc;';
ERROR HY000: TTL duration (abc) in MyRocks must be an unsigned non-null 64-bit integer.
CREATE TABLE t1 (
a bigint(20) UNSIGNED NOT NULL,
b int NOT NULL,
c int NOT NULL,
PRIMARY KEY (a,c)
) ENGINE=rocksdb
COMMENT='ttl_duration=1;ttl_col=abc;';
ERROR HY000: TTL column (abc) in MyRocks must be an unsigned non-null 64-bit integer, exist inside the table, and have an accompanying ttl duration.
CREATE TABLE t1 (
a bigint(20) UNSIGNED NOT NULL,
b int NOT NULL,
c int NOT NULL,
PRIMARY KEY (a,c)
) ENGINE=rocksdb
COMMENT='ttl_col=abc;';
ERROR HY000: TTL column (abc) in MyRocks must be an unsigned non-null 64-bit integer, exist inside the table, and have an accompanying ttl duration.
CREATE TABLE t1 (
a bigint(20) NOT NULL,
PRIMARY KEY (a)
) ENGINE=rocksdb
COMMENT='ttl_duration=500;';
INSERT INTO t1 values (1);
SELECT COUNT(*) FROM t1;
COUNT(*)
1
set global rocksdb_force_flush_memtable_now=1;
set global rocksdb_compact_cf='default';
SELECT COUNT(*) FROM t1;
COUNT(*)
1
DROP TABLE t1;
CREATE TABLE t1 (
a INT PRIMARY KEY
) ENGINE=rocksdb
COMMENT='ttl_duration=100;';
INSERT INTO t1 values (1);
SELECT * FROM t1;
a
1
ALTER TABLE t1 COMMENT = 'ttl_duration=1';
SHOW CREATE TABLE t1;
Table	Create Table
t1	CREATE TABLE `t1` (
  `a` int(11) NOT NULL,
  PRIMARY KEY (`a`)
) ENGINE=ROCKSDB DEFAULT CHARSET=latin1 COMMENT='ttl_duration=1'
set global rocksdb_force_flush_memtable_now=1;
set global rocksdb_compact_cf='default';
SELECT COUNT(*) FROM t1;
COUNT(*)
0
DROP TABLE t1;
CREATE TABLE t1 (
a INT PRIMARY KEY,
b INT
) ENGINE=rocksdb
COMMENT='ttl_duration=100;';
ALTER TABLE t1 DROP PRIMARY KEY;
ERROR HY000: TTL support is currently disabled when table has secondary indexes or hidden PK.
ALTER TABLE t1 ADD INDEX kb(b), ALGORITHM=INPLACE;
ERROR HY000: TTL support is currently disabled when table has secondary indexes or hidden PK.
DROP TABLE t1;
CREATE TABLE t1 (
a INT PRIMARY KEY,
b INT
) ENGINE=rocksdb
COMMENT='ttl_duration=5;';
INSERT INTO t1 VALUES (1,1);
INSERT INTO t1 VALUES (2,2);
ALTER TABLE t1 DROP PRIMARY KEY, ADD PRIMARY KEY(b);
set global rocksdb_force_flush_memtable_now=1;
set @@global.rocksdb_compact_cf = 'default';
SELECT COUNT(*) FROM t1;
COUNT(*)
2
set @@global.rocksdb_compact_cf = 'default';
SELECT COUNT(*) FROM t1;
COUNT(*)
0
DROP TABLE t1;
CREATE TABLE t1 (
a bigint(20) UNSIGNED NOT NULL,
PRIMARY KEY (a)
) ENGINE=rocksdb
COMMENT='asdadfasdfsadfadf ;ttl_duration=1; asfasdfasdfadfa';
INSERT INTO t1 values (UNIX_TIMESTAMP());
SELECT COUNT(*) FROM t1;
COUNT(*)
1
set global rocksdb_force_flush_memtable_now=1;
set global rocksdb_compact_cf='default';
SELECT COUNT(*) FROM t1;
COUNT(*)
0
ALTER TABLE t1 COMMENT = 'adsf;;ttl_duration=5;asfasdfa;ttl_col=a;asdfasdf;';
INSERT INTO t1 values (UNIX_TIMESTAMP());
set global rocksdb_force_flush_memtable_now=1;
set global rocksdb_compact_cf='default';
SELECT COUNT(*) FROM t1;
COUNT(*)
1
set global rocksdb_compact_cf='default';
SELECT COUNT(*) FROM t1;
COUNT(*)
0
DROP TABLE t1;
CREATE TABLE t1 (
a bigint(20) NOT NULL,
PRIMARY KEY (a)
) ENGINE=rocksdb
COMMENT='ttl_duration=5;';
INSERT INTO t1 values (1);
INSERT INTO t1 values (3);
INSERT INTO t1 values (5);
INSERT INTO t1 values (7);
INSERT INTO t1 values (9);
UPDATE t1 SET a=a+1;
SELECT * FROM t1;
a
10
2
4
6
8
set global rocksdb_force_flush_memtable_now=1;
set global rocksdb_compact_cf='default';
SELECT * FROM t1;
a
10
8
DROP TABLE t1;
CREATE TABLE t1 (
a INT,
b bigint(20) UNSIGNED NOT NULL,
PRIMARY KEY (a)
) ENGINE=rocksdb
COMMENT='ttl_duration=5;ttl_col=b;';
INSERT INTO t1 values (1, UNIX_TIMESTAMP());
INSERT INTO t1 values (3, UNIX_TIMESTAMP());
INSERT INTO t1 values (5, UNIX_TIMESTAMP());
INSERT INTO t1 values (7, UNIX_TIMESTAMP());
UPDATE t1 SET b=UNIX_TIMESTAMP() WHERE a < 4;
SELECT a FROM t1;
a
1
3
5
7
set global rocksdb_force_flush_memtable_now=1;
set global rocksdb_compact_cf='default';
SELECT a FROM t1;
a
1
3
DROP TABLE t1;
SET @@global.rocksdb_update_cf_options = 'default={disable_auto_compactions=false;};';
SET @@global.rocksdb_update_cf_options = '';
