SET @start_global_value = @@global.enable_deprecation_warning;
SELECT @start_global_value;
@start_global_value
1
SELECT @@session.enable_deprecation_warning;
ERROR HY000: Variable 'enable_deprecation_warning' is a GLOBAL variable
SET GLOBAL enable_deprecation_warning=1;
SET GLOBAL enable_deprecation_warning=0;
SET GLOBAL enable_deprecation_warning=true;
SET GLOBAL enable_deprecation_warning=false;
SET GLOBAL enable_deprecation_warning=on;
SET GLOBAL enable_deprecation_warning=off;
SET GLOBAL enable_deprecation_warning=1.1;
ERROR 42000: Incorrect argument type to variable 'enable_deprecation_warning'
SET GLOBAL enable_deprecation_warning="foo";
ERROR 42000: Variable 'enable_deprecation_warning' can't be set to the value of 'foo'
SET GLOBAL enable_deprecation_warning=-1;
ERROR 42000: Variable 'enable_deprecation_warning' can't be set to the value of '-1'
SET GLOBAL enable_deprecation_warning=0;
SELECT !0;
!0
1
SHOW WARNINGS;
Level	Code	Message
SELECT SQL_NO_CACHE !0;
!0
1
SHOW WARNINGS;
Level	Code	Message
SELECT SQL_NO_FCACHE !0;
!0
1
SHOW WARNINGS;
Level	Code	Message
CREATE TABLE t1 (pk int (10) primary key);
SHOW WARNINGS;
Level	Code	Message
UPDATE t1 SET pk=VALUES(pk) WHERE pk=1;
SHOW WARNINGS;
Level	Code	Message
select @foo1 := COUNT(*) FROM t1;
@foo1 := COUNT(*)
0
SHOW WARNINGS;
Level	Code	Message
DROP TABLE t1;
SET GLOBAL enable_deprecation_warning = @start_global_value;
