#
# Setup
#
# startup argument: ro, sro => 1, 0
select @@global.read_only;
@@global.read_only
1
select @@global.super_read_only;
@@global.super_read_only
0
drop table if exists t1;
# operations as super user, should succeed
create table t1(a int);
insert into t1(a) values(1);
insert into t1(a) values(2);
delete from t1 where a = 1;
select a from t1;
a
2
# create normal user
create user normal_user;
# connecting conn with 'normal_user'
# read table t1, should succeed
select a from t1;
a
2
# write into table t1, should not succeed
insert into t1(a) values(3);
ERROR HY000: The MySQL server is running with the --read-only option so it cannot execute this statement
#
# Cleanup
#
drop table t1;
drop user normal_user;
# do not restore to original values in startup params
set global read_only= 0;
set global super_read_only= 0;
