include/master-slave.inc
Warnings:
Note	####	Sending passwords in plain text without SSL/TLS is extremely insecure.
Note	####	Storing MySQL user name or password information in the master info repository is not secure and is therefore not recommended. Please consider using the USER and PASSWORD connection options for START SLAVE; see the 'START SLAVE Syntax' in the MySQL Manual for more information.
[connection master]
create table t1 (a int) engine=innodb;
insert into t1 values(1);
insert into t1 values(2);
select * from t1;
a
1
2
update mysql.slave_gtid_info set Last_gtid = 'master_uuid:5';
include/rpl_restart_server.inc [server_number=2]
include/start_slave.inc
insert into t1 values(3);
insert into t1 values(4);
insert into t1 values(5);
insert into t1 values(6);
select * from t1;
a
1
2
5
6
include/stop_slave.inc
include/start_slave.inc
begin;
insert into t1 values(7);
insert into t1 values(8);
commit;
Number of Xids in slave's binary log
3
drop table t1;
include/rpl_end.inc
