include/master-slave.inc
Warnings:
Note	####	Sending passwords in plain text without SSL/TLS is extremely insecure.
Note	####	Storing MySQL user name or password information in the master info repository is not secure and is therefore not recommended. Please consider using the USER and PASSWORD connection options for START SLAVE; see the 'START SLAVE Syntax' in the MySQL Manual for more information.
[connection master]
include/rpl_set_gtid_mode.inc [ON on servers 1,2]
call mtr.add_suppression("Error_code: 1032");
set @save.slave_check_before_image_consistency = @@global.slave_check_before_image_consistency;
set @@global.slave_check_before_image_consistency = OFF;
set @@global.slave_check_before_image_consistency = @save.slave_check_before_image_consistency;
create table t1 (a int primary key, b int, c int) engine = innodb;
create table t2 (a int unique, b int, c int) engine = innodb;
create table t3 (a int, b int, c int, key(a)) engine = innodb;
create table t4 (a int, b int, c int) engine = innodb;
insert into t1 values(1, 1, 1);
insert into t2 values(1, 1, 1);
insert into t3 values(1, 1, 1);
insert into t4 values(1, 1, 1);
include/sync_slave_sql_with_master.inc
set @@sql_log_bin = 0;
update t1 set c = 2;
update t2 set c = 2;
update t3 set c = 2;
update t4 set c = 2;
set @@sql_log_bin = 1;
update t1 set b = 2;
include/wait_for_slave_sql_error.inc [errno=1032]
show status like 'Slave_before_image_inconsistencies';
Variable_name	Value
Slave_before_image_inconsistencies	1
select * from information_schema.RBR_BI_INCONSISTENCIES;
TABLE	LAST_GTID	SOURCE_LOG_POS	SOURCE_IMAGE	LOCAL_IMAGE
test.t1	uuid:10	master-bin.000001:2763	c=1	c=2
set @@sql_log_bin = 0;
update t1 set c = 1;
set @@sql_log_bin = 1;
include/stop_slave.inc
include/start_slave.inc
include/sync_slave_sql_with_master.inc
update t2 set b = 2;
include/wait_for_slave_sql_error.inc [errno=1032]
show status like 'Slave_before_image_inconsistencies';
Variable_name	Value
Slave_before_image_inconsistencies	1
select * from information_schema.RBR_BI_INCONSISTENCIES;
TABLE	LAST_GTID	SOURCE_LOG_POS	SOURCE_IMAGE	LOCAL_IMAGE
test.t1	uuid:10	master-bin.000001:2763	c=1	c=2
set @@sql_log_bin = 0;
update t2 set c = 1;
set @@sql_log_bin = 1;
include/stop_slave.inc
include/start_slave.inc
include/sync_slave_sql_with_master.inc
update t3 set b = 2;
include/wait_for_slave_sql_error.inc [errno=1032]
show status like 'Slave_before_image_inconsistencies';
Variable_name	Value
Slave_before_image_inconsistencies	1
select * from information_schema.RBR_BI_INCONSISTENCIES;
TABLE	LAST_GTID	SOURCE_LOG_POS	SOURCE_IMAGE	LOCAL_IMAGE
test.t1	uuid:10	master-bin.000001:2763	c=1	c=2
set @@sql_log_bin = 0;
update t3 set c = 1;
set @@sql_log_bin = 1;
include/stop_slave.inc
include/start_slave.inc
include/sync_slave_sql_with_master.inc
update t4 set b = 2;
show status like 'Slave_before_image_inconsistencies';
Variable_name	Value
Slave_before_image_inconsistencies	1
select * from information_schema.RBR_BI_INCONSISTENCIES;
TABLE	LAST_GTID	SOURCE_LOG_POS	SOURCE_IMAGE	LOCAL_IMAGE
test.t1	uuid:10	master-bin.000001:2763	c=1	c=2
include/wait_for_slave_sql_error.inc [errno=1032]
set @@sql_log_bin = 0;
update t4 set c = 1;
set @@sql_log_bin = 1;
include/stop_slave.inc
include/start_slave.inc
include/sync_slave_sql_with_master.inc
set @save.slave_check_before_image_consistency = @@global.slave_check_before_image_consistency;
set @@global.slave_check_before_image_consistency = OFF;
set @@global.slave_check_before_image_consistency = @save.slave_check_before_image_consistency;
set @@global.debug = "+d,dbg.fire_bi_inconsistency";
update t1 set c = 3;
update t2 set c = 3;
update t3 set c = 3;
update t4 set c = 3;
include/sync_slave_sql_with_master.inc
show status like 'Slave_before_image_inconsistencies';
Variable_name	Value
Slave_before_image_inconsistencies	0
select * from information_schema.RBR_BI_INCONSISTENCIES;
TABLE	LAST_GTID	SOURCE_LOG_POS	SOURCE_IMAGE	LOCAL_IMAGE
set @@global.debug = "-d,dbg.fire_bi_inconsistency";
select * from t1;
a	b	c
1	2	3
select * from t2;
a	b	c
1	2	3
select * from t3;
a	b	c
1	2	3
select * from t4;
a	b	c
1	2	3
select * from t1;
a	b	c
1	2	3
select * from t2;
a	b	c
1	2	3
select * from t3;
a	b	c
1	2	3
select * from t4;
a	b	c
1	2	3
drop table t1;
drop table t2;
drop table t3;
drop table t4;
include/sync_slave_sql_with_master.inc
include/stop_slave.inc
set @@global.slave_rows_search_algorithms = 'INDEX_SCAN,TABLE_SCAN,HASH_SCAN';
Warnings:
Warning	1287	'@@slave_rows_search_algorithms' is deprecated and will be removed in a future release.
include/start_slave.inc
set @save.slave_check_before_image_consistency = @@global.slave_check_before_image_consistency;
set @@global.slave_check_before_image_consistency = OFF;
set @@global.slave_check_before_image_consistency = @save.slave_check_before_image_consistency;
create table t1 (a int primary key, b int, c int) engine = innodb;
create table t2 (a int unique, b int, c int) engine = innodb;
create table t3 (a int, b int, c int, key(a)) engine = innodb;
create table t4 (a int, b int, c int) engine = innodb;
insert into t1 values(1, 1, 1);
insert into t2 values(1, 1, 1);
insert into t3 values(1, 1, 1);
insert into t4 values(1, 1, 1);
include/sync_slave_sql_with_master.inc
set @@sql_log_bin = 0;
update t1 set c = 2;
update t2 set c = 2;
update t3 set c = 2;
update t4 set c = 2;
set @@sql_log_bin = 1;
update t1 set b = 2;
include/wait_for_slave_sql_error.inc [errno=1032]
show status like 'Slave_before_image_inconsistencies';
Variable_name	Value
Slave_before_image_inconsistencies	1
select * from information_schema.RBR_BI_INCONSISTENCIES;
TABLE	LAST_GTID	SOURCE_LOG_POS	SOURCE_IMAGE	LOCAL_IMAGE
test.t1	uuid:30	master-bin.000001:8052	c=1	c=2
set @@sql_log_bin = 0;
update t1 set c = 1;
set @@sql_log_bin = 1;
include/stop_slave.inc
include/start_slave.inc
include/sync_slave_sql_with_master.inc
update t2 set b = 2;
include/wait_for_slave_sql_error.inc [errno=1032]
show status like 'Slave_before_image_inconsistencies';
Variable_name	Value
Slave_before_image_inconsistencies	1
select * from information_schema.RBR_BI_INCONSISTENCIES;
TABLE	LAST_GTID	SOURCE_LOG_POS	SOURCE_IMAGE	LOCAL_IMAGE
test.t1	uuid:30	master-bin.000001:8052	c=1	c=2
set @@sql_log_bin = 0;
update t2 set c = 1;
set @@sql_log_bin = 1;
include/stop_slave.inc
include/start_slave.inc
include/sync_slave_sql_with_master.inc
update t3 set b = 2;
include/wait_for_slave_sql_error.inc [errno=1032]
show status like 'Slave_before_image_inconsistencies';
Variable_name	Value
Slave_before_image_inconsistencies	1
select * from information_schema.RBR_BI_INCONSISTENCIES;
TABLE	LAST_GTID	SOURCE_LOG_POS	SOURCE_IMAGE	LOCAL_IMAGE
test.t1	uuid:30	master-bin.000001:8052	c=1	c=2
set @@sql_log_bin = 0;
update t3 set c = 1;
set @@sql_log_bin = 1;
include/stop_slave.inc
include/start_slave.inc
include/sync_slave_sql_with_master.inc
update t4 set b = 2;
show status like 'Slave_before_image_inconsistencies';
Variable_name	Value
Slave_before_image_inconsistencies	1
select * from information_schema.RBR_BI_INCONSISTENCIES;
TABLE	LAST_GTID	SOURCE_LOG_POS	SOURCE_IMAGE	LOCAL_IMAGE
test.t1	uuid:30	master-bin.000001:8052	c=1	c=2
include/wait_for_slave_sql_error.inc [errno=1032]
set @@sql_log_bin = 0;
update t4 set c = 1;
set @@sql_log_bin = 1;
include/stop_slave.inc
include/start_slave.inc
include/sync_slave_sql_with_master.inc
set @save.slave_check_before_image_consistency = @@global.slave_check_before_image_consistency;
set @@global.slave_check_before_image_consistency = OFF;
set @@global.slave_check_before_image_consistency = @save.slave_check_before_image_consistency;
set @@global.debug = "+d,dbg.fire_bi_inconsistency";
update t1 set c = 3;
update t2 set c = 3;
update t3 set c = 3;
update t4 set c = 3;
include/sync_slave_sql_with_master.inc
show status like 'Slave_before_image_inconsistencies';
Variable_name	Value
Slave_before_image_inconsistencies	0
select * from information_schema.RBR_BI_INCONSISTENCIES;
TABLE	LAST_GTID	SOURCE_LOG_POS	SOURCE_IMAGE	LOCAL_IMAGE
set @@global.debug = "-d,dbg.fire_bi_inconsistency";
select * from t1;
a	b	c
1	2	3
select * from t2;
a	b	c
1	2	3
select * from t3;
a	b	c
1	2	3
select * from t4;
a	b	c
1	2	3
select * from t1;
a	b	c
1	2	3
select * from t2;
a	b	c
1	2	3
select * from t3;
a	b	c
1	2	3
select * from t4;
a	b	c
1	2	3
drop table t1;
drop table t2;
drop table t3;
drop table t4;
include/sync_slave_sql_with_master.inc
include/stop_slave.inc
set @@global.slave_rows_search_algorithms = DEFAULT;
Warnings:
Warning	1287	'@@slave_rows_search_algorithms' is deprecated and will be removed in a future release.
include/start_slave.inc
include/rpl_end.inc
