include/master-slave.inc
Warnings:
Note	####	Sending passwords in plain text without SSL/TLS is extremely insecure.
Note	####	Storing MySQL user name or password information in the master info repository is not secure and is therefore not recommended. Please consider using the USER and PASSWORD connection options for START SLAVE; see the 'START SLAVE Syntax' in the MySQL Manual for more information.
[connection master]
call mtr.add_suppression("The slave coordinator and worker threads are stopped, possibly leaving data in inconsistent state");
create database d1;
create database d2;
create database d3;
create table d1.t1 (a int) engine=innodb;
insert into d1.t1 values(1);
create table d2.t2 (a int) engine=myisam;
create table d3.t3 (a int) engine=innodb;
lock tables d1.t1 read;
set @@global.debug= '+d,after_executed_write_rows_event';
update d1.t1 set a= 5;
update d1.t1 set a= 4;
update d1.t1 set a= 3;
update d1.t1 set a= 2;
update d1.t1 set a= 1;
set global debug= '+d,dump_thread_wait_after_send_write_rows';
insert into d2.t2 values(1);
unlock tables;
SET DEBUG_SYNC= 'now WAIT_FOR executed';
set @@global.debug= '-d,after_executed_write_rows_event';
set @start=now();
stop slave;
select timestampdiff(SECOND, @start, now()) >= 60;
timestampdiff(SECOND, @start, now()) >= 60
1
start slave;
SET DEBUG_SYNC= 'now SIGNAL signal.continue';
SET DEBUG_SYNC= 'RESET';
set @@global.debug= '-d,dump_thread_wait_after_send_write_rows';
"Tables on master:"
connection master
select * from d1.t1;
a
1
select * from d2.t2;
a
1
select * from d3.t3;
a
"Tables on slave:"
connection slave
select * from d1.t1;
a
1
select * from d2.t2;
a
1
select * from d3.t3;
a
delete from d1.t1;
insert into d1.t1 values(1);
delete from d2.t2;
delete from d3.t3;
lock tables d1.t1 read;
set @@global.debug= '+d,after_executed_write_rows_event';
update d1.t1 set a= 5;
update d1.t1 set a= 4;
update d1.t1 set a= 3;
update d1.t1 set a= 2;
update d1.t1 set a= 1;
set global debug= '+d,dump_thread_wait_after_send_write_rows';
insert into d3.t3 values(1);
unlock tables;
SET DEBUG_SYNC= 'now WAIT_FOR executed';
set @@global.debug= '-d,after_executed_write_rows_event';
set @start=now();
stop slave;
select timestampdiff(SECOND, @start, now()) < 60;
timestampdiff(SECOND, @start, now()) < 60
1
start slave;
SET DEBUG_SYNC= 'now SIGNAL signal.continue';
SET DEBUG_SYNC= 'RESET';
set @@global.debug= '-d,dump_thread_wait_after_send_write_rows';
"Tables on master:"
connection master
select * from d1.t1;
a
1
select * from d2.t2;
a
select * from d3.t3;
a
1
"Tables on slave:"
connection slave
select * from d1.t1;
a
1
select * from d2.t2;
a
select * from d3.t3;
a
1
drop database d1;
drop database d2;
drop database d3;
include/rpl_end.inc
