include/master-slave.inc
Warnings:
Note	####	Sending passwords in plain text without SSL/TLS is extremely insecure.
Note	####	Storing MySQL user name or password information in the master info repository is not secure and is therefore not recommended. Please consider using the USER and PASSWORD connection options for START SLAVE; see the 'START SLAVE Syntax' in the MySQL Manual for more information.
[connection master]
call mtr.add_suppression("Slave SQL.*Column [0-9] of table .test.t[0-9]*. cannot be converted from type.* Error_code: 1677");
create table t1 (a int, b text) rbr_column_names=1;
show create table t1;
Table	Create Table
t1	CREATE TABLE `t1` (
  `a` int(11) DEFAULT NULL,
  `b` text
) ENGINE=MyISAM DEFAULT CHARSET=latin1 RBR_COLUMN_NAMES=1
drop table t1;
create table t1 (b text);
Check slave can deal with missing columns
insert into t1 values(1, "column1");
select * from t1;
b
column1
drop table t1;
create table t1 (b text, a int);
Check slave can deal with columns in different order
insert into t1(a, b) values(2, "column2");
update t1 set b="update column2" where a=2;
select * from t1;
b	a
update column2	2
drop table t1;
create table t1 (extra_column text, a int, b text);
Check slave can deal with new columns added at the beginning
insert into t1 values(2, "column2");
select * from t1;
extra_column	a	b
NULL	2	column2
drop table t1;
create table t1(a int, extra_column text, b text);
Check slave can deal with new columns added in the middle
insert into t1 values(2, "column2");
insert into t1 values(3, "column3");
delete from t1 where a=3 and b="column3";
select * from t1;
a	extra_column	b
2	NULL	column2
set @start_val = @@global.slave_type_conversions;
set @@global.slave_type_conversions=ALL_NON_LOSSY;
create table t2 (a int, b varchar(1000), c enum('1','2','3'), d int) engine=innodb rbr_column_names=1;
Check slave_type_conversions with rbr_column_names
drop table t2;
create table t2(a int, b text, d int) engine=innodb rbr_column_names=1;
insert into t2 values(1, "column2", 1, 1);
select * from t2;
a	b	d
1	column2	1
drop table t2;
create table t2 (a int, b varchar(1000), d int) engine=innodb rbr_column_names=1;
Check slave_type_conversions with rbr_column_names
drop table t2;
create table t2(a int, b text, c enum('1','2','3'), d int) engine=innodb rbr_column_names=1;
insert into t2 values(1, "column2", 1);
select * from t2;
a	b	c	d
1	column2	NULL	1
set @@global.slave_type_conversions = @start_val;
drop table t1;
create table t1 (a int, b int);
Check slave fails with an error due to type mismatch
drop table t2;
insert into t1 values(1, "column2");
include/wait_for_slave_sql_error.inc [errno=1677]
include/stop_slave.inc
include/rpl_reset.inc
Check rbr_column_names can be changed using ALTER TABLE
alter table t1 rbr_column_names = 0;
show create table t1;
Table	Create Table
t1	CREATE TABLE `t1` (
  `a` int(11) DEFAULT NULL,
  `b` text
) ENGINE=MyISAM DEFAULT CHARSET=latin1
show create table t1;
Table	Create Table
t1	CREATE TABLE `t1` (
  `a` int(11) DEFAULT NULL,
  `b` int(11) DEFAULT NULL
) ENGINE=MyISAM DEFAULT CHARSET=latin1
alter table t1 rbr_column_names = 1;
show create table t1;
Table	Create Table
t1	CREATE TABLE `t1` (
  `a` int(11) DEFAULT NULL,
  `b` text
) ENGINE=MyISAM DEFAULT CHARSET=latin1 RBR_COLUMN_NAMES=1
show create table t1;
Table	Create Table
t1	CREATE TABLE `t1` (
  `a` int(11) DEFAULT NULL,
  `b` int(11) DEFAULT NULL
) ENGINE=MyISAM DEFAULT CHARSET=latin1 RBR_COLUMN_NAMES=1
drop table t1;
include/rpl_end.inc
