include/master-slave.inc
Warnings:
Note	####	Sending passwords in plain text without SSL/TLS is extremely insecure.
Note	####	Storing MySQL user name or password information in the master info repository is not secure and is therefore not recommended. Please consider using the USER and PASSWORD connection options for START SLAVE; see the 'START SLAVE Syntax' in the MySQL Manual for more information.
[connection master]
create table t1 (a int) engine=innodb;
insert into t1 values(1);
select * from mysql.slave_gtid_info;
Id	Database_name	Last_gtid
1	test	uuid:2
begin;
delete from mysql.slave_gtid_info;
insert into t1 values(2);
select sleep(20);
sleep(20)
0
commit;
insert into t1 values(3);
select * from t1;
a
1
2
3
include/stop_slave.inc
set @@global.slave_parallel_workers=2;
include/start_slave.inc
begin;
delete from mysql.slave_gtid_info;
insert into t1 values(4);
select sleep(20);
sleep(20)
0
commit;
insert into t1 values(5);
select * from t1;
a
1
2
3
4
5
select * from mysql.slave_gtid_info;
Id	Database_name	Last_gtid
1	test	uuid:6
include/stop_slave.inc
set @@global.slave_parallel_workers=0;
include/start_slave.inc
drop table t1;
include/rpl_end.inc
