SET @@global.maximum_hlc_drift_ns = 2538630000000000000;
SET @@global.minimum_hlc_ns = 2538630000000000000;
set global rocksdb_force_flush_memtable_now = true;
CREATE TABLE t1 (id INT NOT NULL, value BIGINT PRIMARY KEY) ENGINE=rocksdB;
INSERT INTO t1 VALUES(1, 2538630000000000002);

Not specify exactly_at_hlc

Update t1 Set value=2538630000000000003 where id=1;
SET GLOBAL THRIFT_SERVER_TESTER_INPUT='bypass: {"db_name":"test","table_name":"t1","columns":["id", "value"],"where":[{"column":"id","op":0,"value":{"signedIntVal":1}}],"limit":5}';
SELECT SEQ_NUMBER, TYPE, VALUE FROM THRIFT_SERVER_PLUGIN_OUTPUT ORDER BY SEQ_NUMBER;
SEQ_NUMBER	TYPE	VALUE
0	header	[{"type":2,"name":"id"}, {"type":2,"name":"value"}]
1	row	[{"signedIntVal":1}, {"signedIntVal":2538630000000000003}]
2	hlcTsLowerBound	2538630000000000003
SELECT USER, HOST, DB, COMMAND, TIME, INFO, STATE FROM INFORMATION_SCHEMA.PROCESSLIST WHERE USER='rpc_plugin';
USER	HOST	DB	COMMAND	TIME	INFO	STATE
rpc_plugin	connecting host	NULL	Sleep	0		User sleep
TRUNCATE TABLE THRIFT_SERVER_PLUGIN_OUTPUT;

specify customized exactly_at_hlc value

Update t1 Set value=2538630000000000004 where id=1;
SET GLOBAL THRIFT_SERVER_TESTER_INPUT='bypass: {"db_name":"test","table_name":"t1","columns":["id", "value"],"where":[{"column":"id","op":0,"value":{"signedIntVal":1}}],"exactly_at_hlc":2538630000000000005,"limit":5}';
SELECT SEQ_NUMBER, TYPE, VALUE FROM THRIFT_SERVER_PLUGIN_OUTPUT ORDER BY SEQ_NUMBER;
SEQ_NUMBER	TYPE	VALUE
0	header	[{"type":2,"name":"id"}, {"type":2,"name":"value"}]
1	row	[{"signedIntVal":1}, {"signedIntVal":2538630000000000003}]
2	hlcTsLowerBound	2538630000000000006
3	readHlc	2538630000000000005
SELECT USER, HOST, DB, COMMAND, TIME, INFO, STATE FROM INFORMATION_SCHEMA.PROCESSLIST WHERE USER='rpc_plugin';
USER	HOST	DB	COMMAND	TIME	INFO	STATE
rpc_plugin	connecting host	NULL	Sleep	0		User sleep
TRUNCATE TABLE THRIFT_SERVER_PLUGIN_OUTPUT;

specify max exactly_at_hlc value

Update t1 Set value=2538630000000000005 where id=1;
SET GLOBAL THRIFT_SERVER_TESTER_INPUT='bypass: {"db_name":"test","table_name":"t1","columns":["id", "value"],"where":[{"column":"id","op":0,"value":{"signedIntVal":1}}],"exactly_at_hlc":9223372036854775807,"limit":5}';
SELECT SEQ_NUMBER, TYPE, VALUE FROM THRIFT_SERVER_PLUGIN_OUTPUT ORDER BY SEQ_NUMBER;
SEQ_NUMBER	TYPE	VALUE
0	header	[{"type":2,"name":"id"}, {"type":2,"name":"value"}]
1	row	[{"signedIntVal":1}, {"signedIntVal":2538630000000000005}]
2	hlcTsLowerBound	2538630000000000009
3	readHlc	2538630000000000009
SELECT USER, HOST, DB, COMMAND, TIME, INFO, STATE FROM INFORMATION_SCHEMA.PROCESSLIST WHERE USER='rpc_plugin';
USER	HOST	DB	COMMAND	TIME	INFO	STATE
rpc_plugin	connecting host	NULL	Sleep	0		User sleep
TRUNCATE TABLE THRIFT_SERVER_PLUGIN_OUTPUT;
DROP TABLE t1;
SET @@global.maximum_hlc_drift_ns = 300000000000;
SET @@global.minimum_hlc_ns = 0;
