include/master-slave.inc
Warnings:
Note	####	Sending passwords in plain text without SSL/TLS is extremely insecure.
Note	####	Storing MySQL user name or password information in the master info repository is not secure and is therefore not recommended. Please consider using the USER and PASSWORD connection options for START SLAVE; see the 'START SLAVE Syntax' in the MySQL Manual for more information.
[connection master]
call mtr.add_suppression("Error_code: 1032");
call mtr.add_suppression("Error_code: 1756");
set @@global.slave_rows_search_algorithms = 'INDEX_SCAN,TABLE_SCAN';
Warnings:
Warning	1287	'@@slave_rows_search_algorithms' is deprecated and will be removed in a future release.
create table t1 (a int primary key, b int, c float) engine = rocksdb;
create table t2 (a int unique, b int, c float) engine = rocksdb;
insert into t1 values(1, 1, 0.7983204567);
insert into t2 values(1, 1, 0.7983204567);
include/sync_slave_sql_with_master.inc
set @@sql_log_bin = 0;
update t1 set c = 0.798321;
update t2 set c = 0.798321;
set @@sql_log_bin = 1;
update t1 set b = 2;
include/wait_for_slave_sql_error.inc [errno=1032]
inconsistency_count
1
select * from information_schema.RBR_BI_INCONSISTENCIES;
TABLE	LAST_GTID	SOURCE_LOG_POS	SOURCE_IMAGE	LOCAL_IMAGE
test.t1	uuid:7	master-bin.000001:2046	c=0.79832	c=0.798321
set @@sql_log_bin = 0;
update t1 set c = 0.798320;
set @@sql_log_bin = 1;
include/stop_slave.inc
include/start_slave.inc
include/sync_slave_sql_with_master.inc
inconsistency_count
1
update t2 set b = 2;
include/wait_for_slave_sql_error.inc [errno=1032]
inconsistency_count
2
select * from information_schema.RBR_BI_INCONSISTENCIES;
TABLE	LAST_GTID	SOURCE_LOG_POS	SOURCE_IMAGE	LOCAL_IMAGE
test.t2	uuid:8	master-bin.000001:2352	c=0.79832	c=0.798321
test.t1	uuid:7	master-bin.000001:2046	c=0.79832	c=0.798321
set @@sql_log_bin = 0;
update t2 set c = 0.798320;
set @@sql_log_bin = 1;
include/stop_slave.inc
include/start_slave.inc
include/sync_slave_sql_with_master.inc
inconsistency_count
2
select * from t1;
a	b	c
1	2	0.79832
select * from t2;
a	b	c
1	2	0.79832
select * from t1;
a	b	c
1	2	0.79832
select * from t2;
a	b	c
1	2	0.79832
drop table t1;
drop table t2;
include/sync_slave_sql_with_master.inc
include/stop_slave.inc
set @@global.slave_rows_search_algorithms = DEFAULT;
Warnings:
Warning	1287	'@@slave_rows_search_algorithms' is deprecated and will be removed in a future release.
include/start_slave.inc
include/rpl_end.inc
