DROP TABLE IF EXISTS t1;
call mtr.add_suppression("InnoDB: Warning: innodb_zip_debug is enabled and this is a non-debug mysqld. Please disable it immediately if the machine is serving production traffic.");
CREATE TABLE t1(`id` INT AUTO_INCREMENT PRIMARY KEY, msg VARCHAR(255))
ENGINE=INNODB
ROW_FORMAT=COMPRESSED
COMPRESSION=ZLIB
COMPACT_METADATA=1
KEY_BLOCK_SIZE=1;
START TRANSACTION;
INSERT INTO t1 VALUES (1, REPEAT(PASSWORD(1), 5));
INSERT INTO t1 VALUES (2, REPEAT(PASSWORD(2), 5));
INSERT INTO t1 VALUES (3, REPEAT(PASSWORD(3), 5));
INSERT INTO t1 VALUES (4, REPEAT(PASSWORD(4), 5));
INSERT INTO t1 VALUES (5, REPEAT(PASSWORD(5), 5));
INSERT INTO t1 VALUES (6, REPEAT(PASSWORD(6), 5));
INSERT INTO t1 VALUES (7, REPEAT(PASSWORD(7), 5));
INSERT INTO t1 VALUES (8, REPEAT(PASSWORD(8), 5));
INSERT INTO t1 VALUES (9, REPEAT(PASSWORD(9), 5));
INSERT INTO t1 VALUES (10, REPEAT(PASSWORD(10), 5));
INSERT INTO t1 VALUES (11, REPEAT(PASSWORD(11), 5));
INSERT INTO t1 VALUES (12, REPEAT(PASSWORD(12), 5));
INSERT INTO t1 VALUES (13, REPEAT(PASSWORD(13), 5));
INSERT INTO t1 VALUES (14, REPEAT(PASSWORD(14), 5));
INSERT INTO t1 VALUES (15, REPEAT(PASSWORD(15), 5));
INSERT INTO t1 VALUES (16, REPEAT(PASSWORD(16), 5));
INSERT INTO t1 VALUES (17, REPEAT(PASSWORD(17), 5));
INSERT INTO t1 VALUES (18, REPEAT(PASSWORD(18), 5));
INSERT INTO t1 VALUES (19, REPEAT(PASSWORD(19), 5));
INSERT INTO t1 VALUES (20, REPEAT(PASSWORD(20), 5));
INSERT INTO t1 VALUES (21, REPEAT(PASSWORD(21), 5));
INSERT INTO t1 VALUES (22, REPEAT(PASSWORD(22), 5));
INSERT INTO t1 VALUES (23, REPEAT(PASSWORD(23), 5));
COMMIT;
SELECT * FROM t1;
id	msg
1	*E6CC90B878B948C35E92B003C792C46C58C4AF40*E6CC90B878B948C35E92B003C792C46C58C4AF40*E6CC90B878B948C35E92B003C792C46C58C4AF40*E6CC90B878B948C35E92B003C792C46C58C4AF40*E6CC90B878B948C35E92B003C792C46C58C4AF40
2	*12033B78389744F3F39AC4CE4CCFCAD6960D8EA0*12033B78389744F3F39AC4CE4CCFCAD6960D8EA0*12033B78389744F3F39AC4CE4CCFCAD6960D8EA0*12033B78389744F3F39AC4CE4CCFCAD6960D8EA0*12033B78389744F3F39AC4CE4CCFCAD6960D8EA0
3	*C4E74DDDC9CC9E2FDCDB7F63B127FB638831262E*C4E74DDDC9CC9E2FDCDB7F63B127FB638831262E*C4E74DDDC9CC9E2FDCDB7F63B127FB638831262E*C4E74DDDC9CC9E2FDCDB7F63B127FB638831262E*C4E74DDDC9CC9E2FDCDB7F63B127FB638831262E
4	*908BE2B7EB7D7567F7FF98716850F59BA69AA9DB*908BE2B7EB7D7567F7FF98716850F59BA69AA9DB*908BE2B7EB7D7567F7FF98716850F59BA69AA9DB*908BE2B7EB7D7567F7FF98716850F59BA69AA9DB*908BE2B7EB7D7567F7FF98716850F59BA69AA9DB
5	*7534F9EAEE5B69A586D1E9C1ACE3E3F9F6FCC446*7534F9EAEE5B69A586D1E9C1ACE3E3F9F6FCC446*7534F9EAEE5B69A586D1E9C1ACE3E3F9F6FCC446*7534F9EAEE5B69A586D1E9C1ACE3E3F9F6FCC446*7534F9EAEE5B69A586D1E9C1ACE3E3F9F6FCC446
6	*C3AB9ECDF746570BBF9DCAA9DB3586D25956DC93*C3AB9ECDF746570BBF9DCAA9DB3586D25956DC93*C3AB9ECDF746570BBF9DCAA9DB3586D25956DC93*C3AB9ECDF746570BBF9DCAA9DB3586D25956DC93*C3AB9ECDF746570BBF9DCAA9DB3586D25956DC93
7	*23E7A7428138939FBE2F69D23E5B87383EFD83C9*23E7A7428138939FBE2F69D23E5B87383EFD83C9*23E7A7428138939FBE2F69D23E5B87383EFD83C9*23E7A7428138939FBE2F69D23E5B87383EFD83C9*23E7A7428138939FBE2F69D23E5B87383EFD83C9
8	*6AF37A8C78E3A957D16D98F12788D1CFB2987A4C*6AF37A8C78E3A957D16D98F12788D1CFB2987A4C*6AF37A8C78E3A957D16D98F12788D1CFB2987A4C*6AF37A8C78E3A957D16D98F12788D1CFB2987A4C*6AF37A8C78E3A957D16D98F12788D1CFB2987A4C
9	*7E9FDC7F61153649AB9A75CED26807DF74F86E65*7E9FDC7F61153649AB9A75CED26807DF74F86E65*7E9FDC7F61153649AB9A75CED26807DF74F86E65*7E9FDC7F61153649AB9A75CED26807DF74F86E65*7E9FDC7F61153649AB9A75CED26807DF74F86E65
10	*15B4A9F089BEC4C84A24C5148B14A80C14651492*15B4A9F089BEC4C84A24C5148B14A80C14651492*15B4A9F089BEC4C84A24C5148B14A80C14651492*15B4A9F089BEC4C84A24C5148B14A80C14651492*15B4A9F089BEC4C84A24C5148B14A80C14651492
11	*0801D10217B06C5A9F32430C1A34E030D41A0257*0801D10217B06C5A9F32430C1A34E030D41A0257*0801D10217B06C5A9F32430C1A34E030D41A0257*0801D10217B06C5A9F32430C1A34E030D41A0257*0801D10217B06C5A9F32430C1A34E030D41A0257
12	*AA803D048B666A933E512AA53B36C70174A37D1E*AA803D048B666A933E512AA53B36C70174A37D1E*AA803D048B666A933E512AA53B36C70174A37D1E*AA803D048B666A933E512AA53B36C70174A37D1E*AA803D048B666A933E512AA53B36C70174A37D1E
13	*DFC5E490F07E908D8E0301A9961A1294F1833CDB*DFC5E490F07E908D8E0301A9961A1294F1833CDB*DFC5E490F07E908D8E0301A9961A1294F1833CDB*DFC5E490F07E908D8E0301A9961A1294F1833CDB*DFC5E490F07E908D8E0301A9961A1294F1833CDB
14	*2BB4042681093EDDB139FE897BDC3E9DC66DB3E9*2BB4042681093EDDB139FE897BDC3E9DC66DB3E9*2BB4042681093EDDB139FE897BDC3E9DC66DB3E9*2BB4042681093EDDB139FE897BDC3E9DC66DB3E9*2BB4042681093EDDB139FE897BDC3E9DC66DB3E9
15	*164FDE5FF23E4F03CC876EC8C8E7AE2DF1D2A6B9*164FDE5FF23E4F03CC876EC8C8E7AE2DF1D2A6B9*164FDE5FF23E4F03CC876EC8C8E7AE2DF1D2A6B9*164FDE5FF23E4F03CC876EC8C8E7AE2DF1D2A6B9*164FDE5FF23E4F03CC876EC8C8E7AE2DF1D2A6B9
16	*AD32FD65062E11F28615AF007C00472353B8889B*AD32FD65062E11F28615AF007C00472353B8889B*AD32FD65062E11F28615AF007C00472353B8889B*AD32FD65062E11F28615AF007C00472353B8889B*AD32FD65062E11F28615AF007C00472353B8889B
17	*F2B30D366CFF7C4585A87B431F101272244C42C4*F2B30D366CFF7C4585A87B431F101272244C42C4*F2B30D366CFF7C4585A87B431F101272244C42C4*F2B30D366CFF7C4585A87B431F101272244C42C4*F2B30D366CFF7C4585A87B431F101272244C42C4
18	*3085545A58D808FEFA4545CCD601D5E3F7A92726*3085545A58D808FEFA4545CCD601D5E3F7A92726*3085545A58D808FEFA4545CCD601D5E3F7A92726*3085545A58D808FEFA4545CCD601D5E3F7A92726*3085545A58D808FEFA4545CCD601D5E3F7A92726
19	*D547752508864FE305B97CD907BD12A1121AA77F*D547752508864FE305B97CD907BD12A1121AA77F*D547752508864FE305B97CD907BD12A1121AA77F*D547752508864FE305B97CD907BD12A1121AA77F*D547752508864FE305B97CD907BD12A1121AA77F
20	*73CD70D3F4D94BFCB566501B2909C8D435FF0A11*73CD70D3F4D94BFCB566501B2909C8D435FF0A11*73CD70D3F4D94BFCB566501B2909C8D435FF0A11*73CD70D3F4D94BFCB566501B2909C8D435FF0A11*73CD70D3F4D94BFCB566501B2909C8D435FF0A11
21	*EBEFE38F24D7BF6DDD422948D227E9EB3C94527C*EBEFE38F24D7BF6DDD422948D227E9EB3C94527C*EBEFE38F24D7BF6DDD422948D227E9EB3C94527C*EBEFE38F24D7BF6DDD422948D227E9EB3C94527C*EBEFE38F24D7BF6DDD422948D227E9EB3C94527C
22	*AEA73029F4DC11A88BA257A99DC751663BD0A4CB*AEA73029F4DC11A88BA257A99DC751663BD0A4CB*AEA73029F4DC11A88BA257A99DC751663BD0A4CB*AEA73029F4DC11A88BA257A99DC751663BD0A4CB*AEA73029F4DC11A88BA257A99DC751663BD0A4CB
23	*DFB702FDA6D8C5DE6F7587F426C7C5B59428CAEB*DFB702FDA6D8C5DE6F7587F426C7C5B59428CAEB*DFB702FDA6D8C5DE6F7587F426C7C5B59428CAEB*DFB702FDA6D8C5DE6F7587F426C7C5B59428CAEB*DFB702FDA6D8C5DE6F7587F426C7C5B59428CAEB
DELETE FROM t1 WHERE `id` <= 4;
SELECT * FROM t1;
id	msg
5	*7534F9EAEE5B69A586D1E9C1ACE3E3F9F6FCC446*7534F9EAEE5B69A586D1E9C1ACE3E3F9F6FCC446*7534F9EAEE5B69A586D1E9C1ACE3E3F9F6FCC446*7534F9EAEE5B69A586D1E9C1ACE3E3F9F6FCC446*7534F9EAEE5B69A586D1E9C1ACE3E3F9F6FCC446
6	*C3AB9ECDF746570BBF9DCAA9DB3586D25956DC93*C3AB9ECDF746570BBF9DCAA9DB3586D25956DC93*C3AB9ECDF746570BBF9DCAA9DB3586D25956DC93*C3AB9ECDF746570BBF9DCAA9DB3586D25956DC93*C3AB9ECDF746570BBF9DCAA9DB3586D25956DC93
7	*23E7A7428138939FBE2F69D23E5B87383EFD83C9*23E7A7428138939FBE2F69D23E5B87383EFD83C9*23E7A7428138939FBE2F69D23E5B87383EFD83C9*23E7A7428138939FBE2F69D23E5B87383EFD83C9*23E7A7428138939FBE2F69D23E5B87383EFD83C9
8	*6AF37A8C78E3A957D16D98F12788D1CFB2987A4C*6AF37A8C78E3A957D16D98F12788D1CFB2987A4C*6AF37A8C78E3A957D16D98F12788D1CFB2987A4C*6AF37A8C78E3A957D16D98F12788D1CFB2987A4C*6AF37A8C78E3A957D16D98F12788D1CFB2987A4C
9	*7E9FDC7F61153649AB9A75CED26807DF74F86E65*7E9FDC7F61153649AB9A75CED26807DF74F86E65*7E9FDC7F61153649AB9A75CED26807DF74F86E65*7E9FDC7F61153649AB9A75CED26807DF74F86E65*7E9FDC7F61153649AB9A75CED26807DF74F86E65
10	*15B4A9F089BEC4C84A24C5148B14A80C14651492*15B4A9F089BEC4C84A24C5148B14A80C14651492*15B4A9F089BEC4C84A24C5148B14A80C14651492*15B4A9F089BEC4C84A24C5148B14A80C14651492*15B4A9F089BEC4C84A24C5148B14A80C14651492
11	*0801D10217B06C5A9F32430C1A34E030D41A0257*0801D10217B06C5A9F32430C1A34E030D41A0257*0801D10217B06C5A9F32430C1A34E030D41A0257*0801D10217B06C5A9F32430C1A34E030D41A0257*0801D10217B06C5A9F32430C1A34E030D41A0257
12	*AA803D048B666A933E512AA53B36C70174A37D1E*AA803D048B666A933E512AA53B36C70174A37D1E*AA803D048B666A933E512AA53B36C70174A37D1E*AA803D048B666A933E512AA53B36C70174A37D1E*AA803D048B666A933E512AA53B36C70174A37D1E
13	*DFC5E490F07E908D8E0301A9961A1294F1833CDB*DFC5E490F07E908D8E0301A9961A1294F1833CDB*DFC5E490F07E908D8E0301A9961A1294F1833CDB*DFC5E490F07E908D8E0301A9961A1294F1833CDB*DFC5E490F07E908D8E0301A9961A1294F1833CDB
14	*2BB4042681093EDDB139FE897BDC3E9DC66DB3E9*2BB4042681093EDDB139FE897BDC3E9DC66DB3E9*2BB4042681093EDDB139FE897BDC3E9DC66DB3E9*2BB4042681093EDDB139FE897BDC3E9DC66DB3E9*2BB4042681093EDDB139FE897BDC3E9DC66DB3E9
15	*164FDE5FF23E4F03CC876EC8C8E7AE2DF1D2A6B9*164FDE5FF23E4F03CC876EC8C8E7AE2DF1D2A6B9*164FDE5FF23E4F03CC876EC8C8E7AE2DF1D2A6B9*164FDE5FF23E4F03CC876EC8C8E7AE2DF1D2A6B9*164FDE5FF23E4F03CC876EC8C8E7AE2DF1D2A6B9
16	*AD32FD65062E11F28615AF007C00472353B8889B*AD32FD65062E11F28615AF007C00472353B8889B*AD32FD65062E11F28615AF007C00472353B8889B*AD32FD65062E11F28615AF007C00472353B8889B*AD32FD65062E11F28615AF007C00472353B8889B
17	*F2B30D366CFF7C4585A87B431F101272244C42C4*F2B30D366CFF7C4585A87B431F101272244C42C4*F2B30D366CFF7C4585A87B431F101272244C42C4*F2B30D366CFF7C4585A87B431F101272244C42C4*F2B30D366CFF7C4585A87B431F101272244C42C4
18	*3085545A58D808FEFA4545CCD601D5E3F7A92726*3085545A58D808FEFA4545CCD601D5E3F7A92726*3085545A58D808FEFA4545CCD601D5E3F7A92726*3085545A58D808FEFA4545CCD601D5E3F7A92726*3085545A58D808FEFA4545CCD601D5E3F7A92726
19	*D547752508864FE305B97CD907BD12A1121AA77F*D547752508864FE305B97CD907BD12A1121AA77F*D547752508864FE305B97CD907BD12A1121AA77F*D547752508864FE305B97CD907BD12A1121AA77F*D547752508864FE305B97CD907BD12A1121AA77F
20	*73CD70D3F4D94BFCB566501B2909C8D435FF0A11*73CD70D3F4D94BFCB566501B2909C8D435FF0A11*73CD70D3F4D94BFCB566501B2909C8D435FF0A11*73CD70D3F4D94BFCB566501B2909C8D435FF0A11*73CD70D3F4D94BFCB566501B2909C8D435FF0A11
21	*EBEFE38F24D7BF6DDD422948D227E9EB3C94527C*EBEFE38F24D7BF6DDD422948D227E9EB3C94527C*EBEFE38F24D7BF6DDD422948D227E9EB3C94527C*EBEFE38F24D7BF6DDD422948D227E9EB3C94527C*EBEFE38F24D7BF6DDD422948D227E9EB3C94527C
22	*AEA73029F4DC11A88BA257A99DC751663BD0A4CB*AEA73029F4DC11A88BA257A99DC751663BD0A4CB*AEA73029F4DC11A88BA257A99DC751663BD0A4CB*AEA73029F4DC11A88BA257A99DC751663BD0A4CB*AEA73029F4DC11A88BA257A99DC751663BD0A4CB
23	*DFB702FDA6D8C5DE6F7587F426C7C5B59428CAEB*DFB702FDA6D8C5DE6F7587F426C7C5B59428CAEB*DFB702FDA6D8C5DE6F7587F426C7C5B59428CAEB*DFB702FDA6D8C5DE6F7587F426C7C5B59428CAEB*DFB702FDA6D8C5DE6F7587F426C7C5B59428CAEB
CHECKSUM TABLE t1;
Table	Checksum
test.t1	3365824671
DROP TABLE t1;
