create table t(c1 int auto_increment primary key, c2 int, key(c2)) engine=InnoDB;
insert into t(c2) values (1);
insert into t(c2) select c2 from t;
insert into t(c2) select c2 from t;
insert into t(c2) select c2 from t;
insert into t(c2) select c2 from t;
insert into t(c2) select c2 from t;
insert into t(c2) select c2 from t;
insert into t(c2) select c2 from t;
insert into t(c2) select c2 from t;
select count(distinct c2) from t;
count(distinct c2)
1
set innodb_stats_on_metadata=0;
show variables like 'innodb_stats_on_metadata';
Variable_name	Value
innodb_stats_on_metadata	OFF
analyze table t;
Table	Op	Msg_type	Msg_text
test.t	analyze	status	OK
show index from t;
Table	Non_unique	Key_name	Seq_in_index	Column_name	Collation	Cardinality	Sub_part	Packed	Null	Index_type	Comment	Index_comment
t	0	PRIMARY	1	c1	A	256	NULL	NULL		BTREE		
t	1	c2	1	c2	A	2	NULL	NULL	YES	BTREE		
select * from mysql.innodb_index_stats where database_name='test' and table_name='t';
database_name	table_name	index_name	last_update	stat_name	stat_value	sample_size	stat_description
test	t	PRIMARY	LAST_UPDATE	n_diff_pfx01	256	1	c1
test	t	PRIMARY	LAST_UPDATE	n_leaf_pages	1	NULL	Number of leaf pages in the index
test	t	PRIMARY	LAST_UPDATE	size	1	NULL	Number of pages in the index
test	t	c2	LAST_UPDATE	n_diff_pfx01	1	1	c2
test	t	c2	LAST_UPDATE	n_diff_pfx02	256	1	c2,c1
test	t	c2	LAST_UPDATE	n_leaf_pages	1	NULL	Number of leaf pages in the index
test	t	c2	LAST_UPDATE	size	1	NULL	Number of pages in the index
update t set c2 = c1;
select count(distinct c2) from t;
count(distinct c2)
256
show index from t;
Table	Non_unique	Key_name	Seq_in_index	Column_name	Collation	Cardinality	Sub_part	Packed	Null	Index_type	Comment	Index_comment
t	0	PRIMARY	1	c1	A	256	NULL	NULL		BTREE		
t	1	c2	1	c2	A	2	NULL	NULL	YES	BTREE		
select * from mysql.innodb_index_stats where database_name='test' and table_name='t';
database_name	table_name	index_name	last_update	stat_name	stat_value	sample_size	stat_description
test	t	PRIMARY	LAST_UPDATE	n_diff_pfx01	256	1	c1
test	t	PRIMARY	LAST_UPDATE	n_leaf_pages	1	NULL	Number of leaf pages in the index
test	t	PRIMARY	LAST_UPDATE	size	1	NULL	Number of pages in the index
test	t	c2	LAST_UPDATE	n_diff_pfx01	1	1	c2
test	t	c2	LAST_UPDATE	n_diff_pfx02	256	1	c2,c1
test	t	c2	LAST_UPDATE	n_leaf_pages	1	NULL	Number of leaf pages in the index
test	t	c2	LAST_UPDATE	size	1	NULL	Number of pages in the index
analyze table t;
Table	Op	Msg_type	Msg_text
test.t	analyze	status	OK
show index from t;
Table	Non_unique	Key_name	Seq_in_index	Column_name	Collation	Cardinality	Sub_part	Packed	Null	Index_type	Comment	Index_comment
t	0	PRIMARY	1	c1	A	256	NULL	NULL		BTREE		
t	1	c2	1	c2	A	256	NULL	NULL	YES	BTREE		
select * from mysql.innodb_index_stats where database_name='test' and table_name='t';
database_name	table_name	index_name	last_update	stat_name	stat_value	sample_size	stat_description
test	t	PRIMARY	LAST_UPDATE	n_diff_pfx01	256	1	c1
test	t	PRIMARY	LAST_UPDATE	n_leaf_pages	1	NULL	Number of leaf pages in the index
test	t	PRIMARY	LAST_UPDATE	size	1	NULL	Number of pages in the index
test	t	c2	LAST_UPDATE	n_diff_pfx01	256	1	c2
test	t	c2	LAST_UPDATE	n_diff_pfx02	256	1	c2,c1
test	t	c2	LAST_UPDATE	n_leaf_pages	1	NULL	Number of leaf pages in the index
test	t	c2	LAST_UPDATE	size	1	NULL	Number of pages in the index
set innodb_stats_on_metadata=1;
show variables like 'innodb_stats_on_metadata';
Variable_name	Value
innodb_stats_on_metadata	ON
update t set c2 = 1;
select count(distinct c2) from t;
count(distinct c2)
1
show index from t;
Table	Non_unique	Key_name	Seq_in_index	Column_name	Collation	Cardinality	Sub_part	Packed	Null	Index_type	Comment	Index_comment
t	0	PRIMARY	1	c1	A	256	NULL	NULL		BTREE		
t	1	c2	1	c2	A	2	NULL	NULL	YES	BTREE		
select * from mysql.innodb_index_stats where database_name='test' and table_name='t';
database_name	table_name	index_name	last_update	stat_name	stat_value	sample_size	stat_description
test	t	PRIMARY	LAST_UPDATE	n_diff_pfx01	256	1	c1
test	t	PRIMARY	LAST_UPDATE	n_leaf_pages	1	NULL	Number of leaf pages in the index
test	t	PRIMARY	LAST_UPDATE	size	1	NULL	Number of pages in the index
test	t	c2	LAST_UPDATE	n_diff_pfx01	1	1	c2
test	t	c2	LAST_UPDATE	n_diff_pfx02	256	1	c2,c1
test	t	c2	LAST_UPDATE	n_leaf_pages	1	NULL	Number of leaf pages in the index
test	t	c2	LAST_UPDATE	size	1	NULL	Number of pages in the index
update t set c2 = c1;
select count(distinct c2) from t;
count(distinct c2)
256
show index from t;
Table	Non_unique	Key_name	Seq_in_index	Column_name	Collation	Cardinality	Sub_part	Packed	Null	Index_type	Comment	Index_comment
t	0	PRIMARY	1	c1	A	256	NULL	NULL		BTREE		
t	1	c2	1	c2	A	256	NULL	NULL	YES	BTREE		
select * from mysql.innodb_index_stats where database_name='test' and table_name='t';
database_name	table_name	index_name	last_update	stat_name	stat_value	sample_size	stat_description
test	t	PRIMARY	LAST_UPDATE	n_diff_pfx01	256	1	c1
test	t	PRIMARY	LAST_UPDATE	n_leaf_pages	1	NULL	Number of leaf pages in the index
test	t	PRIMARY	LAST_UPDATE	size	1	NULL	Number of pages in the index
test	t	c2	LAST_UPDATE	n_diff_pfx01	256	1	c2
test	t	c2	LAST_UPDATE	n_diff_pfx02	256	1	c2,c1
test	t	c2	LAST_UPDATE	n_leaf_pages	1	NULL	Number of leaf pages in the index
test	t	c2	LAST_UPDATE	size	1	NULL	Number of pages in the index
drop table t;
