DROP TABLE IF EXISTS tbl1;
DROP TABLE IF EXISTS tbl2;
DROP DATABASE IF EXISTS cus_test;
CREATE DATABASE cus_test;
USE cus_test;
CREATE TABLE tbl1 (
col1_1 INT UNSIGNED AUTO_INCREMENT PRIMARY KEY,
col1_2 INT NOT NULL,
col1_3 INT NOT NULL,
col1_4 INT NOT NULL);
INSERT INTO tbl1 (col1_2, col1_3, col1_4) VALUES (2, 3, 4);
INSERT INTO tbl1 (col1_2, col1_3, col1_4) VALUES (3, 4, 5);
INSERT INTO tbl1 (col1_2, col1_3, col1_4) VALUES (4, 5, 6);
CREATE TABLE tbl2 (col2_1 INT NOT NULL, col2_2 INT NOT NULL);
INSERT INTO tbl2 (col2_1, col2_2) VALUES (2, 3);
CREATE TABLE tbl3 (
col1_1 INT UNSIGNED AUTO_INCREMENT PRIMARY KEY,
col1_2 INT NOT NULL,
col3_3 INT NOT NULL);
INSERT INTO tbl3 (col1_2, col3_3) VALUES (2, 83);
INSERT INTO tbl3 (col1_2, col3_3) VALUES (3, 84);
INSERT INTO tbl3 (col1_2, col3_3) VALUES (4, 85);
set global column_stats_control = ON;
SET @start_value = @@global.performance_schema_esms_by_all;
SET @@global.performance_schema_esms_by_all = ON;
SELECT col1_2, col1_3 FROM (SELECT col1_2, col1_3, col1_4 FROM tbl1
WHERE col1_4 < 10 ) t WHERE col1_3 IN (2, 5, 6, 7);
col1_2	col1_3
4	5
SELECT col1_1, col1_2 FROM tbl1 WHERE col1_3 IN (SELECT col2_1 FROM tbl2 WHERE col2_2 <> 3);
col1_1	col1_2
UPDATE tbl1 SET col1_3 = 1 WHERE col1_2 IN (SELECT col2_2 FROM tbl2 WHERE col2_1 < 5);
DELETE FROM tbl1 WHERE col1_2 IN (SELECT col2_2 FROM tbl2 WHERE col2_1 < 5);
Number of distinct queries executed.
SELECT COUNT(DISTINCT SQL_ID) FROM performance_schema.column_statistics;
COUNT(DISTINCT SQL_ID)
4
Unique column accesses per table instance per SQL_ID
SELECT SQL_ID, DIGEST_TEXT, TABLE_SCHEMA, TABLE_NAME, COLUMN_NAME, SQL_OPERATION, OPERATOR_TYPE
FROM performance_schema.column_statistics cs, performance_schema.events_statements_summary_by_all mt, performance_schema.sql_text st
WHERE TABLE_SCHEMA <> 'performance_schema' AND cs.SQL_ID = mt.DIGEST AND cs.SQL_ID = st.DIGEST
ORDER BY SQL_ID, DIGEST_TEXT, TABLE_SCHEMA, TABLE_NAME, COLUMN_NAME, SQL_OPERATION, OPERATOR_TYPE;
SQL_ID	3872865c590f27445f6633a180489f85
DIGEST_TEXT	DELETE FROM `tbl1` WHERE `col1_2` IN ( SELECT `col2_2` FROM `tbl2` WHERE `col2_1` < ? )
TABLE_SCHEMA	cus_test
TABLE_NAME	tbl1
COLUMN_NAME	col1_2
SQL_OPERATION	TABLE_JOIN
OPERATOR_TYPE	EQUAL
SQL_ID	3872865c590f27445f6633a180489f85
DIGEST_TEXT	DELETE FROM `tbl1` WHERE `col1_2` IN ( SELECT `col2_2` FROM `tbl2` WHERE `col2_1` < ? )
TABLE_SCHEMA	cus_test
TABLE_NAME	tbl2
COLUMN_NAME	col2_1
SQL_OPERATION	FILTER
OPERATOR_TYPE	LESS_THAN
SQL_ID	3872865c590f27445f6633a180489f85
DIGEST_TEXT	DELETE FROM `tbl1` WHERE `col1_2` IN ( SELECT `col2_2` FROM `tbl2` WHERE `col2_1` < ? )
TABLE_SCHEMA	cus_test
TABLE_NAME	tbl2
COLUMN_NAME	col2_2
SQL_OPERATION	TABLE_JOIN
OPERATOR_TYPE	EQUAL
SQL_ID	3f82ca2bc23efeaabeb208d03664e859
DIGEST_TEXT	SELECT `col1_2` , `col1_3` FROM ( SELECT `col1_2` , `col1_3` , `col1_4` FROM `tbl1` WHERE `col1_4` < ? ) `t` WHERE `col1_3` IN (...)
TABLE_SCHEMA	cus_test
TABLE_NAME	tbl1
COLUMN_NAME	col1_4
SQL_OPERATION	FILTER
OPERATOR_TYPE	LESS_THAN
SQL_ID	85f2a9282b8f9a018df123224f0227b0
DIGEST_TEXT	UPDATE `tbl1` SET `col1_3` = ? WHERE `col1_2` IN ( SELECT `col2_2` FROM `tbl2` WHERE `col2_1` < ? )
TABLE_SCHEMA	cus_test
TABLE_NAME	tbl1
COLUMN_NAME	col1_2
SQL_OPERATION	TABLE_JOIN
OPERATOR_TYPE	EQUAL
SQL_ID	85f2a9282b8f9a018df123224f0227b0
DIGEST_TEXT	UPDATE `tbl1` SET `col1_3` = ? WHERE `col1_2` IN ( SELECT `col2_2` FROM `tbl2` WHERE `col2_1` < ? )
TABLE_SCHEMA	cus_test
TABLE_NAME	tbl1
COLUMN_NAME	col1_3
SQL_OPERATION	PROJECTION
OPERATOR_TYPE	NO_OP
SQL_ID	85f2a9282b8f9a018df123224f0227b0
DIGEST_TEXT	UPDATE `tbl1` SET `col1_3` = ? WHERE `col1_2` IN ( SELECT `col2_2` FROM `tbl2` WHERE `col2_1` < ? )
TABLE_SCHEMA	cus_test
TABLE_NAME	tbl2
COLUMN_NAME	col2_1
SQL_OPERATION	FILTER
OPERATOR_TYPE	LESS_THAN
SQL_ID	85f2a9282b8f9a018df123224f0227b0
DIGEST_TEXT	UPDATE `tbl1` SET `col1_3` = ? WHERE `col1_2` IN ( SELECT `col2_2` FROM `tbl2` WHERE `col2_1` < ? )
TABLE_SCHEMA	cus_test
TABLE_NAME	tbl2
COLUMN_NAME	col2_2
SQL_OPERATION	TABLE_JOIN
OPERATOR_TYPE	EQUAL
SQL_ID	b1aef49dde17f099c78c0d3adcde827a
DIGEST_TEXT	SELECT `col1_1` , `col1_2` FROM `tbl1` WHERE `col1_3` IN ( SELECT `col2_1` FROM `tbl2` WHERE `col2_2` != ? )
TABLE_SCHEMA	cus_test
TABLE_NAME	tbl1
COLUMN_NAME	col1_1
SQL_OPERATION	PROJECTION
OPERATOR_TYPE	NO_OP
SQL_ID	b1aef49dde17f099c78c0d3adcde827a
DIGEST_TEXT	SELECT `col1_1` , `col1_2` FROM `tbl1` WHERE `col1_3` IN ( SELECT `col2_1` FROM `tbl2` WHERE `col2_2` != ? )
TABLE_SCHEMA	cus_test
TABLE_NAME	tbl1
COLUMN_NAME	col1_2
SQL_OPERATION	PROJECTION
OPERATOR_TYPE	NO_OP
SQL_ID	b1aef49dde17f099c78c0d3adcde827a
DIGEST_TEXT	SELECT `col1_1` , `col1_2` FROM `tbl1` WHERE `col1_3` IN ( SELECT `col2_1` FROM `tbl2` WHERE `col2_2` != ? )
TABLE_SCHEMA	cus_test
TABLE_NAME	tbl1
COLUMN_NAME	col1_3
SQL_OPERATION	TABLE_JOIN
OPERATOR_TYPE	EQUAL
SQL_ID	b1aef49dde17f099c78c0d3adcde827a
DIGEST_TEXT	SELECT `col1_1` , `col1_2` FROM `tbl1` WHERE `col1_3` IN ( SELECT `col2_1` FROM `tbl2` WHERE `col2_2` != ? )
TABLE_SCHEMA	cus_test
TABLE_NAME	tbl2
COLUMN_NAME	col2_1
SQL_OPERATION	TABLE_JOIN
OPERATOR_TYPE	EQUAL
SQL_ID	b1aef49dde17f099c78c0d3adcde827a
DIGEST_TEXT	SELECT `col1_1` , `col1_2` FROM `tbl1` WHERE `col1_3` IN ( SELECT `col2_1` FROM `tbl2` WHERE `col2_2` != ? )
TABLE_SCHEMA	cus_test
TABLE_NAME	tbl2
COLUMN_NAME	col2_2
SQL_OPERATION	FILTER
OPERATOR_TYPE	NOT_EQUAL
set global column_stats_control = OFF_HARD;
SET @@global.performance_schema_esms_by_all = @start_value;
DROP TABLE tbl1;
DROP TABLE tbl2;
DROP TABLE tbl3;
DROP DATABASE cus_test;
