DROP TABLE IF EXISTS tbl1;
DROP TABLE IF EXISTS tbl2;
DROP DATABASE IF EXISTS cus_test;
CREATE DATABASE cus_test;
USE cus_test;
CREATE TABLE tbl1 (
col1_1 INT(6) UNSIGNED AUTO_INCREMENT PRIMARY KEY,
col1_2 INT(6) NOT NULL,
col1_3 INT(6) NOT NULL,
col1_4 INT(6) NOT NULL);
INSERT INTO tbl1 (col1_2, col1_3, col1_4) VALUES (2, 3, 4);
INSERT INTO tbl1 (col1_2, col1_3, col1_4) VALUES (3, 4, 5);
INSERT INTO tbl1 (col1_2, col1_3, col1_4) VALUES (4, 5, 6);
CREATE TABLE tbl2 (col2_1 INT(6) NOT NULL, col2_2 INT(6) NOT NULL);
INSERT INTO tbl2 (col2_1, col2_2) VALUES (2, 3);
CREATE TABLE tbl3 (
col1_1 INT(6) UNSIGNED AUTO_INCREMENT PRIMARY KEY,
col1_2 INT(6) NOT NULL,
col3_3 INT(6) NOT NULL);
INSERT INTO tbl3 (col1_2, col3_3) VALUES (2, 83);
INSERT INTO tbl3 (col1_2, col3_3) VALUES (3, 84);
INSERT INTO tbl3 (col1_2, col3_3) VALUES (4, 85);
set global column_stats_control = ON;
SELECT col1_2, col1_3 FROM (SELECT col1_2, col1_3, col1_4 FROM tbl1
WHERE col1_4 < 10 ) t WHERE col1_3 IN (2, 5, 6, 7);
col1_2	col1_3
4	5
SELECT col1_1, col1_2 FROM tbl1 WHERE col1_3 IN (SELECT col2_1 FROM tbl2 WHERE col2_2 <> 3);
col1_1	col1_2
UPDATE tbl1 SET col1_3 = 1 WHERE col1_2 IN (SELECT col2_2 FROM tbl2 WHERE col2_1 < 5);
DELETE FROM tbl1 WHERE col1_2 IN (SELECT col2_2 FROM tbl2 WHERE col2_1 < 5);
SELECT COUNT(DISTINCT SQL_ID) FROM information_schema.COLUMN_STATISTICS;
COUNT(DISTINCT SQL_ID)
4
SELECT SQL_ID, TABLE_SCHEMA, TABLE_NAME, COLUMN_NAME, SQL_OPERATION, OPERATOR_TYPE
FROM information_schema.COLUMN_STATISTICS;
SQL_ID	TABLE_SCHEMA	TABLE_NAME	COLUMN_NAME	SQL_OPERATION	OPERATOR_TYPE
3df64e0895810fb1d8dfc157ee14e123	cus_test	tbl1	col1_3	FILTER	SET_MEMBERSHIP
3df64e0895810fb1d8dfc157ee14e123	cus_test	tbl2	col2_2	FILTER	NOT_EQUAL
83da169ba169f7564fa2502c4f5c5f4c	cus_test	tbl2	col2_1	FILTER	LESS_THAN
83da169ba169f7564fa2502c4f5c5f4c	cus_test	tbl2	col2_2	FILTER	EQUAL
924de928e6d0a763b1ee391fd3ded1ef	cus_test	tbl1	col1_4	FILTER	LESS_THAN
cb8d70cecffd5b34892ade21759c6b19	cus_test	tbl2	col2_1	FILTER	LESS_THAN
cb8d70cecffd5b34892ade21759c6b19	cus_test	tbl2	col2_2	FILTER	EQUAL
set global column_stats_control = OFF_HARD;
DROP TABLE tbl1;
DROP TABLE tbl2;
DROP TABLE tbl3;
DROP DATABASE cus_test;
