set global debug='d,dump:i';
use test;
CREATE TABLE t1 (
a int not null auto_increment,
b int not null,
c int not null,
d varchar(100),
e varchar(200),
primary key (a, b, c),
key c_idx (c)
);
SELECT COUNT(*) INTO @numrows FROM t1;
SELECT @numrows;
@numrows
1024
DUMP TABLE t1 INTO 't1dump' ;
affected rows: 1024
info: dump table complete: 1024 rows, 8 chunks
CREATE TABLE t1load AS SELECT * FROM t1 LIMIT 0;
SELECT COUNT(*) FROM t1load;
COUNT(*)
1024
DROP TABLE t1load;
DUMP TABLE t1 INTO 't1dump' WITH ( CONSISTENT SNAPSHOT );
affected rows: 1024
info: dump table complete: 1024 rows, 8 chunks
CREATE TABLE t1load AS SELECT * FROM t1 LIMIT 0;
SELECT COUNT(*) FROM t1load;
COUNT(*)
1024
DROP TABLE t1load;
DUMP TABLE t1 INTO 't1dump' WITH ( CONSISTENT SNAPSHOT, THREADS = 1 );
affected rows: 1024
info: dump table complete: 1024 rows, 8 chunks
CREATE TABLE t1load AS SELECT * FROM t1 LIMIT 0;
SELECT COUNT(*) FROM t1load;
COUNT(*)
1024
DROP TABLE t1load;
DUMP TABLE t1 INTO 't1dump' WITH ( CONSISTENT SNAPSHOT, THREADS = 4 );
affected rows: 1024
info: dump table complete: 1024 rows, 8 chunks
CREATE TABLE t1load AS SELECT * FROM t1 LIMIT 0;
SELECT COUNT(*) FROM t1load;
COUNT(*)
1024
DROP TABLE t1load;
DUMP TABLE t1 INTO 't1dump' WITH ( CONSISTENT SNAPSHOT, THREADS = 2, CHUNK_SIZE = 7 ROWS );
affected rows: 1024
info: dump table complete: 1024 rows, 147 chunks
CREATE TABLE t1load AS SELECT * FROM t1 LIMIT 0;
SELECT COUNT(*) FROM t1load;
COUNT(*)
1024
DROP TABLE t1load;
TRUNCATE TABLE t1;
SELECT COUNT(*) INTO @numrows FROM t1;
SELECT @numrows;
@numrows
32
# connection 1
SET DEBUG_SYNC='dump_snapshot_created SIGNAL snapshot_created WAIT_FOR rows_mutated';
DUMP TABLE t1 INTO 't1dump' WITH (CONSISTENT SNAPSHOT, THREADS=4, CHUNK_SIZE = 7 ROWS);
# connection 2
SET DEBUG_SYNC='now WAIT_FOR snapshot_created';
UPDATE t1 SET e = 'eee' WHERE a BETWEEN 10 AND 30;
SET DEBUG_SYNC='now SIGNAL rows_mutated';
# connection 1
# connection default
SELECT * FROM t1;
a	b	c	d	e
1	1	2	aaa	bbb
2	1	2	aaa	bbb
3	1	2	aaa	bbb
4	1	2	aaa	bbb
5	1	2	aaa	bbb
6	1	2	aaa	bbb
7	1	2	aaa	bbb
8	1	2	aaa	bbb
9	1	2	aaa	bbb
10	1	2	aaa	eee
11	1	2	aaa	eee
12	1	2	aaa	eee
13	1	2	aaa	eee
14	1	2	aaa	eee
15	1	2	aaa	eee
16	1	2	aaa	eee
17	1	2	aaa	eee
18	1	2	aaa	eee
19	1	2	aaa	eee
20	1	2	aaa	eee
21	1	2	aaa	eee
22	1	2	aaa	eee
23	1	2	aaa	eee
24	1	2	aaa	eee
25	1	2	aaa	eee
26	1	2	aaa	eee
27	1	2	aaa	eee
28	1	2	aaa	eee
29	1	2	aaa	eee
30	1	2	aaa	eee
31	1	2	aaa	bbb
32	1	2	aaa	bbb
CREATE TABLE t1load AS SELECT * FROM t1 LIMIT 0;
SELECT * FROM t1load;
a	b	c	d	e
1	1	2	aaa	bbb
2	1	2	aaa	bbb
3	1	2	aaa	bbb
4	1	2	aaa	bbb
5	1	2	aaa	bbb
6	1	2	aaa	bbb
7	1	2	aaa	bbb
8	1	2	aaa	bbb
9	1	2	aaa	bbb
10	1	2	aaa	bbb
11	1	2	aaa	bbb
12	1	2	aaa	bbb
13	1	2	aaa	bbb
14	1	2	aaa	bbb
15	1	2	aaa	bbb
16	1	2	aaa	bbb
17	1	2	aaa	bbb
18	1	2	aaa	bbb
19	1	2	aaa	bbb
20	1	2	aaa	bbb
21	1	2	aaa	bbb
22	1	2	aaa	bbb
23	1	2	aaa	bbb
24	1	2	aaa	bbb
25	1	2	aaa	bbb
26	1	2	aaa	bbb
27	1	2	aaa	bbb
28	1	2	aaa	bbb
29	1	2	aaa	bbb
30	1	2	aaa	bbb
31	1	2	aaa	bbb
32	1	2	aaa	bbb
DROP TABLE t1load;
SET DEBUG_SYNC= "RESET";
DROP TABLE t1;
set global debug=default;
