include/master-slave.inc
Warnings:
Note	####	Sending passwords in plain text without SSL/TLS is extremely insecure.
Note	####	Storing MySQL user name or password information in the master info repository is not secure and is therefore not recommended. Please consider using the USER and PASSWORD connection options for START SLAVE; see the 'START SLAVE Syntax' in the MySQL Manual for more information.
[connection master]
drop table if exists t1, t2, t3, t4;
CREATE TABLE t1 (
a int not null,
doc document not null,
primary key (a),
key (doc)) engine=innodb;
ERROR HY000: DOCUMENT column 'doc' cannot be part of a key
CREATE TABLE t1 (
a int not null,
b char (10) not null,
doc document not null,
primary key (a),
key (doc.id as int),
key (doc.name as string)) engine=innodb;
ERROR 42000: You have an error in your SQL syntax; check the manual that corresponds to your MySQL server version for the right syntax to use near ')) engine=innodb' at line 7
CREATE TABLE t1 (
a int not null,
b char (10) not null,
doc document not null,
primary key (a),
key (doc.id as int),
key (doc.address as binary)) engine=innodb;
ERROR 42000: You have an error in your SQL syntax; check the manual that corresponds to your MySQL server version for the right syntax to use near ')) engine=innodb' at line 7
CREATE TABLE t1 (
a int not null,
b int,
c char (10),
doc document not null,
primary key (a),
UNIQUE key b_a (b, a),
UNIQUE key c_doc (c, doc.address.zipcode as int)
) engine=innodb;
SHOW CREATE TABLE t1;
Table	Create Table
t1	CREATE TABLE `t1` (
  `a` int(11) NOT NULL,
  `b` int(11) DEFAULT NULL,
  `c` char(10) DEFAULT NULL,
  `doc` document NOT NULL,
  PRIMARY KEY (`a`),
  UNIQUE KEY `b_a` (`b`,`a`),
  UNIQUE KEY `c_doc` (`c`,`doc`.`address`.`zipcode` AS INT)
) ENGINE=InnoDB DEFAULT CHARSET=latin1
SHOW INDEXES IN t1;
Table	Non_unique	Key_name	Seq_in_index	Column_name	Collation	Cardinality	Sub_part	Packed	Null	Index_type	Comment	Index_comment
t1	0	PRIMARY	1	a	A	-	NULL	NULL		BTREE		
t1	0	b_a	1	b	A	-	NULL	NULL	YES	BTREE		
t1	0	b_a	2	a	A	-	NULL	NULL		BTREE		
t1	0	c_doc	1	c	A	-	NULL	NULL	YES	BTREE		
t1	0	c_doc	2	doc	A	-	8	NULL		BTREE		
insert into t1 values (1,10,'@1','{ "id":101, "name":"Alex", "phone":6507770001, "address":{ "houseNumber":1001, "streetName":"1st", "zipcode":98761 }, "bool":"True", "a.b.c.":1 }');
insert into t1 values (2,20,'@2','{ "id":102, "name":"Bob", "phone":6507770002, "address":{ "houseNumber":1002, "streetName":"2nd", "zipcode":98762 }, "int64":2222222220123456789, "a.b.c.":2 }');
insert into t1 values (3,30,'@3','{ "id":103, "name":"Charlie", "phone":6507770003, "address":{ "houseNumber":1003, "streetName":"3rd", "zipcode":98763 }, "double":3.333333, "a.b.c.":3 }');
insert into t1 values (4,40,'@4','{ "id":104, "name":"Don", "phone":6507770004, "address":{ "houseNumber":1004, "streetName":"4th", "zipcode":98764 }, "Children":["Alex", "Bob", "Charlei"], "a.b.c.":4 }');
insert into t1 values (5,50,'@5','{ "id":105, "name":"Eddard", "phone":6507770005, "address":{ "houseNumber":1005, "streetName":"5th", "zipcode":98765 }, "Children":["Rob", "Sansa", "Arya"], "a.b.c.":5 }');
insert into t1 values (6,60,'@5','{ "id":105, "name":"Eddard", "phone":6507770005, "address":{ "houseNumber":1005, "streetName":"5th", "zipcode":98765 }, "Children":["Rob", "Sansa", "Arya"], "a.b.c.":5 }');
ERROR 23000: Duplicate entry '@5-98765' for key 'c_doc'
update t1 set doc='{ "id":105, "name":"Eddard", "phone":6507770005, "address":{ "houseNumber":1005, "streetName":"5th", "zipcode":98766 }, "Children":["Rob", "Sansa", "Arya"], "a.b.c.":5 }' where a = 5;
insert into t1 values (6,60,'@5','{ "id":105, "name":"Eddard", "phone":6507770005, "address":{ "houseNumber":1005, "streetName":"5th", "zipcode":98766 }, "Children":["Rob", "Sansa", "Arya"], "a.b.c.":5 }');
ERROR 23000: Duplicate entry '@5-98766' for key 'c_doc'
delete from t1 where a = 5;
SHOW INDEXES IN t1;
Table	Non_unique	Key_name	Seq_in_index	Column_name	Collation	Cardinality	Sub_part	Packed	Null	Index_type	Comment	Index_comment
t1	0	PRIMARY	1	a	A	-	NULL	NULL		BTREE		
t1	0	b_a	1	b	A	-	NULL	NULL	YES	BTREE		
t1	0	b_a	2	a	A	-	NULL	NULL		BTREE		
t1	0	c_doc	1	c	A	-	NULL	NULL	YES	BTREE		
t1	0	c_doc	2	doc	A	-	8	NULL		BTREE		
SELECT * FROM t1;
a	b	c	doc
1	10	@1	{"id":101,"name":"Alex","phone":6507770001,"address":{"houseNumber":1001,"streetName":"1st","zipcode":98761},"bool":"True","a.b.c.":1}
2	20	@2	{"id":102,"name":"Bob","phone":6507770002,"address":{"houseNumber":1002,"streetName":"2nd","zipcode":98762},"int64":2222222220123456789,"a.b.c.":2}
3	30	@3	{"id":103,"name":"Charlie","phone":6507770003,"address":{"houseNumber":1003,"streetName":"3rd","zipcode":98763},"double":3.333333,"a.b.c.":3}
4	40	@4	{"id":104,"name":"Don","phone":6507770004,"address":{"houseNumber":1004,"streetName":"4th","zipcode":98764},"Children":["Alex","Bob","Charlei"],"a.b.c.":4}
ALTER TABLE t1 DROP KEY b_a;
SHOW INDEXES IN t1;
Table	Non_unique	Key_name	Seq_in_index	Column_name	Collation	Cardinality	Sub_part	Packed	Null	Index_type	Comment	Index_comment
t1	0	PRIMARY	1	a	A	-	NULL	NULL		BTREE		
t1	0	c_doc	1	c	A	-	NULL	NULL	YES	BTREE		
t1	0	c_doc	2	doc	A	-	8	NULL		BTREE		
SELECT * FROM t1;
a	b	c	doc
1	10	@1	{"id":101,"name":"Alex","phone":6507770001,"address":{"houseNumber":1001,"streetName":"1st","zipcode":98761},"bool":"True","a.b.c.":1}
2	20	@2	{"id":102,"name":"Bob","phone":6507770002,"address":{"houseNumber":1002,"streetName":"2nd","zipcode":98762},"int64":2222222220123456789,"a.b.c.":2}
3	30	@3	{"id":103,"name":"Charlie","phone":6507770003,"address":{"houseNumber":1003,"streetName":"3rd","zipcode":98763},"double":3.333333,"a.b.c.":3}
4	40	@4	{"id":104,"name":"Don","phone":6507770004,"address":{"houseNumber":1004,"streetName":"4th","zipcode":98764},"Children":["Alex","Bob","Charlei"],"a.b.c.":4}
ALTER TABLE t1 DROP KEY c_doc;
SHOW INDEXES IN t1;
Table	Non_unique	Key_name	Seq_in_index	Column_name	Collation	Cardinality	Sub_part	Packed	Null	Index_type	Comment	Index_comment
t1	0	PRIMARY	1	a	A	-	NULL	NULL		BTREE		
SELECT * FROM t1;
a	b	c	doc
1	10	@1	{"id":101,"name":"Alex","phone":6507770001,"address":{"houseNumber":1001,"streetName":"1st","zipcode":98761},"bool":"True","a.b.c.":1}
2	20	@2	{"id":102,"name":"Bob","phone":6507770002,"address":{"houseNumber":1002,"streetName":"2nd","zipcode":98762},"int64":2222222220123456789,"a.b.c.":2}
3	30	@3	{"id":103,"name":"Charlie","phone":6507770003,"address":{"houseNumber":1003,"streetName":"3rd","zipcode":98763},"double":3.333333,"a.b.c.":3}
4	40	@4	{"id":104,"name":"Don","phone":6507770004,"address":{"houseNumber":1004,"streetName":"4th","zipcode":98764},"Children":["Alex","Bob","Charlei"],"a.b.c.":4}
CREATE TABLE t2 (
a int not null,
b char (10) not null,
doc document not null,
primary key (a),
key (doc.id as int),
UNIQUE key doc_double (doc.double as double),
key doc_bool (doc.bool as bool),
UNIQUE key doc_name (doc.name as string(64)),
key doc_name_100 (doc.name as string(100)),
UNIQUE key doc_address (doc.address as binary(64)),
key (doc.address as binary(100))) engine=innodb;
Warnings:
Note	1831	Duplicate index 'doc_address' defined on the table 'test.t2'. This is deprecated and will be disallowed in a future release.
Note	1831	Duplicate index 'doc_2' defined on the table 'test.t2'. This is deprecated and will be disallowed in a future release.
SHOW CREATE TABLE t2;
Table	Create Table
t2	CREATE TABLE `t2` (
  `a` int(11) NOT NULL,
  `b` char(10) NOT NULL,
  `doc` document NOT NULL,
  PRIMARY KEY (`a`),
  UNIQUE KEY `doc_double` (`doc`.`double` AS DOUBLE),
  UNIQUE KEY `doc_name` (`doc`.`name` AS STRING(64)),
  UNIQUE KEY `doc_address` (`doc`.`address` AS BINARY(64)),
  KEY `doc` (`doc`.`id` AS INT),
  KEY `doc_bool` (`doc`.`bool` AS BOOL),
  KEY `doc_name_100` (`doc`.`name` AS STRING(100)),
  KEY `doc_2` (`doc`.`address` AS BINARY(100))
) ENGINE=InnoDB DEFAULT CHARSET=latin1
SHOW INDEXES IN t2;
Table	Non_unique	Key_name	Seq_in_index	Column_name	Collation	Cardinality	Sub_part	Packed	Null	Index_type	Comment	Index_comment
t2	0	PRIMARY	1	a	A	-	NULL	NULL		BTREE		
t2	0	doc_double	1	doc	A	-	8	NULL		BTREE		
t2	0	doc_name	1	doc	A	-	64	NULL		BTREE		
t2	0	doc_address	1	doc	A	-	64	NULL		BTREE		
t2	1	doc	1	doc	A	-	8	NULL		BTREE		
t2	1	doc_bool	1	doc	A	-	1	NULL		BTREE		
t2	1	doc_name_100	1	doc	A	-	100	NULL		BTREE		
t2	1	doc_2	1	doc	A	-	100	NULL		BTREE		
insert into t2 values (1,'@1','{ "id":101, "name":"Alex", "phone":6507770001, "address":{ "houseNumber":1001, "streetName":"1st", "zipcode":98761 }, "bool":"True" }');
insert into t2 values (2,'@2','{ "id":102, "name":"Bob", "phone":6507770002, "address":{ "houseNumber":1002, "streetName":"2nd", "zipcode":98762 }, "int64":2222222220123456789 }');
insert into t2 values (3,'@3','{ "id":103, "name":"Charlie", "phone":6507770003, "address":{ "houseNumber":1003, "streetName":"3rd", "zipcode":98763 }, "double":3.333333 }');
insert into t2 values (4,'@4','{ "id":104, "name":"Don", "phone":6507770004, "address":{ "houseNumber":1004, "streetName":"4th", "zipcode":98764 }, "Children":["Alex", "Bob", "Charlei"] }');
insert into t2 values (5,'@5','{ "id":105, "name":"Eddard", "phone":6507770005, "address":{ "houseNumber":1005, "streetName":"5th", "zipcode":98765 }, "Children":["Rob", "Sansa", "Arya"], "a.b.c.":5 }');
insert into t2 values (6,'@6','{ "id":106, "name":"Charlie_106", "phone":6507770006, "address":{ "houseNumber":1006, "streetName":"6th", "zipcode":98766 }, "double":3.333333 }');
ERROR 23000: Duplicate entry '3.333333' for key 'doc_double'
insert into t2 values (6,'@6','{ "id":106, "name":"Eddard", "phone":6507770006, "address":{ "houseNumber":1006, "streetName":"6th", "zipcode":98766 }, "Children":["Rob", "Sansa", "Arya"], "a.b.c.":6 }');
ERROR 23000: Duplicate entry 'Eddard' for key 'doc_name'
insert into t2 values (6,'@6','{ "id":106, "name":"Ned", "phone":6507770006, "address":{ "houseNumber":1005, "streetName":"5th", "zipcode":98765 }, "Children":["Rob", "Sansa", "Arya"], "a.b.c.":6 }');
ERROR 23000: Duplicate entry '{"houseNumber":1005,"streetName":"5th","zipcode":98765}' for key 'doc_address'
update t2 set doc='{ "id":105, "name":"Ned", "phone":6507770005, "address":{ "houseNumber":1005, "streetName":"Winterfell", "zipcode":98766 }, "Children":["Rob", "Sansa", "Arya"], "a.b.c.":5 }' where a = 5;
insert into t2 values (6,'@6','{ "id":106, "name":"Ned Stark", "phone":6507770006, "address":{ "houseNumber":1005, "streetName":"Winterfell", "zipcode":98766 }, "Children":["Rob", "Sansa", "Arya"], "a.b.c.":6 }');
ERROR 23000: Duplicate entry '{"houseNumber":1005,"streetName":"Winterfell","zipcode":98766}' for key 'doc_address'
insert into t2 values(7,'@7','{ "double" : 123}');
insert into t2 values(8, '@8','{ "double" : 123.0}');
ERROR 23000: Duplicate entry '123' for key 'doc_double'
insert into t2 values(8,'@8','{ "name" : 123}');
insert into t2 values(9, '@9','{ "name" : "123"}');
ERROR 23000: Duplicate entry '123' for key 'doc_name'
insert into t2 values(9,'@9','{ "name" : 123.1231131232}');
insert into t2 values(10, '@10','{ "name" : "123.1231131232"}');
ERROR 23000: Duplicate entry '123.1231131232' for key 'doc_name'
delete from t2 where a = 5;
SHOW INDEXES IN t2;
Table	Non_unique	Key_name	Seq_in_index	Column_name	Collation	Cardinality	Sub_part	Packed	Null	Index_type	Comment	Index_comment
t2	0	PRIMARY	1	a	A	-	NULL	NULL		BTREE		
t2	0	doc_double	1	doc	A	-	8	NULL		BTREE		
t2	0	doc_name	1	doc	A	-	64	NULL		BTREE		
t2	0	doc_address	1	doc	A	-	64	NULL		BTREE		
t2	1	doc	1	doc	A	-	8	NULL		BTREE		
t2	1	doc_bool	1	doc	A	-	1	NULL		BTREE		
t2	1	doc_name_100	1	doc	A	-	100	NULL		BTREE		
t2	1	doc_2	1	doc	A	-	100	NULL		BTREE		
ALTER TABLE t2 DROP KEY doc_bool;
SHOW INDEXES IN t2;
Table	Non_unique	Key_name	Seq_in_index	Column_name	Collation	Cardinality	Sub_part	Packed	Null	Index_type	Comment	Index_comment
t2	0	PRIMARY	1	a	A	-	NULL	NULL		BTREE		
t2	0	doc_double	1	doc	A	-	8	NULL		BTREE		
t2	0	doc_name	1	doc	A	-	64	NULL		BTREE		
t2	0	doc_address	1	doc	A	-	64	NULL		BTREE		
t2	1	doc	1	doc	A	-	8	NULL		BTREE		
t2	1	doc_name_100	1	doc	A	-	100	NULL		BTREE		
t2	1	doc_2	1	doc	A	-	100	NULL		BTREE		
ALTER TABLE t2 DROP KEY doc_name_100;
SHOW INDEXES IN t2;
Table	Non_unique	Key_name	Seq_in_index	Column_name	Collation	Cardinality	Sub_part	Packed	Null	Index_type	Comment	Index_comment
t2	0	PRIMARY	1	a	A	-	NULL	NULL		BTREE		
t2	0	doc_double	1	doc	A	-	8	NULL		BTREE		
t2	0	doc_name	1	doc	A	-	64	NULL		BTREE		
t2	0	doc_address	1	doc	A	-	64	NULL		BTREE		
t2	1	doc	1	doc	A	-	8	NULL		BTREE		
t2	1	doc_2	1	doc	A	-	100	NULL		BTREE		
ALTER TABLE t2 DROP KEY doc_address;
SHOW INDEXES IN t2;
Table	Non_unique	Key_name	Seq_in_index	Column_name	Collation	Cardinality	Sub_part	Packed	Null	Index_type	Comment	Index_comment
t2	0	PRIMARY	1	a	A	-	NULL	NULL		BTREE		
t2	0	doc_double	1	doc	A	-	8	NULL		BTREE		
t2	0	doc_name	1	doc	A	-	64	NULL		BTREE		
t2	1	doc	1	doc	A	-	8	NULL		BTREE		
t2	1	doc_2	1	doc	A	-	100	NULL		BTREE		
CREATE TABLE t3 (
a int not null,
b int,
c char (10),
doc document not null,
primary key (a),
UNIQUE key b_a (b, a)
) engine=innodb;
SHOW CREATE TABLE t3;
Table	Create Table
t3	CREATE TABLE `t3` (
  `a` int(11) NOT NULL,
  `b` int(11) DEFAULT NULL,
  `c` char(10) DEFAULT NULL,
  `doc` document NOT NULL,
  PRIMARY KEY (`a`),
  UNIQUE KEY `b_a` (`b`,`a`)
) ENGINE=InnoDB DEFAULT CHARSET=latin1
SHOW INDEXES IN t3;
Table	Non_unique	Key_name	Seq_in_index	Column_name	Collation	Cardinality	Sub_part	Packed	Null	Index_type	Comment	Index_comment
t3	0	PRIMARY	1	a	A	-	NULL	NULL		BTREE		
t3	0	b_a	1	b	A	-	NULL	NULL	YES	BTREE		
t3	0	b_a	2	a	A	-	NULL	NULL		BTREE		
insert into t3 values (1,10,'@1','{ "id":101, "name":"Alex", "phone":6507770001, "address":{ "houseNumber":1001, "streetName":"1st", "zipcode":98761 }, "bool":"True", "a.b.c.":1 }');
insert into t3 values (2,20,'@2','{ "id":102, "name":"Bob", "phone":6507770002, "address":{ "houseNumber":1002, "streetName":"2nd", "zipcode":98762 }, "int64":2222222220123456789, "a.b.c.":2 }');
insert into t3 values (3,30,'@3','{ "id":103, "name":"Charlie", "phone":6507770003, "address":{ "houseNumber":1003, "streetName":"3rd", "zipcode":98763 }, "double":3.333333, "a.b.c.":3 }');
insert into t3 values (4,40,'@4','{ "id":104, "name":"Don", "phone":6507770004, "address":{ "houseNumber":1004, "streetName":"4th", "zipcode":98764 }, "Children":["Alex", "Bob", "Charlei"], "a.b.c.":4 }');
SELECT * FROM t3;
a	b	c	doc
1	10	@1	{"id":101,"name":"Alex","phone":6507770001,"address":{"houseNumber":1001,"streetName":"1st","zipcode":98761},"bool":"True","a.b.c.":1}
2	20	@2	{"id":102,"name":"Bob","phone":6507770002,"address":{"houseNumber":1002,"streetName":"2nd","zipcode":98762},"int64":2222222220123456789,"a.b.c.":2}
3	30	@3	{"id":103,"name":"Charlie","phone":6507770003,"address":{"houseNumber":1003,"streetName":"3rd","zipcode":98763},"double":3.333333,"a.b.c.":3}
4	40	@4	{"id":104,"name":"Don","phone":6507770004,"address":{"houseNumber":1004,"streetName":"4th","zipcode":98764},"Children":["Alex","Bob","Charlei"],"a.b.c.":4}
ALTER TABLE t3 ADD UNIQUE INDEX c_doc (c, doc.address.zipcode as int);
insert into t3 values (5,50,'@4','{ "id":104, "name":"Don", "phone":6507770004, "address":{ "houseNumber":1004, "streetName":"4th", "zipcode":98764 }, "Children":["Alex", "Bob", "Charlei"], "a.b.c.":4 }');
ERROR 23000: Duplicate entry '@4-98764' for key 'c_doc'
SHOW INDEXES IN t3;
Table	Non_unique	Key_name	Seq_in_index	Column_name	Collation	Cardinality	Sub_part	Packed	Null	Index_type	Comment	Index_comment
t3	0	PRIMARY	1	a	A	-	NULL	NULL		BTREE		
t3	0	b_a	1	b	A	-	NULL	NULL	YES	BTREE		
t3	0	b_a	2	a	A	-	NULL	NULL		BTREE		
t3	0	c_doc	1	c	A	-	NULL	NULL	YES	BTREE		
t3	0	c_doc	2	doc	A	-	8	NULL		BTREE		
SELECT * FROM t3;
a	b	c	doc
1	10	@1	{"id":101,"name":"Alex","phone":6507770001,"address":{"houseNumber":1001,"streetName":"1st","zipcode":98761},"bool":"True","a.b.c.":1}
2	20	@2	{"id":102,"name":"Bob","phone":6507770002,"address":{"houseNumber":1002,"streetName":"2nd","zipcode":98762},"int64":2222222220123456789,"a.b.c.":2}
3	30	@3	{"id":103,"name":"Charlie","phone":6507770003,"address":{"houseNumber":1003,"streetName":"3rd","zipcode":98763},"double":3.333333,"a.b.c.":3}
4	40	@4	{"id":104,"name":"Don","phone":6507770004,"address":{"houseNumber":1004,"streetName":"4th","zipcode":98764},"Children":["Alex","Bob","Charlei"],"a.b.c.":4}
ALTER TABLE t3 DROP KEY b_a;
SHOW INDEXES IN t3;
Table	Non_unique	Key_name	Seq_in_index	Column_name	Collation	Cardinality	Sub_part	Packed	Null	Index_type	Comment	Index_comment
t3	0	PRIMARY	1	a	A	-	NULL	NULL		BTREE		
t3	0	c_doc	1	c	A	-	NULL	NULL	YES	BTREE		
t3	0	c_doc	2	doc	A	-	8	NULL		BTREE		
ALTER TABLE t3 DROP KEY c_doc;
SHOW INDEXES IN t3;
Table	Non_unique	Key_name	Seq_in_index	Column_name	Collation	Cardinality	Sub_part	Packed	Null	Index_type	Comment	Index_comment
t3	0	PRIMARY	1	a	A	-	NULL	NULL		BTREE		
SELECT * FROM t3;
a	b	c	doc
1	10	@1	{"id":101,"name":"Alex","phone":6507770001,"address":{"houseNumber":1001,"streetName":"1st","zipcode":98761},"bool":"True","a.b.c.":1}
2	20	@2	{"id":102,"name":"Bob","phone":6507770002,"address":{"houseNumber":1002,"streetName":"2nd","zipcode":98762},"int64":2222222220123456789,"a.b.c.":2}
3	30	@3	{"id":103,"name":"Charlie","phone":6507770003,"address":{"houseNumber":1003,"streetName":"3rd","zipcode":98763},"double":3.333333,"a.b.c.":3}
4	40	@4	{"id":104,"name":"Don","phone":6507770004,"address":{"houseNumber":1004,"streetName":"4th","zipcode":98764},"Children":["Alex","Bob","Charlei"],"a.b.c.":4}
CREATE TABLE t4 (
a int not null,
b char (10) not null,
doc document not null,
primary key (a),
key id_a_double_b_bool (doc.id as int, a, doc.double as double, b, doc.bool as bool),
key a_name_b_name100_address_a_address100_b (a, doc.name as string(64), b, doc.name as string(100), doc.address as binary(64), a, doc.address as binary(100), b)) engine=innodb;
ERROR 42S21: Duplicate column name 'doc'
drop table t1, t2, t3;
include/rpl_end.inc
